headlines,date
Media Alert: Adobe Survey Reveals Americans’ Dependence on Email,10-03-16
"Box announces Adobe, Splunk integrations",10-03-19
Shareholder Rosensweig 2012 Irrev Child Trust 11/6/12 Files To Sell $1.4M of ADBE on 9/26/16,10-04-16
Affiliated Person Warnock Family Trust 8/27/12 Files To Sell $534.9K of ADBE on 9/27/16,10-04-16
Adobe Drives Creative Innovation Forward at MAX 2015,10-05-15
Content Creators Face Mounting Pressure in Era of ‘Third Screen’,10-05-15
Accenture Unit Forms Digital Marketing Solutions Partnership with Adobe,10-05-16
"Application Software Stocks Technical Reports -- Adobe Systems, LINE, Endurance Intl., and Zendesk",10-06-16
Adobe Provides Three-year Growth Strategy and Financial Targets,10-06-15
"--Adobe Systems Sees FY 2016 Revenue at $5.7 Bln, vs. Street Est. of $5.92 Bln; EPS Seen at $2.70, vs. Street Est. of $3.21",10-06-15
"Adobe Systems Sees FY16 Below Street View, Targets 20% Sales and 30% Non-GAAP EPS CAGRs for FY15-FY18",10-06-15
Adobe provides below-consensus FY16 guidance; shares -8.4%,10-06-15
After Hours Gainers / Losers,10-06-15
Nick Offerman Hosts Sneaks Event at Adobe MAX in Los Angeles,10-07-15
"Analyst Actions: Adobe Systems Price Target Raised To $87 At FBR Capital, Reiterated Market Perform",10-07-15
Stocks Futures Set to Open Higher on Oil Market Gains,10-07-15
"S&P 500 Movers: Yum! Brands Tumbles 19%, Leads Losers; Freeport-McMoRan Up 8%",10-07-15
Alphabet's Google Announces Open Source Initiative to Improve Performance of Mobile Web,10-07-15
Sector Update: Tech,10-07-15
"Analyst Actions: Adobe Systems Price Target Raised to $90 At Deutsche Bank, Reiterated Buy",10-07-15
"Sector Update: Tech Stocks Struggle With Weaker Apple, Alphabet; Adobe Falls as FY16 Outlook Trails Views",10-07-15
Analysts defend Adobe's guidance; shares close down 5.3%,10-07-15
Jefferies boosts Microsoft in cautious software look,10-07-19
Adobe Accelerates Experience-Driven Commerce With Major Advancements To Magento Commerce Cloud,10-09-18
Invesco S&P 500 Quality ETF (SPHQ) September Summary,10-09-18
Chairman of the Board WARNOCK JOHN E Sells $4.0M of ADBE on 10/8/15,10-09-15
Adobe Systems' Chief Accounting Officer To Retire in January 2017,10-10-16
Adobe Announces Webcast of Financial Analyst Meeting at Adobe MAX,10-11-18
Vice President Dillon Michael A Sells $1.5M of ADBE on 10/10/16,10-11-16
Vice President Morris Donna Sells $1.1M of ADBE on 10/10/16,10-11-16
Adobe Announces Webcast of Financial Analyst Briefing at Adobe MAX,10-12-17
Media Alert: Adobe Advertising Cloud Brings Marketers Flexibility and Convenience with New Mobile App,10-12-17
Media Alert: Adobe Advertising Cloud First Media Buying Platform to Give Advertisers Full Supply Side Transparency,10-12-17
"Analyst Actions: RBC Reaffirms Adobe Systems at Outperform Ahead of Investor Day, PT $288 - Stock Rises 3%",10-12-18
Adobe Redefines the Way the World Signs with New e-Sign Capabilities in Document Cloud,10-13-15
Adobe and Dropbox Partner to Streamline Work with Documents,10-13-15
Adobe Named a Leader in Gartner 2017 Magic Quadrant for Digital Marketing Analytics,10-13-17
"Fundamental Equity Analysis – Consolidated Research on Johnson & Johnson, Home Depot, Adobe, Disney, AbbVie, and eBay – Developing Opportunities, Future Expectations, and Projections",10-13-17
Chairman of the Board Geschke Charles M Exer. Acquires $1.7M of ADBE on 10/12/15-10/13/15,10-13-15
Vice President Dillon Michael A Files To Sell $1.5M of ADBE on 10/10/16,10-13-16
"Analyst Actions: Adobe Systems Upgraded To Overweight at Atlantic Equities, $97 Price Target Maintained",10-14-15
MT Newswires' Analyst Notebook: ADBE,10-14-15
Adobe MAX conference starts today,10-15-18
Adobe Announces Next Generation of Creative Cloud at MAX 2018,10-15-18
Analyst Actions: Cleveland Research Starts Adobe Systems at Neutral With $283 Price Target,10-15-19
Adobe Outlines Growth Strategy at Adobe MAX,10-15-18
"--Adobe Reaffirms Q4 Revenue and EPS Targets, Sees FY 2019 Revenue Growth of 20% Year-Over-Year",10-15-18
"--Adobe on Track to Achieve Q4 Revenue of $2.42 Bln, vs. Street Est. of $2.42 Bln; EPS Seen at $1.87, vs. Street Est. of $1.89",10-15-18
"Adobe Systems On Track to Meets Targets, Sets 2019 Revenue Guidance - Stock Up 4% After-Hours",10-15-18
"Adobe reaffirms Q4 guidance, FY19 growth targets",10-15-18
After Hours Gainers / Losers (10/15/2018),10-15-18
MT Newswires' After-Hours Trading Range Analysis: ADBE,10-15-18
Forecast Report: ADBE,10-15-18
MT Newswires After-Hours News Movers,10-15-18
"Analyst Actions: Citigroup Cuts Adobe Systems to Neutral From Buy, Price Target to $313 From $322",10-16-19
Deutsche Bank downgrades Adobe on channel checks,10-16-17
Adobe -2.7% as Citi hits sidelines,10-16-19
Analyst Actions: Deutsche Bank Downgrades Adobe Systems to Hold vs Buy,10-16-17
Sector Update: Tech,10-16-18
Sector Update: Tech Stocks Advancing In Early Tuesday Trading,10-16-18
"Stocks Futures Indicate Record Highs at Open as Manufacturing Index Surprises, Oil Snaps Higher",10-16-17
Premarket Gainers as of 9:05 am (10/16/2018),10-16-18
"S&P 500 Movers: McKesson Soars 6%, Leads Gainers; Progressive, Salesforce Drop 4%",10-16-19
"S&P 500 Movers: W. W. Grainger Sinks 12%, Leads Losers; Adobe Jumps 8%",10-16-18
"Analyst Actions: Barclays Lifts Adobe Systems' Price Target to $304 From $297, Reiterates Overweight Rating",10-16-18
Adobe urges users patch Flash after malware attack; shares -,10-16-17
Sector Update: Tech Stocks Help Lead Tuesday Market Rally,10-16-18
"Analyst Actions: Oppenheimer Sees Marketo Overhang on Adobe Systems, Keeps at Perform, No PT - Stock Jumps 8%",10-16-18
"Analyst Actions: RBC Focuses on Adobe Earnings Power, Keeps at Outperform, PT $288 - Stock Jumps 9%",10-16-18
MT Newswires' Analyst Notebook: ADBE,10-16-19
MT Newswires' Analyst Notebook: ADBE,10-16-17
"Close Update: US Stocks Close Lower on Dismal Retail Sales, US-China Trade Worries Eclipse Upbeat Earnings",10-16-19
Close Update: Stocks Rally as Solid Earnings Reports Help Boost Markets,10-16-18
"Stocks End Higher on Upbeat Earnings, Brexit Deal",10-17-19
Adobe Unveils the Next Generation of Creative Cloud at MAX 2017,10-18-17
Adobe Introduces New Lightroom CC Cloud Photography Service,10-18-17
Adobe Named a Leader in Gartner 2016 Magic Quadrant for Digital Marketing Analytics,10-18-16
Adobe Outlines Growth Strategy at Adobe MAX,10-18-17
Adobe Systems Sees 2018 Revenue and Earnings Above Street Expectations - up 6% After-Hours,10-18-17
After Hours Gainers / Losers,10-18-17
MT Newswires After-Hours News Movers,10-18-17
"MT Newswires' After Hours Watch List: LLNW, ADBE, EBAY",10-18-17
WSJ gets hands on list of Salesforce M&A targets,10-18-16
Affiliated Person Morris Family Revocable Trust Files To Sell $1.1M of ADBE on 10/10/16,10-18-16
"Analyst Actions: Adobe Systems Upgraded to Hold From Sell by Pivotal, Price Target Raised to $160 From $118",10-19-17
"Analyst Actions: Adobe Systems' Price Target From RBC Raised to $177 From $157, Outperform Maintained",10-19-17
Wedbush out positive on Adobe but starts Neutral,10-19-18
Premarket Gainers as of 9:05 am,10-19-17
Analysts up Adobe price targets after analyst day; shares +9.4%,10-19-17
"Market Chatter: Tableau Software, Others Jump After Leaked Colin Powell Emails Disclose Potential M&A Targets for Salesforce.com",10-19-16
Analyst Actions: BMO Capital Lifts Adobe Systems PT to $187 from $165; Maintains Outperform Rating,10-19-17
"Analyst Actions: Canaccord Raises Adobe Systems PT to $185 vs $170, Reiterates Buy Rating; Shares Hit Record",10-19-17
"S&P 500 Movers: Adobe Systems Jumps 11%, Leads Gainers; United Continental Tumbles 10%",10-19-17
NetApp Names Bill Miller as Chief Information Officer; Partners with DarkMatter For Data Storage & Analytics,10-19-16
"Analyst Actions: Wedbush Starts Adobe Systems at Neutral, With $270 Price Target",10-19-18
Technology - Top Gainers / Losers as of 2:55 pm,10-19-17
"Update: Market Chatter: Pegasystems, Tableau Software and Others Jump After Leaked Colin Powell Emails Disclose Potential M&A Targets for Salesforce.com",10-19-16
"Analyst Actions: Wedbush Starts DocuSign at Neutral, Price Target $45 - Stock Slumps 9%",10-19-18
Vice President Wadhwani David Files To Sell $2.3M of ADBE on 10/14/15,10-19-15
Shareholder Geschke Family Trust Files To Sell $3.1M of ADBE on 10/12/15,10-20-15
Adobe cut on Experience Cloud concerns,10-21-19
"Analyst Actions: BMO Capital Cuts Adobe Systems' Price Target to $300 From $310, Keeps Outperform Rating",10-21-19
Adobe Illustrator coming to the iPad - Bloomberg,10-21-19
Adobe to Launch Graphics Editor App Illustrator on Apple's iPad in 2020,10-22-19
"Report: Exploring Fundamental Drivers Behind Adobe, Allergan plc, Netflix, Wyndham Worldwide, Genuine Parts, and Analog Devices — New Horizons, Emerging Trends, and Upcoming Developments",10-22-18
Adobe Achieves Global Gender Pay Parity,10-22-18
"Thinking about trading options or stock in Adobe, TD Ameritrade, American Express, CSX, or Lowe's?",10-22-19
"Stock Performance Review on Application Software Industry -- Adobe Systems, Alarm.Com, Ansys, and Cadence Design Systems",10-23-17
Adobe Extends Digital Experience Product Portfolio to Serve Mid-Market and SMB Business Needs,10-23-19
Director Sedgewick Robert Exercises & Sells $1.4M of ADBE on 10/23/15,10-23-15
Vice President Rencher Bradley Exercises & Sells $2.3M of ADBE on 10/22/15,10-23-15
Affiliated Person Warnock Family Trust 8/27/12 Files To Sell $4.0M of ADBE on 10/8/15,10-23-15
Director Daley James E Files To Sell $1.5M of ADBE on 10/22/15,10-23-15
"Tech lunch break: TI, STM warnings shake semis",10-24-18
Adobe Named the Leader in Digital Experience Platforms by Independent Research Firm,10-26-15
New Adobe Study Shows Gen Z Students and Teachers See Creativity as Key to Success,10-26-16
World’s Top Creators Headline Adobe MAX,10-26-16
Vice President Rencher Bradley Files To Sell $2.3M of ADBE on 10/22/15,10-26-15
Adobe Predicts Record $91 Billion in Sales This Holiday Season,10-27-16
Adobe Data Shows Retailers Fail to Maximize Mobile Revenue,10-27-16
Adobe Sees Record Sales This Holiday Season; Says Average Order Value on Smartphones Lower Than Desktops,10-27-16
Adobe Announces Webcast of Financial Analyst Meeting at Adobe MAX,10-27-16
Vice President Morris Donna Sells $1.4M of ADBE on 10/26/15,10-27-15
Adobe Says Customer Data Exposed in Glitch,10-28-19
"Analyst Actions: Barclays Cuts Price Target on Adobe to $325 From $330, Maintains Overweight",10-28-19
Adobe Data Shows 76 Percent of Online Holiday Sales Will be Spent on 1 Percent of Product SKUs,10-29-15
Adobe Announces Webcast of Financial Analyst Meeting at Adobe MAX,10-30-19
Stocks Close Higher on Third Straight Fed Rate Cut,10-30-19
What to watch at Adobe analyst event - RBC,10-31-19
Adobe Completes Acquisition of Marketo,10-31-18
Adobe Forecasts $124 Billion in U.S. Online Sales This Holiday Season,11-01-18
Creativity Pays: Global Survey From Adobe Links Being Creative to Stronger Personal and Professional Success,11-01-16
Adobe: US online holiday sales will top $124B,11-01-18
Adobe Sees Record-Breaking Online Holiday Sales for 2018 With 15% Shopping Surge,11-01-18
Adobe Systems Sees US Holiday Season Online Sales Up 14.8% To $124.1 Bln vs Yr Ago,11-01-18
Adobe Forecasts U.S. Online Sales to Surpass $100 Billion This Holiday Season,11-02-17
Adobe Predicts US Online Sales Will Exceed $100 Bln During Holiday Season,11-02-17
Adobe Charts Future of Creativity and Design at Adobe MAX 2016,11-02-16
Adobe Sensei Lets Customers Master the Art of Digital Experiences,11-02-16
Reuters partners with Adobe to bring its renowned photo and video library to Adobe Stock,11-02-16
Adobe Outlines Growth Opportunities,11-02-16
Director Sedgewick Robert Files To Sell $1.4M of ADBE on 10/23/15,11-02-15
"--Analyst Actions: Wunderlich Raises Adobe Systems PT to $115 vs $99, Reiterates Hold Rating",11-03-16
Media Alert: Adobe Advances Strategic Partnership With Microsoft Around CRM and Content Management,11-03-17
Investor Advisory: Adobe Announces Webcasts of Investor Conference Participation,11-03-15
Chief Executive Officer Narayen Shantanu Exercises & Sells $2.0M of ADBE on 11/2/15,11-03-15
Shareholder Morris Family Trust Files To Sell $1.4M of ADBE on 10/26/15,11-03-15
Adobe MAX 2019: Empowering Creativity for All,11-04-19
"HP, Adobe collab on digital 3D project",11-04-19
"Adobe, The New York Times Company and Twitter Announce Content Authenticity Initiative to Develop Industry Standard for Content Attribution",11-04-19
"Adobe Leadership in Creativity, Digital Documents and Customer Experience Management Categories Drives Next Era of Growth",11-04-19
Adobe Reaffirms Q4 Non-GAAP EPS Guidance of $2.25,11-05-19
Adobe +4.5% as analysts praise optimistic guidance,11-05-19
"--Analyst Actions: RBC Boosts Price Target on Adobe Systems to $345 From $315, Maintains Outperform Rating",11-05-19
Sector Update: Most Tech Heavyweights Trade Higher Pre-Market Tuesday,11-05-19
"ADBE, NIO among premarket gainers",11-05-19
"Analyst Actions: Citigroup Raises Adobe Systems' Price Target to $321 From $313, Maintains Neutral Rating",11-05-19
"Analyst Actions: Barclays Lifts Adobe Systems' Price Target to $330 From $325, Maintains Overweight Rating",11-05-19
"Analyst Actions: Wells Fargo Lifts Adobe Systems' Price Target to $285 From $275, Maintains Market Perform Rating",11-05-19
"--Analyst Actions: JP Morgan Raises Adobe Systems' Price Target to $322 From $318, Maintains Neutral Rating",11-05-19
"Analyst Actions: Cowen Raises Adobe Systems' Price Target to $295 From $285, Maintains Market Perform Rating",11-05-19
Investor Advisory: Adobe Announces Webcast of Investor Conference Participation,11-05-18
--Analyst Actions: Jefferies Raises Price Target for Buy-Rated Adobe Systems to $350 From $340,11-05-19
Adobe buying comScore's audience analytics software business,11-05-15
Adobe Named a Leader Among Web Analytics Vendors by Independent Research Firm,11-07-17
Invesco S&P 500 Quality ETF (SPHQ) October Summary,11-08-18
Investor Advisory: Adobe Announces Webcasts of Investor Conference Participation,11-09-17
Media Alert: Adobe Launches New Data Marketplace,11-10-15
Adobe to Acquire TubeMogul,11-10-16
Adobe buying TubeMogul for about $540M,11-10-16
TubeMogul +82% on news of $540M buyout from Adobe,11-10-16
Stock Move: TubeMogul Shares Surge 82% as Adobe Buys Company for $540 Mln,11-10-16
Adobe Systems to Buy TubeMogul For $540 Million to Make Advertising 'One-Stop Shop',11-10-16
"Midday Update: Post-Election Rally Stumbles, Nasdaq Capitulates to Tech Sector Weakness",11-10-16
Investor Advisory: Adobe Announces Webcast of Investor Conference Participation,11-10-16
Sector Update: Tech Stocks Mostly in Deep Hole,11-10-16
Dow Rallies to Record High on Financials' Strength While Apple Bites Nasdaq in US Intraday,11-10-16
Adobe Named a Leader in Data Management Platforms by Independent Research Firm,11-10-15
Stocks to watch next week,11-11-17
"ADBE, CRM gain bull on sector trends",11-13-19
Adobe Launches Industry’s First 100 Percent Programmatic Ad Campaign,11-13-17
Analyst Actions: Piper Jaffray Stars Coverage on Adobe Systems at Overweight,11-13-19
"Appaloosa adds Alibaba, increases Micron",11-15-19
"Lone Pine sheds Microsoft and Adobe stake, while increases in Alibaba, Salesforce and Amazon",11-15-19
Nomura starts Adobe at Buy,11-16-18
"Analyst Actions: Nomura Starts Adobe Systems at Buy, With $315 Price Target",11-16-18
"S&P 500 Movers: Adobe Slumps 8%, Leads Losers; Twenty-First Century Fox Adds 3%",11-19-18
Adobe Named a Leader in Lead-to-Revenue Management Platform Vendors by Independent Research Firm,11-21-16
"Adobe Systems to Offer New Features to iPad Photoshop App in 2019, H120",11-21-19
Analyst Actions: KeyBanc Capital Boosts Price Target for Adobe Systems to $216; Reiterates Overweight Rating,11-22-17
"Retailers' Thanksgiving Online Sales Revenue Reaches $1.52 Bln, up 17% YoY, Adobe Says",11-24-17
Media Alert: Adobe Data Shows 46 Percent of Retail Traffic Driven by Mobile,11-25-15
"Consumers Spend $27 Bln Online So Far in November, Up 8.5% Over Last Year; Mobile Accounts for 24% of Sales",11-25-15
WPP Will Combine Wunderman Segment With J. Walter Thompson to Create New Agency,11-26-18
WPP Will Combine Wunderman Segment With J. Walter Thompson to Create New Agency,11-26-18
Media Alert: Adobe Data Shows Black Friday Breaks Online Sales Record With $3.34 Billion,11-26-16
Adobe Analytics Data Shows Cyber Monday Broke Online Sales Record with $7.9 Billion,11-26-18
Adobe Analytics Data Shows Cyber Monday Broke Online Sales Record with $7.9 Billion,11-26-18
"Pivotal Research Trims Estimate for 2017 US Advertising Growth to 4.1% From $4.4% Amid TV, Digital Challenges",11-27-17
"Option-trading opportunities on Adobe Systems, Alibaba, Micron, Netflix, and Tesla Motors",11-27-18
"Option-trading opportunities on Adobe Systems, Alibaba, Micron, Netflix, and Tesla Motors",11-27-18
"Online Holiday Purchases Hit $50 Billion Ahead of Thanksgiving, Bolstering Holiday Shopping Season, Says Adobe",11-27-19
"Adobe Data Shows Top Sellers on Black Friday: Samsung TVs, iPad Air 2, Microsoft XBox, Lego Star Wars, Shopkin Dolls",11-27-15
Adobe Data Shows Cyber Monday Is Largest Online Sales Day in History with $6.59 Billion,11-27-17
Pivotal Research Group Cuts 2017 Ad-Growth View to 2.0% in Deceleration from 2016's Expected 5% Growth,11-28-16
Cyber Monday Sets Online Sales Record as Shopping From Mobile Phones Surges,11-28-17
"New Research: Key Drivers of Growth for Southwestern Energy, Walgreens Boots Alliance, Adobe, Overstock, AmTrust Financial Services, and Automatic Data Processing — Factors of Influence, Major Initiatives and Sustained Production",11-28-17
Adobe Systems Data Shows Record Black Friday Sales,11-28-16
Repeat: Adobe Systems Data Shows Record Black Friday Sales,11-28-16
Sector Update: Tech,11-28-16
Sector Update: Technology Stocks Mainly Lower in Early Trade,11-28-16
Cloud stocks gain on Salesforce earnings,11-28-18
Cloud stocks gain on Salesforce earnings,11-28-18
"S&P 500 Movers: Tiffany Tumbles 12%, Leads Losers; Salesforce.com Adds 7%",11-28-18
"S&P 500 Movers: Tiffany Tumbles 12%, Leads Losers; Salesforce.com Adds 7%",11-28-18
Media Alert: Adobe Data Shows Cyber Monday Largest Online Sales Day in History With $3.39 Billion,11-28-16
"Cyber Monday Set To Break Record With $3.39 Billion In Sales, Adobe Systems Says",11-29-16
Adobe Digital Index Data Shows Cyber Monday Sales Up 14% So Far,11-30-15
Adobe Data Shows Cyber Monday Largest Online Sales Day in History with $3 Billion,11-30-15
SHAREHOLDER ALERT: Monteverde & Associates PC Announces an Investigation of The Board of Directors of TubeMogul - TUBE,12-01-16
Adobe Digital Index Says Cyber Monday Sales Rose 16% to $3.07 Bln,12-01-15
DOCU target raised before 'solid' Q3 report,12-02-19
Chief Executive Officer Narayen Shantanu Exercises & Sells $2.1M of ADBE on 12/1/15,12-02-15
OPTIONS: Straddle Prices for Companies Reporting Financial Results the Week of December 7,12-04-15
"Application Software Stocks Under Scanner -- Mobileye, Nuance Communications, Adobe Systems, and Splunk",12-05-16
Adobe to Webcast Q4 and FY2019 Earnings Conference Call,12-05-19
"S&P 500 Movers: Davita Jumps 11%, Leads Gainers; Patterson Companies Slumps 5%",12-06-17
"Adobe Names Scott Belsky as Chief Product Officer and EVP, Creative Cloud",12-06-17
Media Alert: Adobe Achieves Pay Parity in U.S.,12-07-17
Adobe to Webcast Q4 and FY2015 Earnings Conference Call,12-07-15
OPTIONS: Straddle Prices for Companies Expected to Report Results This Week,12-08-17
OPTIONS: Straddle Prices for Companies Reporting Financial Results this Week,12-08-15
Adobe rallies ahead of earnings following bullish Pac Crest/Deutsche notes,12-08-15
"Analyst Actions: Adobe Systems Adds More Than 2%, Deutsche Bank Raises Price Goal to $110",12-08-15
OPTIONS: Straddle Prices for Companies Reporting Financial Results this Week,12-09-15
Facebook sells Oculus Medium to Adobe - TechCrunch,12-09-19
Stocks to watch next week,12-09-17
"Analyst Actions: Morgan Stanley Lifts Adobe Systems' Price Target to $410 From $340, Reiterates Overweight Rating",12-09-19
"Covered Call Alerts For Chesapeake Energy, Nike, Juno Therapeutics Inc, LinkedIn and Adobe Systems Released By InvestorsObserver",12-09-15
Facebook Sells Virtual Reality Sculpting Tool Oculus Medium to Adobe,12-09-19
Notable earnings after Thursday’s close,12-09-15
"Accenture and Adobe Expand Alliance to Advance Digital Transformation for Life Science, Healthcare, and Financial Services Organizations",12-10-15
"Accenture, Adobe to Co-Create Digital Marketing Solutions",12-10-15
GoPro up 3.7% after FBR speculates Apple could buy company,12-10-15
"Analyst Actions: Citigroup Cuts Adobe Systems' Price Target to $300 From $309, Reiterates Buy Rating",12-10-18
"Analyst Actions: Citigroup Cuts Adobe Systems' Price Target to $300 From $309, Reiterates Buy Rating",12-10-18
Adobe to Webcast Q4 and FY2018 Earnings Conference Call,12-10-18
Adobe to Webcast Q4 and FY2018 Earnings Conference Call,12-10-18
"Earnings Reaction History: Adobe Systems Inc., 40.0% Follow-Through Indicator, 12.2% Sensitive",12-10-15
Adobe Systems Tends to Support Long Trade off Post-Market Earnings Moves,12-10-15
Adobe Reports Record Quarterly and Annual Revenue,12-10-15
"Adobe Systems beats by $0.02, revenue in-line",12-10-15
Adobe Tops Q4 Expectations - Shares Firming 3.5% in After-Hours Trading,12-10-15
"ADBE, Q4, Operating Metrics Released",12-10-15
"Adobe up 5% after FQ4 EPS beat, Digital Media ARR guidance hike",12-10-15
After Hours Gainers / Losers,12-10-15
MT Newswires After-Hours News Movers,12-10-15
Forecast Report: ADBE,12-10-15
MT Newswires' After-Hours Trading Range Analysis: ADBE,12-10-15
Shareholder Narayen Family Trust Files To Sell $2.1M of ADBE on 12/1/15,12-10-15
OPTIONS: Straddle Prices for Companies Expected to Report Results This Week,12-11-17
Premarket Gainers / Losers as of 9:10 am,12-11-15
"Analyst Actions: Adobe Systems Hits New High - PT Raised to $104 at Pivotal Research, Buy Rating Reaffirmed",12-11-15
"Analyst Actions: BMO Capital Lifts Adobe Systems' Price Target to $350 From $300, Keeps Outperform Rating",12-11-19
Analyst Actions: Adobe Systems PT Lifted to $105 at UBS,12-11-15
"Analyst Actions: Adobe Systems Price Target Raised to $112 at RBC Capital, Outperform Rating Reiterated",12-11-15
"Analyst Actions: Adobe Systems Price Target Raised to $110 at Pacific Crest, Overweight Rating Maintained",12-11-15
Invesco S&P 500 Quality ETF (SPHQ) November Summary,12-11-18
Invesco S&P 500 Quality ETF (SPHQ) November Summary,12-11-18
Adobe to Webcast Q4 and FY2017 Earnings Conference Call,12-11-17
"Adobe Systems Results Seen as 'Bellwether' for Software Industry, Investor Reaction to Q4 to Dictate Which Stocks Will Perform",12-11-19
"Update: Adobe Systems Results Seen as 'Bellwether' for Software Industry, Investor Reaction to Q4 to Dictate Which Stocks Will Perform",12-11-19
"Facebook, Google Rankings Fall on Glassdoor's List of Best Places to Work",12-11-19
Sector Update: Tech,12-11-15
Sector Update: Tech Stocks in Deep Hole Near Close; Price Targets Increase for Adobe Systems After Q4 Results,12-11-15
"Adobe Systems beats by $0.06, beats on revenue",12-11-14
Adobe buying photo marketplace Fotolia for $800M,12-11-14
More on Adobe: Creative Cloud subs top 3.4M,12-11-14
Notable earnings after Thursday's close,12-11-19
Adobe Systems Q4 2019 Earnings Preview,12-11-19
After Hour Gainers / Losers,12-11-14
"Last tech earnings: Adobe, Broadcom, Oracle",12-12-19
OPTIONS: Straddle Prices for Companies Expected to Report Results This Week,12-12-17
OPTIONS: Straddle Prices for Stocks Expected to Report Quarterly Results This Week,12-12-19
OPTIONS: Straddle Prices for Stocks Expected to Report Results This Week,12-12-18
OPTIONS: Straddle Prices for Stocks Expected to Report Results This Week,12-12-18
Analyst Actions: JP Morgan Downgrades Adobe Systems to Neutral From Overweight,12-12-17
JPMorgan downgrades Imperva and Adobe,12-12-17
MT Newswires' Opening Bell Momentum Stocks: ADBE,12-12-17
Premarket Gainers / Losers,12-12-14
"Facebook Could Have 2019 Management Shakeup While Netflix Set for More Growth, Pivotal Says",12-12-18
"Facebook Could Have 2019 Management Shakeup While Netflix Set for More Growth, Pivotal Says",12-12-18
Adobe to Webcast Q4 and FY2016 Earnings Conference Call,12-12-16
Adobe Surpasses $11 Billion in Annual Revenue,12-12-19
"Adobe Systems EPS beats by $0.03, beats on revenue",12-12-19
Adobe +3.3% after Q4 beats,12-12-19
"Adobe Fiscal Q4 Results Top Street Expectations, Shares Higher After Hours",12-12-19
Adobe closes up 9%; analysts rush to hike targets,12-12-14
Adobe Systems Q4 2018 Earnings Preview,12-12-18
Notable earnings after Thursday’s close,12-12-18
Adobe Systems Q4 2018 Earnings Preview,12-12-18
Notable earnings after Thursday’s close,12-12-18
MT Newswires After-Hours News Movers,12-12-19
Adobe Fourth-Quarter Results Beat Expectations as Subscription Revenue Advances on Rising User Growth,12-13-19
OPTIONS: Straddle Prices for Stocks Expected to Report Results This Week,12-13-18
OPTIONS: Straddle Prices for Stocks Expected to Report Results This Week,12-13-18
"--Analyst Actions: Wedbush Boosts Price Target on Adobe Systems to $315 From $290, Maintains Neutral Rating",12-13-19
Sector Update: Tech,12-13-19
Sector Update: Top Tech Stocks Climb Pre-Bell Friday,12-13-19
"--Analyst Actions: Credit Suisse Raises Adobe Systems' Price Target to $350 From $325, Keeps Outperform Rating",12-13-19
