headlines,date
"CFRA: History Suggests Owning 'Barbell Portfolio' of Last Year's 10 Best, 10 Worst Sub-Industries",01-02-18
S&P 500 Expected by Goldman Sachs to Climb 7% in 2018; Firm Sees 2018 Total Return at 9%,01-05-18
Adobe to Host Conference Call to Discuss TubeMogul Acquisition,01-05-17
BMO Capital Markets rates Adobe Systems Overweight,01-05-17
--Analyst Actions: BMO Capital Initiates Coverage on Adobe Systems with Outperform Rating and $125 PT,01-05-17
"Pacific Crest Securities selects grouping of cloud names with compelling prospects, valuations",01-05-17
Chairman of the Board Geschke Charles M Sells $5.0M of ADBE on 1/4/17,01-05-17
Chief Executive Officer Narayen Shantanu Exercises & Sells $2.0M of ADBE on 1/4/16,01-05-16
"OPTIONS: Option Implied Volatility for Semiconductor, Software and Technology into CES",01-07-20
"Analyst Actions: Adobe Systems Upgraded To Buy By Pivotal Research, Price Target Raised To $262 From $252",01-07-19
Piper's top software picks for 2019,01-07-19
Adobe Appoints Anil Chakravarthy as Executive Vice President and General Manager of Its Digital Experience Business,01-07-20
Former Informatica CEO tapped to lead Adobe unit a year after reorganization,01-07-20
Top 5 Cloud Stocks to Own for 2020 and for the Next Decade: Analyst,01-08-20
Spiros Segalas Adds 4 Stocks to Portfolio in 4th Quarter,01-08-20
"Analyst Actions: Adobe Systems' Price Target From Pivotal Raised to $193 From $162, Hold Rating Kept",01-09-18
Chairman of the Board Geschke Charles M Sells $2.5M of ADBE on 1/9/17,01-09-17
"Adobe Guides Full Year Revenue Above Estimates, FY EPS Expected Below Street",01-10-17
"Analyst Actions: Jefferies Raises Adobe Systems' Price Target to $390 From $370, Reiterates Buy Rating",01-10-20
"Analyst Actions: BofA Securities Lifts Price Target on Adobe Systems to $400 From $350, Reiterates Buy Rating",01-10-20
Adobe founder sells $5M worth as shares approach 52-week high,01-10-17
"Stock Research Reports for Chevron, Accenture, Adobe & Others",01-10-20
Software holding up amid Jefferies target increases,01-10-20
Adobe Named a Leader in 2016 Gartner Magic Quadrant for Digital Marketing Hubs,01-11-16
Performance Review Peril: Adobe Study Shows Office Workers Waste Time and Tears,01-11-17
AMD outshines Intel at CES 2020 as chip makers’ traditional roles remain reversed,01-11-20
Why Is Adobe (ADBE) Up 11.1% Since Last Earnings Report?,01-11-20
"Pivotal Research Downgrades Internet/Advertising Stocks Including Adobe, CBS, Disney Ahead of Q4 Results",01-12-17
"Analyst Actions: Adobe Systems Downgraded by Pivotal to Hold From Buy, Price Target Cut to $104 From $136",01-12-17
"Analyst Actions: Salesforce.com Downgraded to Hold vs Buy by Pivotal, PT Slashed to $76 From $105",01-12-17
Chief Executive Officer Narayen Shantanu Files To Sell $2.1M of ADBE on 1/4/16,01-12-16
Shareholder Geschke Family Trust Files To Sell $5.0M of ADBE on 1/4/17,01-12-17
Adobe Brings One of Its Last Legacy Products to the Cloud,01-13-20
"--Analyst Actions: Credit Suisse Lifts Adobe Systems' Price Target to $385 From $350, Keeps Outperform Rating",01-13-20
"The Zacks Analyst Blog Highlights: Chevron, Accenture, Adobe Systems, Gilead Sciences and Honda Motor",01-13-20
Microsoft CEO Satya Nadella: Here's what will define the future of retail,01-13-20
Adobe Experience Manager now offered as cloud-native SaaS application,01-13-20
Analyst Actions: Adobe Systems Initiated With Buy And $114 PT At Dougherty & Co.,01-14-16
3 Software Stocks That Could Be Big Winners in 2020,01-14-20
Adobe Systems (ADBE) Is Up 2.41% in One Week: What You Should Know,01-14-20
Adobe (ADBE) Moves to Buy: Rationale Behind the Upgrade,01-14-20
3 Reasons Growth Investors Will Love Adobe (ADBE),01-14-20
Adobe launches new $2B buyback,01-14-15
IBM Gears Up to Report Q4 Earnings: What's in the Cards?,01-15-20
Why Rite Aid (RAD) is Poised for Splendid Returns in 2020,01-15-20
Has Adobe Systems (ADBE) Outpaced Other Computer and Technology Stocks This Year?,01-15-20
Snap Up 5 Mega-Cap Stocks with Impressive Growth Prospects,01-15-20
Factors Setting the Tone for Citrix's (CTXS) Q4 Earnings,01-16-20
"Analyst Actions: Wells Fargo Lifts Adobe Systems Price Target to $345 From $315, Maintains Equal Weight Rating",01-16-20
Wells Fargo boosts software names on 2020 strength,01-16-20
"Software Upstarts Hit Salesforce, Oracle on Tech and Sales Practices",01-16-20
"New Relic names former Adobe, Microsoft exec chief product officer",01-16-20
Adobe started at 15% upside,01-16-19
Adobe Systems Incorporated -- Moody's upgrades Adobe's senior unsecured rating to A2,01-16-20
"New coalition of software startups takes aim at Salesforce, Oracle, SAP",01-16-20
Does Adobe (NASDAQ:ADBE) Have A Healthy Balance Sheet?,01-17-20
Analyst Actions: Oppenheimer Upgrades Adobe Systems to Outperform From Perform; Price Target is $410,01-17-20
"Analyst Actions: Adobe Systems Started By Stephens At Equalweight, With $278 Price Target",01-17-19
"Research Reports Initiation on Application Software Stocks -- Mobileye, Adobe Systems, Nuance Communications, and Splunk",01-17-17
"Adobe stock gains after Oppenheimer upgrade, while Autodesk gets a downgrade",01-17-20
Adobe Announces Program to Repurchase $2.5 Billion of Stock by End of FY2019,01-17-17
--Adobe Systems OKs New Stock Buyback Program of up to $2.5 Bln in Shares Through FY-End 2019,01-17-17
Chairman of the Board Warnock John E Sells $536.4K of ADBE on 1/17/17,01-17-17
"Adobe Systems authorizes new, $2.5B stock repurchase program",01-17-17
MT Newswires After-Hours News Movers,01-17-17
Adobe Systems (ADBE) Outpaces Stock Market Gains: What You Should Know,01-17-20
Adobe Named a Leader in 2018 Gartner Magic Quadrant for Digital Experience Platforms,01-18-18
"The Truth About Market Timing - January 20, 2020",01-20-20
Adobe Video Tools Get Rave Reviews at Sundance 2016,01-21-16
Adobe Shares Surge With Massive Demand,01-21-20
Adobe Announces Executive Retirements,01-22-18
Adobe Updates Q1 and Fiscal Year 2018 Financial Targets,01-22-18
Adobe Systems Updates FY and Q1 Guidance to Account for Tax Act,01-22-18
Adobe Systems Says CFO and General Counsel to Retire This Year,01-22-18
Adobe raises FY18 guidance; shares +1.1%,01-22-18
MT Newswires After-Hours News Movers,01-22-18
"Analyst Actions: Adobe Systems' Price Target From Pivotal Lifted to $195 From $193, Hold Rating Maintained",01-23-18
"Analyst Actions: Adobe Systems' Price Target From RBC Boosted to $208 From $193, Outperform Maintained",01-23-18
KeyBanc raises its Adobe Systems price target to 14% upside,01-23-18
"Adobe Acquires Allegorithmic, the Leader in 3D Editing and Authoring for Gaming and Entertainment",01-23-19
Sector Update: Technology Stocks Higher in Pre-Market Trading; Verizon Beats Q4 Revenue Estimates,01-23-18
Adobe Acquires Allegorithmic for Undisclosed Sum,01-23-19
Adobe Systems acquires Allegorithmic,01-23-19
Sector Update: Technology Stocks Still Grinding Higher,01-23-18
"Analyst Actions: RBC Ups Adobe Systems Price Target to $208, Keeps Outperform - Stock Up 1%",01-23-18
"Analyst Actions: Canaccord Ups Adobe Systems Price Target to $220, Keeps Buy - Stock Up 1%",01-23-18
Sector Update: Tech Stocks Extending Day-Long Advance,01-23-18
"Creative Problem Solving Skills Are Key to Tomorrow’s Jobs, but Today’s Curricula Are Leaving Students Behind",01-24-18
Global Survey Finds It Is Time for Governments to Transform Online Experiences,01-24-18
Adobe Names Leeny Oberg and Dheeraj Pandey to its Board of Directors,01-24-19
Adobe Announces Organization Change,01-24-19
Media Alert: Adobe Introduces New Applications for Select Chromebooks to Unlock Student Creativity,01-24-17
4 Boosted Enterprise Software Stocks to Buy in 2020,01-24-20
Adobe Named a Leader in Web Content Management Systems Vendors by Independent Research Firm,01-26-17
"Application Software Stocks on our Radar -- Allscripts Healthcare Solutions, Adobe Systems, Fortinet, and Cadence Design Systems",01-27-16
"This money manager says growth stocks are still your best play, and he has the math to back it up",01-27-20
8 Cloud Stocks To Own In 2020,01-27-20
Analyst Actions: Cleveland Research Upgrades Adobe Systems to Buy From Neutral,01-27-20
Looking Back at 2019,01-27-20
Adobe Systems (ADBE) Stock Moves -1.27%: What You Should Know,01-27-20
Charting a Course for How to Play Adobe and Salesforce.com Amid Weakness,01-28-20
Dropbox scoops up HelloSign for $230M,01-28-19
Dropbox Acquires Electronic Signature Company HelloSign in $230 Million Deal,01-28-19
Adobe Announces Changes to Executive Leadership Team,01-30-20
Tech faces off against Trump,01-31-17
Is Adobe Systems (ADBE) Stock Outpacing Its Computer and Technology Peers This Year?,01-31-20
Adobe Announces Major Updates to Technical Communication Solutions,01-31-17
Shareholder ValueAct Holdings LP Sells $183.3M of ADBE on 1/21/16-1/25/16,01-31-16
Chairman of the Board Warnock John E Sells $3.3M of ADBE on 1/22/16,01-31-16
Chief Financial Officer Garrett Mark S Files To Sell $4.7M of ADBE on 1/25/16,02-01-16
Adobe’s Board of Directors Elects Adobe CEO Shantanu Narayen as Chairman,02-01-17
Vice President Dillon Michael A Sells $889.3K of ADBE on 1/29/16,02-01-16
Vice President Thompson Matthew A Files To Sell $6.4M of ADBE on 1/25/16,02-01-16
Adobe Systems Says CEO Shantanu Narayen to Also Take on Chairman Role,02-02-17
"Consolidated Research: 2018 Summary Expectations for Towne Bank, Alpha and Omega Semiconductor, Johnson Outdoors, Gulfport Energy, Kroger, and Adobe — Fundamental Analysis, Key Performance Indications",02-02-18
Verbification: A Testimony for a Moat,02-02-20
Shareholder ValueAct Holdings LP Sells $16.5M of ADBE on 1/29/16,02-02-16
Chief Executive Officer Narayen Shantanu Exercises & Sells $2.0M of ADBE on 2/1/16,02-02-16
Shareholder ValueAct Capital Master Fund LP Files To Sell $141.9M of ADBE on 1/22/16,02-02-16
Vice President Dillon Michael A Files To Sell $889.3K of ADBE on 1/29/16,02-02-16
Adobe Systems (ADBE) Outpaces Stock Market Gains: What You Should Know,02-03-20
Shareholder Warnock John & Marva Ttes Files To Sell $3.3M of ADBE on 1/22/16,02-03-16
How Should Investors React To Adobe Inc.'s (NASDAQ:ADBE) CEO Pay?,02-04-20
"S&P 500 Movers: Clorox Jumps 7%, Leads Gainers; Weyerhaeuser Slips 4%",02-04-19
Looking for a Growth Stock? 3 Reasons Why Adobe (ADBE) is a Solid Choice,02-04-20
Investor Advisory: Adobe Announces Webcast of Investor Conference Participation,02-04-20
Adobe and Salesforce overturn old order in cloud revolution,02-04-20
"Thinking about trading options or stock in Adobe, Beyond Meat, Microsoft, QUALCOMM, or Trade Desk?",02-05-20
Enterprise software and security stocks hammered after Tableau/LinkedIn's earnings,02-05-16
Investor Advisory: Adobe Announces Webcast of Investor Conference Participation,02-05-19
Vice President Lewnes Ann Exer. Acquires $200.6K of ADBE on 2/3/16,02-05-16
Adobe considers chipmaking - Axios,02-06-19
Market Chatter: Adobe Systems Considers Designing Own Chips,02-06-19
"Goldman Sachs Touts Software and Services, Says Semiconductor, Tech Hardware Most Exposed to Coronavirus",02-07-20
Investor Advisory: Adobe Announces Webcasts of Investor Conference Participation,02-07-18
How to Trade Adobe Stock Right Now for Big Profits,02-07-20
"--Analyst Actions: RBC Raises Price Target on Adobe Systems to $125 From $115, Maintains Outperform Rating",02-08-17
Adobe Redefines Content Intelligence to Transform Customer Experiences,02-08-18
"Notable tech decliners: MU, WDC, SUNE, SPWR, ADBE, CRM, PANW, FEYE",02-08-16
Shareholder ValueAct Capital Master Fund LP Files To Sell $15.6M of ADBE on 1/29/16,02-08-16
Shareholder ValueAct Capital Master Fund LP Files To Sell $38.3M of ADBE on 1/21/16,02-08-16
Investor Advisory: Adobe Announces Webcasts of Investor Conference Participation,02-09-17
Shareholder Narayen Family Trust Files To Sell $2.0M of ADBE on 2/1/16,02-09-16
Adobe Data Science Symposium and Grants Bring Big Ideas to Big Data,02-10-16
Adobe Systems (ADBE) Outpaces Stock Market Gains: What You Should Know,02-10-20
"Timing the Market, Is it Possible? - February 11, 2020",02-11-20
Media Alert: Adobe Data Shows Prices for Consumer Goods Increase Post Holiday Season,02-13-17
The 10 Best Mutual Funds for Your 401k,02-14-20
Why Shopify Could Keep Rising,02-14-20
Cowen downgrades Adobe,02-15-19
Analyst Actions: Cowen & Co Downgrades Adobe Systems to Market Perform From Outperform With $280 PT,02-15-19
"It isn’t 1999—the party’s not over for tech stocks yet, Goldman says",02-15-20
MT Newswires' Analyst Notebook: ADBE,02-15-19
Adobe Announces New ColdFusion for Creating High-Performing Web and Mobile Apps,02-16-16
"Edison, Morse ... Watson? AI Poses Test of Who’s an Inventor",02-18-20
Fortune's picks for best companies to work for include these 14 Bay Area businesses,02-18-20
Adobe gets new Street-high target,02-19-20
Adobe celebrates Photoshop's 30th anniversary with new desktop and mobile features,02-19-20
"Analyst Actions: UBS Boosts Price Target on Adobe Systems to $430 From $360, Maintains Buy",02-19-20
Adobe Creative Cloud Seen Pushing Software Stock Higher,02-19-20
Adobe Systems (ADBE) Outpaces Stock Market Gains: What You Should Know,02-19-20
"Report: Exploring Fundamental Drivers Behind Canopy Growth, Adobe, Ultragenyx Pharmaceutical, Humana, Ship Finance International, and NexGen Energy — New Horizons, Emerging Trends, and Upcoming Developments",02-21-19
"Research Reports Coverage on Application Software Stocks -- Fortinet, Nuance Communications, Adobe Systems, and Allscripts Healthcare Solutions",02-21-17
"Thinking about trading options or stock in Apple, Adobe, eHealth, Morgan Stanley, or WW International?",02-21-20
"The Zacks Analyst Blog Highlights: Microsoft, Netflix, Adobe, International Business Machines and Apple",02-21-20
Adobe Named a Leader in Enterprise Marketing Software Suites and Cross-Channel Campaign Management by Independent Research Firm,02-21-18
"Adobe Unveils World’s First Open, Cloud-Based Digital Signatures",02-22-17
Adobe Transforms Mobile App Creation and Management,02-22-16
"Adobe Systems to Simplify Building, Managing Enterprise Aps",02-22-16
Adobe Named a Leader in 2017 Gartner Magic Quadrant for Digital Marketing Hubs,02-23-17
Adobe Stock Falls 6%,02-24-20
Is Adobe Inc. (NASDAQ:ADBE) Worth US$373 Based On Its Intrinsic Value?,02-24-20
Vista Equity Is a Tech-Investing Star. The Boss Credits Diversity.,02-24-20
"Verint Systems Expands Collaboration With Adobe to Support Customer Service Insight, Improvement",02-24-20
Salesforce & Square Q4 Earnings Previews: Buy the Tech Stocks for Secular Growth?,02-24-20
Adobe Stock Rises 3%,02-26-20
Adobe (ADBE) is an Incredible Growth Stock: 3 Reasons Why,02-26-20
IBD 50 Stocks To Watch: Adobe Tries To Bounce At Key Chart Level,02-26-20
Three Adobe directors stepping down,02-26-16
Adobe Systems (ADBE) Gains As Market Dips: What You Should Know,02-26-20
Adobe a `Durable EPS Growth Story' - Morgan Stanley Lifts Target,02-27-20
"--Analyst Actions: Morgan Stanley Lifts Adobe Systems Price Target to $450 From $410, Maintains Overweight Rating",02-27-20
Media Alert: Adobe Empowers Businesses to Transform at Adobe Summit,02-28-17
Adobe Could Give More Ground Before Setting Up as a Buy,02-28-20
Sector Update: Tech Stocks Extending Gains in Wednesday Afternoon Trading,02-28-18
US STOCKS-Wall St eyes worst week since financial crisis on pandemic fears,02-28-20
Sector Update: Tech Stocks Reverse Earlier Rise,02-28-18
Adobe Stock Rises 3%,03-02-20
Adobe Retakes 50-Day Line,03-02-20
"Adobe Systems, Dollar Tree, Etsy Inc., CarMax, and Under Armour and more offer option-trading opportunities that offer returns of more than 20%",03-02-17
Why Adobe (ADBE) Stock Looks Like a Buy Ahead of Q1 2020 Earnings,03-02-20
Chief Executive Officer Narayen Shantanu Exercises & Sells $1.9M of ADBE on 3/1/16,03-02-16
Dow Jones Futures Reverse Sharply Lower After G-7 Statement; It's Still A Coronavirus Stock Market Correction,03-03-20
Adobe Summit moves online due to coronavirus,03-03-20
Adobe Stock Falls 3%,03-03-20
These 10 tech giants grew their Bay Area workforces most as hiring slowed last year,03-03-20
Alphabet makes Google I/O 2020 an online event because of coronavirus concerns,03-03-20
Facebook leads FAANG sell-off as Fed rate cut fails to calm investors' coronavirus concerns,03-03-20
IBD Live: Why This Long-Term Leader Is Resilient Against Coronavirus,03-03-20
Shareholder Narayen Family Trust Files To Sell $1.9M of ADBE on 3/1/16,03-03-16
Artificial Intelligence Stocks To Buy And Watch Amid Rising AI Competition,03-04-20
Adobe Stock Rises 3%,03-04-20
Hedge Funds Have Never Been This Bullish On Adobe Inc. (ADBE),03-04-20
Zoom shares tumble despite solid results,03-05-20
Adobe Systems (ADBE) Earnings Expected to Grow: Should You Buy?,03-05-20
Adobe to Webcast Q1 FY2020 Earnings Conference Call,03-05-20
ADOBE INC. -- Moody's announces completion of a periodic review of ratings of Adobe Systems Incorporated,03-05-20
Adobe Stock Falls 4%,03-06-20
"When Does Market Timing Actually Work? - March 06, 2020",03-06-20
Adobe (ADBE) Gears Up for Q1 Earnings: What's in the Cards?,03-06-20
Tech shows go digital route amid coronavirus risks,03-06-20
Analyst Actions: Canaccord Genuity Lifts Salesforce.com PT to $175 From $165; Maintains Buy Rating,03-06-19
Be Greedy When Others Are Fearful,03-06-20
Goldman Sachs Expects Zero GDP Growth for US in Q2; American Airlines Performed Worst in S&P 500 Since Outbreak,03-06-20
Markets Seem to Favor Biden Over Sanders. But Can He Beat Trump?,03-06-20
Media Alert: Adobe Advertising Cloud Brings Sensei Power to Search Advertising,03-07-18
South By Southwest festival canceled due to coronavirus,03-08-20
Market Chatter: Adobe Systems In Talks to Shift Some Business to Google,03-08-17
"The Zacks Analyst Blog Highlights: Adobe, HubSpot and Alibaba",03-09-20
Adobe Stock Falls 8%,03-09-20
"Just Like With Any Champion, Steady Growth And Earnings Expected From Adobe",03-09-20
Adobe Named a Leader in IDC MarketScape: Worldwide Marketing Cloud Platforms 2016,03-10-16
OPTIONS: Straddle Prices for Companies Reporting Financial Results the Week of March 13,03-10-17
These Software Growth Stocks Are Outperforming Amid Market Correction,03-10-20
Why the coronavirus doesn't mean you should sell Tesla stock,03-10-20
5 Must-See Earnings Charts for Coronavirus Impacts,03-10-20
6 Stocks Outperforming the S&P 500 Index,03-10-20
Coronavirus has prompted these tech companies to ask employees to work from home,03-10-20
Adobe Systems raised to $140 target at Cowen and Company,03-10-17
ServiceNow adds artificial intelligence features to its business software,03-11-20
Will 'Low-Touch' Software Companies Resist Coronavirus Stock Market Correction?,03-11-20
"Tech Stocks' Earnings Roster for Mar 12: ADBE, ORCL & AVGO",03-11-20
Adobe Historically Favors Long Trade Off Earnings-Driven After-Hours Moves,03-11-20
Adobe to Webcast Q1 FY2019 Earnings Conference Call,03-11-19
Adobe's Must-Know Chart Layout Ahead of Earnings Report,03-11-20
Stocks To Buy: Is It Time To Buy Or Sell These Large-Cap Stocks?,03-11-20
Notable earnings after Thursday's close,03-11-20
Q1 Earnings Preview: Adobe,03-12-20
Here’s how Invesco’s top strategist says long-term investors should navigate this market panic,03-12-20
Adobe target raised ahead of earnings,03-12-18
"The Zacks Analyst Blog Highlights: MSFT, BABA, ADBE, DIS and LMT",03-12-20
"Adobe Earnings, Revenue Beat in Q1",03-12-20
Adobe to Webcast Q1 FY2018 Earnings Conference Call,03-12-18
"Stay Calm, and Buy Apple and These Other Tech Stocks During the Market Rout, Analyst Says",03-12-20
3 Stocks to Pull From the Bear Market Bargain Bin,03-12-20
"Earnings Reaction History: Adobe Inc, 72.7% Follow-Through Indicator, 3.6% Sensitive",03-12-20
--Analyst Actions: Adobe Systems Reiterated at Stifel With Buy Rating; Price Target Raised to $230 From $210,03-12-18
Adobe Reports Record Revenue,03-12-20
"Adobe Systems EPS beats by $0.04, beats on revenue",03-12-20
"--Adobe Posts Q1 EPS of $2.27, vs. Street Est. of $2.23; Revenue at $3.09 Billion, vs. Consensus of $3.05 Billion",03-12-20
"--Adobe Sees Q2 Revenue of About $3.175 Billion, vs. Street Est. of $3.217 Billion; EPS Seen at About $2.35, vs. Consensus of $2.34",03-12-20
Adobe results top expectations but outlook misses as coronavirus impacts customer spending,03-12-20
"Adobe Systems Q1 Outpaces Expectations, Sets Guidance that Includes Possible Impact from Coronavirus",03-12-20
Adobe Tops Estimates: Says It Expects Coronavirus to Force Delays in Bookings,03-12-20
Adobe Systems (ADBE) Tops Q1 Earnings and Revenue Estimates,03-12-20
Adobe Tops Q1 Views But Says Coronavirus Could Hit Q2 Sales,03-12-20
MT Newswires After-Hours News Movers,03-12-20
Adobe Says It’s Seeing Modest Impact From the Coronavirus,03-12-20
OPTIONS: Straddle Prices for Stocks Expected to Report Results This Week,03-13-19
Adobe Stock Rises 13%,03-13-20
Does Adobe Inc.'s (NASDAQ:ADBE) 14% Earnings Growth Reflect The Long-Term Trend?,03-13-20
Analyst Actions: JPMorgan Upgrades Adobe Systems to Overweight From Neutral; Price Target is $325,03-13-20
"--Analyst Actions: RBC Cuts Price Target on Adobe Systems to $325 From $345, Maintains Outperform Rating",03-13-20
Yext Collaborates with Adobe to Drive Website Discovery,03-13-19
"--Analyst Actions: Credit Suisse Cuts Adobe Systems' Price Target to $370 From $385, Keeps Outperform Rating",03-13-20
Yext Partners With Adobe to Drive Website Discovery,03-13-19
"--Analyst Actions: Wells Fargo Cuts Price Target on Adobe Systems to $315 From $345, Maintains Equal-Weight",03-13-20
"--Analyst Actions: Cowen Lifts Price Target on Adobe Systems to $325 From $315, Maintains Market Perform",03-13-20
"--Analyst Actions: UBS Cuts Price Target on Adobe Systems to $344 From $430, Maintains Buy",03-13-20
"--Analyst Actions: Jefferies Cuts Price Target on Adobe Systems to $370 From $385, Maintains Buy",03-13-20
"--Analyst Actions: BMO Cuts Price Target on Adobe Systems to $350 From $358, Maintains Outperform",03-13-20
"Earnings roundup: Growth and uncertainty for Adobe, Oracle, Broadcom",03-13-20
"--Analyst Actions: Oppenheimer Lowers Adobe Systems' Price Target to $375 From $410, Keeps Outperform Rating",03-13-20
Adobe Is One of the Best Opportunities in the Market Right Now,03-13-20
Adobe for Me Remains an Investment,03-13-20
"Analysts positive on Adobe print, coronavirus worries remain",03-13-20
"Adobe (ADBE) Q1 Earnings Top, Coronavirus Weighs on Guidance",03-13-20
Yext launches four Adobe integrations,03-13-19
"Analyst Actions: Goldman Sachs Lowers Price Target for Adobe Systems to $330 From $355, Maintains Neutral Rating",03-13-20
"Analyst Actions: Morgan Stanley Lowers Price Target for Adobe Systems to $366 From $450, Maintains Overweight Rating",03-13-20
"Analyst Actions: Bernstein Lowers Price Target for Adobe Systems to $363 From $367, Maintains Outperform Rating",03-13-20
"Analyst Actions: Barclays Lowers Price Target for Adobe Systems to $333 From $350, Maintains Overweight Rating",03-13-20
Adobe to Webcast Q1 FY2017 Earnings Conference Call,03-13-17
What I'm Doing In The Stock Market Today,03-13-20
Adobe Systems Rises 2% Ahead of Q1 Results; Morgan Stanley Sees Smooth Start to 2019 But Cautious on Valuation,03-13-19
Coronavirus Impact: What Investors Can Learn from Chip Giant Broadcom,03-13-20
Adobe Rallies on Strong Earnings and Analyst Upgrade After 26% Swoon,03-13-20
"Adobe, DocuSign and Slack Suggest They Aren't Seeing a Big Coronavirus Impact -- For Now",03-13-20
Previewing the 2020 Q1 Earnings Season,03-13-20
Adobe Systems Q1 2019 Earnings Preview,03-13-19
Longs Hold Slim advantage Trading Adobe off Earnings-Driven After-Hours Moves,03-14-19
Adobe Posts Preview Release of New Experience Design Tool,03-14-16
Coronavirus is having a devastating impact on upstart small businesses in San Francisco and Silicon Valley,03-14-20
"Coronavirus update: 147,838 cases, 5,539 deaths, the reality of COVID-19 hits home for Americans",03-14-20
Adobe to Webcast Q1 FY2016 Earnings Conference Call,03-14-16
"Earnings Reaction History: ADOBE SYSTEMS, 60.0% Follow-Through Indicator, 3.6% Sensitive",03-14-19
Dolby sues Adobe for copyright violation,03-14-18
Adobe Reports Record Revenue,03-14-19
"Adobe Beats Q1 Expectations, Sets Q2 and FY 2019 Outlook Below Street View",03-14-19
"Adobe Systems reports Q1 beats, Publishing strength",03-14-19
"Adobe moving to S&P 100, to replace smaller New Fox",03-14-19
Adobe Systems to Join S&P 100 While New Fox Joins S&P 500,03-14-19
Notable earnings after Thursday’s close,03-14-18
Fox Set to Join S&P 500; Adobe to Join S&P 100,03-14-19
MTNewswires After-Hours News Movers,03-14-19
OPTIONS: Straddle Prices for Companies Reporting Financial Results this Week,03-15-17
OPTIONS: Straddle Prices for Stocks Expected to Report Results this Week,03-15-18
Longs Eke Out Advantage Trading Adobe off Post-Market Earnings Moves,03-15-18
Results: Adobe Inc. Exceeded Expectations And The Consensus Has Updated Its Estimates,03-15-20
R.R. Donnelley Teams Up with Adobe to Provide Omni-Channel Marketing Offering,03-15-16
MTNewswires' Opening Bell Momentum Stocks: ADBE,03-15-19
"Option-trading opportunities on Aurora Cannabis Inc., Adobe Inc., The Walt Disney Co., Marvell Technology, and Oracle Corp.",03-15-19
Analyst Actions: RBC Capital Lifts Adobe Systems Price Target to $290 From $288; Maintains Outperform Rating,03-15-19
"Analyst Actions: Adobe Systems' Price Target Raised to $300 at Canaccord Genuity, Buy Rating Reiterated",03-15-19
"S&P 500 Movers: Broadcom Jumps 10%, Leads Gainers; Whirlpool Slips 6%",03-15-19
