headlines,date
"Market Chatter: Apple Falls More Than 2% After Co Takes Different Path, Says Won't Release First-Weekend Sales of New iPhone 7",09-08-16
"Stocks Come Under Pressure From Apple, European Central Bank Inaction",09-08-16
Apple Down 2.5% Although Ireland's Parliament Stands Behind Govt's Appeal of Apple Tax Decision from European Commission,09-08-16
"Midday Update: Stocks Weighed Down by Apple, Inaction by European Central Bank",09-08-16
Market Chatter: Federal Judge Rules in Favor of Apple in Qualcomm Royalty Dispute,09-08-17
Stocks Decline in US Intraday as Apple Weighs on Tech Sector,09-08-16
Reuters: European Commission draft proposal lays out extension of certain telecom security regulations to technology services,09-08-16
"Update: Market Chatter: Western Digital Said to Ask Apple to Join Bid For Toshiba's Chip Unit, But Apple Not Biting",09-08-17
Reuters: Apple warns Western Digital away from Toshiba control,09-08-17
"Stocks Retreat As ECB Decision Disappoints, Apple Shares Fall",09-08-16
"Stocks Remain Weak as ECB Decision Disappoints, Apple Shares Retreat",09-08-16
"Stocks Close Lower After ECB Leaves Interest Rates, Quantitative Easing Unchanged",09-08-16
Shareholder Cook Timothy D Rev Trust dtd 8/19/06 Files To Sell $5.3M of AAPL on 8/31/16,09-08-16
Shareholder Cook Timothy D Rev Trust dtd 8/19/06 Files To Sell $11.7M of AAPL on 8/30/16,09-08-16
Apple broke Chinese labor laws,09-09-19
"Apple set to introduce new iPhones, iPad and Apps for Apple TV",09-09-15
"Apple Says Attack On iPhone Targeted China's Uighur Community, Refutes Google's Research",09-09-19
"Labor Watchdog Claims Apple, Foxconn Violated Chinese Labor Laws in iPhone 11 Production",09-09-19
"T-Mobile, TELUS to Start iPhone 7 Sales on Sept. 16",09-09-16
Sector Update: Tech Giants Climb Pre-Market Monday,09-09-19
Stocks to watch next week,09-09-17
European Commissioner for Competition claims U.S. Senate hearing sparked Apple tax inspection,09-09-16
"Update: T-Mobile, TELUS, U.S. Cellular, AT&T to Start iPhone 7 Sales on Sept. 16",09-09-16
"Apple unveils 12.9"" iPad Pro, new Watch finishes/accessories",09-09-15
Apple's high-gloss black iPhone 7 hottest among pre-orders,09-09-16
"New Apple TV set-top revealed; Siri, App Store, games, touchpad supported",09-09-15
"Apple unveils iPhone 6S/6S+ with 3D Touch sensors, A9 CPU, improved cameras",09-09-15
"iOS 9 Available as a Free Update for iPhone, iPad & iPod touch Users September 16",09-09-15
Apple Brings Innovation Back to Television with The All-New Apple TV,09-09-15
Apple Introduces watchOS 2 with Native Apps and New Gold & Rose Gold Aluminum Apple Watch Sport Models,09-09-15
Apple and Hermès Unveil the Apple Watch Hermès Collection,09-09-15
Apple Introduces iPad Pro Featuring Epic 12.9-inch Retina Display,09-09-15
Apple Introduces iPhone 6s & iPhone 6s Plus,09-09-15
"Apple minimizes iPhone 7 chip-supplier leverage through dual Intel, Qualcomm modem implementations",09-09-16
Apple changes App Store amid antitrust scrutiny,09-09-19
S&P 500 Posts 2.4% Weekly Loss as Friday's Drop Erases Prior Gains,09-09-16
Trump says Apple should shift production to U.S. to avoid China tariffs,09-10-18
Market Chatter: Apple Tweaks App Store Search Engine Algorithm,09-10-19
Market Chatter: Weibo's Oasis App Relaunches in Wake of Plagiarism Claim,09-10-19
What to expect at Apple's fall event,09-10-19
Apple returns to eurozone bond market,09-10-15
Sector Update: Tech,09-10-19
Apple bear cuts target on cycle weakness,09-10-19
Sector Update: Leading Tech Stocks Decline Pre-Bell Tuesday,09-10-19
New iPhones won't have two-way charging - analyst,09-10-19
BofAML: Apple's iPhone prices could increase 20% under Trump's plan,09-10-18
Equalization tax across the EU?,09-10-17
"Analyst predicts iPhone delay, iPad USB-C ahead of fall event",09-10-18
Invesco S&P 500 Quality ETF (SPHQ) August Summary,09-10-18
Apple fall event kicking off (live updates),09-10-19
Apple resets car strategy,09-10-16
"Apple TV+ Launches November 1, Featuring Originals from the World’s Greatest Storytellers",09-10-19
Apple Introduces New Version of the Most Popular iPad Starting at $329,09-10-19
Apple Unveils Apple Watch Series 5,09-10-19
iPhone 11 Pro and iPhone 11 Pro Max: the Most Powerful and Advanced Smartphones,09-10-19
Apple Introduces Dual Camera iPhone 11,09-10-19
Apple Arcade Invites You to Play Something Extraordinary,09-10-19
"Apple's Streaming & Gaming Rivals Hit as Apple TV+, Apple Arcade Each Offered at $4.99/Month Subscription",09-10-19
Research Alert: CFRA Maintains Buy Opinion On Shares Of Apple Inc.,09-10-19
"Apple Unveils iPhone 11 With Dual, Triple Camera Systems; Sets $4.99 Monthly Price for TV Streaming",09-10-19
"Update: Apple's Streaming & Gaming Rivals Hit as Apple TV+, Apple Arcade Each Offered at $4.99/Month; Wedbush Sees 180 million iPhone Units Sold in FY20",09-10-19
"Close Update: Stocks Tread Water Tuesday as Real Estate, Technology Shares Slump",09-10-19
"Stocks End Mixed as Investors Look to ECB, Fed Meetings, Digest Trade-Dispute News",09-10-19
Apple hit by iPhone X leak,09-11-17
5G-less iPhone sees tepid response in Asia,09-11-19
Market Chatter: Apple's New iPhone Details Leaked Over Weekend,09-11-17
"Hong Kong Hang Seng Up 1.04% On Korea Outlook, China Currency Actions",09-11-17
"--Analyst Actions: Goldman Sachs Trims Price Target on Apple to $187 From $189, Reiterates Neutral Rating",09-11-19
Reuters: Apple faces hard sell with premium iPhone in China,09-11-17
Research Alert: CFRA Maintains Buy Opinion On Shares Of Apple Inc.,09-11-19
Broadening Horizons for Apple Pay - Report on Apple,09-11-15
"Analyst Actions: BofA Merrill Lynch Lifts Apple's Price Target to $250 From $240, Reiterates Buy Rating",09-11-19
Sector Update: Tech Heavyweights Climb Pre-Bell Wednesday,09-11-19
"Analyst Actions: Needham Lifts Apple's Price Target to $250 From $225, Reiterates Strong Buy Rating",09-11-19
"Analyst Actions: Barclays Lifts Apple's Price Target to $207 From $192, Reiterates Equal Weight Rating",09-11-19
"Analyst Actions: Maxim Cuts Apple's Price Target to $204 From $211, Reiterates Hold Rating",09-11-19
UBS raises its Apple target on potential 20% services growth,09-11-18
"Thinking about trading options or stock in Apple, Alibaba, JPMorgan Chase, Netflix, or Roku?",09-11-19
"Thinking about buying stock in Apple, Facebook, Fitbit, Micron or Tesla Inc.?",09-11-18
"Thinking about buying stock in Apple, Equifax, MasterCard, Mattel Inc or Sony Corporation?",09-11-17
Analysts praise Apple TV+ pricing,09-11-19
"KGI Securities expects iPhone X to launch in ""severe short supply""",09-11-17
What to expect during Apple's iPhone launch event,09-11-18
"Stocks Drift Higher as Dow Poised to Close Above 27,000 for First Time Since July",09-11-19
Munster expects Apple shares to drop; Cook refutes claims products for rich,09-11-17
"Close Update: Dow Rallies Above 27,000 as Stocks Boosted by US-China Trade Deal Optimism",09-11-19
Stocks End Higher as China Exempts Some US Goods From Higher Tariffs,09-11-19
"Stocks Surge in US Relief Rally as S&P 500 Hits Record High, Dow Jumps",09-11-17
"Amazon, Pandora to launch new music streaming services",09-12-16
Apple's biggest event in years,09-12-17
Pre-Market Briefing: US Equities Futures Inch Higher; Eyes on Apple's New iPhone Launch,09-12-17
OPTIONS: Phone Component Option Implied Volatility into Apple iPhone Event,09-12-17
Hong Kong Hang Seng Slips 0.26%; Shanghai Higher,09-12-19
TrendForce: Global iPhone production volume will grow 5.6% this year,09-12-17
Sector Update: Technology Heavyweights Climbing in Thursday's Pre-Bell Trading,09-12-19
Market Chatter: Apple Cuts Dozens of Workers on Self-Driving Car Project in Shift to Autonomous Navigation Software From Building Car,09-12-16
Walgreens to Give 3% Cashback on Apple Card With Apple Pay Purchases,09-12-19
Apple's fall iPhone event (live updates),09-12-18
Apple iPhone Event 2017: Live updates,09-12-17
"Apple Watch Series 4: Beautifully Redesigned With Breakthrough Communication, Fitness and Health Capabilities",09-12-18
Apple TV 4K Brings Home the Magic of Cinema with 4K & HDR,09-12-17
Apple Introduces iPhone XR,09-12-18
iPhone XS and iPhone XS Max Bring the Best and Biggest Displays to iPhone,09-12-18
"Apple Watch Series 3 Brings Built-in Cellular, Powerful New Health & Fitness Enhancements",09-12-17
iPhone 8 & iPhone 8 Plus: A New Generation of iPhone,09-12-17
The Future Is Here: iPhone X,09-12-17
Gamestop Launching Trade Program To Help Customers Afford New iPhones,09-12-17
Tim Cook shares some of the first photos taken with iPhone 7 Plus,09-12-16
Block & Leviton Files Lawsuit Against Apple on Behalf of iPhone Upgrade Program Members Shut Out of iPhone 7 and 7 Plus,09-12-16
Stocks Rally as Fed Speakers Ease U.S. Rate-Hike Fears,09-12-16
Markets Hit All-Time Highs in US as Gainers Outweigh Apple's Losses,09-12-17
Bain-Apple closer to buying Toshiba unit,09-13-17
Pre-Market Briefing: US Equities Futures Edge Lower; Apple iPhone X Later-Than-Expected Shipment Weighs,09-13-17
Apple suppliers' shares fall across Asia,09-13-17
"--Analyst Actions: Goldman Sachs Cuts Price Target on Apple to $165 From $187, Maintains Neutral Rating",09-13-19
Comcast's Xfinity Mobile will offer Apple's New iPhone 8 and iPhone 8 Plus Starting Sept 22,09-13-17
"Apple's November Ship Date for iPhone X Disappoints BMO, But Firm Still Expects iPhone Portfolio to Do Well",09-13-17
Goldman cuts Apple on TV+ trial,09-13-19
T-Mobile Says Sales Of Apple iPhone 7 Breaks Records,09-13-16
"ZAGG Inc Releases Wireless Charging Base for iPhone 8, iPhone 8 Plus, and iPhone X",09-13-17
Analyst: Apple could sell half its usual volume of iPhones in first week,09-13-17
"T-Mobile Says IPhone 7, 7 Plus Pre-Sales Top Records",09-13-16
"Update: T-Mobile Says Sales Of Apple iPhone 7 Breaks Records, Sprint Says Sales Rise Near Five-Fold",09-13-16
Sector Update: Most Tech Majors Climb Pre-Bell Friday,09-13-19
Analyst Actions: Needham & Co Reiterates Apple Buy Rating; Lifts Price Target to $260 From $220,09-13-18
"Thinking about buying stock in Apple, Advanced Micro Devices, Netflix, Nike, or NVIDIA?",09-13-18
Sector Update: Tech Stocks Mainly Lower Pre-Bell,09-13-16
Apple +3%; carrier pre-orders encouraging,09-13-16
Abrams spurned Apple for less money with Warner - report,09-13-19
"Needham praises Apple's ""movie industry"" release schedule",09-13-18
US Stock Indexes Decline in Early Trading as Oil Prices Plunge,09-13-16
Stock Indexes Higher Early Thursday After Government Report Shows Jobless Claims Drop to Fresh 49-Year Low,09-13-18
Stocks Return to Downward Trajectory as Oil Losses Weigh,09-13-16
"Stocks Buoyed By Tame Inflation, Progress Toward Trade Deal",09-13-18
"S&P 500 Movers: Freeport-McMoRan Sinks 9%, Leads Losers; Apple Adds 3%",09-13-16
Goldman drops its Apple EPS forecast on lower XR price,09-13-18
Stocks Edge Back From Record Highs in US as Apple's Losses Dent Gains,09-13-17
Midday Update: Oil Weighs on Stocks Causing Dow to Surrender Monday's Gains,09-13-16
BlackBerry Says Its Software is Ready For iOS 10,09-13-16
"Midday Update: Wall Street Buoyed by Upbeat Inflation, Jobs Data",09-13-18
Swift Playgrounds Now Available on the App Store,09-13-16
Midday Update: U.S. Stocks Flat as Wall Street Waits For Friday's Data-Dump,09-13-17
Apple bear sees weak iPhone 11 demand,09-13-19
Mid-Day Report: US Stocks Mixed as Technology Slides But Optimism Over Trade Talks Push Gold & Treasuries Lower,09-13-19
Energy Stocks Lead US Equities Lower in Intraday Trading,09-13-16
Apple denies Goldman's TV+ claims,09-13-19
"Main Street's Index, the BetterInvesting Top 100, Nearly Doubled Over 5 Years Through August",09-13-16
"Apple addresses iOS 10 update issues, declares resolved",09-13-16
Vonage Using Apple's iOS 10 to Enable VoIP Apps to Work Almost as 'Native Call',09-13-16
"Analyst Actions: Goldman Sachs Lowers Apple Earnings Forecasts Amid New Launches, Keeps at Neutral, PT $240 - Stock Up 2%",09-13-18
"T-Mobile and Sprint Say iPhone 7, 7 Plus Pre-Sales Soar",09-13-16
"Analyst Actions: RBC Sees Apple Watch 4 Positive for iRhythm Tech's Zio, Keeps at Outperform - Stock Rises 7%",09-13-18
"Apple roundup: product, accessory products pricing adds up",09-13-17
"Analyst Actions: RBC Reaffirms Apple at Outperform on new Products, Price Target $240 - Stock Up 2%",09-13-18
Market Chatter: Apple Warns Ireland Delays Threaten $1 Billion Project - Shares Softer,09-13-17
Cirrus Logic Shares Down 4% after Apple Stops Providing Headphone Dongles for New iPhones,09-13-18
Close Update: U.S. Stocks Retreat as Oil Prices Weigh on Energy Shares,09-13-16
"Close Update: Tame Inflation Data, Hopes for U.S./China Trade Talks Buoy Stocks",09-13-18
Energy Shares Chart Path Lower as US Stocks Retreat,09-13-16
"Stocks End Mixed as Apple Slide Offsets Gains From Easing US, China Trade Tensions",09-13-19
"Close Update: US Stocks Close Mixed as Technology Falters, Tensions Ease Between US, China",09-13-19
Stocks Nudge to New Records in US Trading as Energy Climbs and Apple Curbs Losses,09-13-17
"Dow Hits February High as Apple, Trade Hopes Bolster US Equities",09-13-18
Disney's Iger leaves Apple board,09-13-19
Tim Cook comments on AirPods,09-14-16
Report: LG Display becomes iPhone's second OLED supplier,09-14-18
LG Display Chosen by Apple as Second OLED Supplier; Shares Rise 7% in Pre-Market,09-14-18
Sector Update: Tech,09-14-18
Sector Update: Technology Stocks Higher in Pre-Market; LG Display Tapped by Apple as Second OLED Supplier; Shares Rise 11%,09-14-18
"Financialinsiders.com Earnings Recap Week Ending September 14th, 2017",09-14-18
Wall Street Set for Rebound Despite Dip in Oil Prices,09-14-16
Apple states initial iPhone sales on pace to top year-ago levels; shares +2.6%,09-14-15
"Twitter Launches App to Allow Live Streaming on Apple TV, Amazon Fire TV and Xbox One",09-14-16
Apple shares continue torrid run-up as headlines shift from tax complications to new products,09-14-16
Analyst Actions: Maxim Group Reiterates Apple Buy Rating; Lifts PT to $182 from $180,09-14-17
Apple Face ID may recognize only one face; new charging case coming in Dec.?,09-14-17
"Goldman rate-hike plays: Favor balance sheet quality, avoid floating rate debt",09-14-15
"S&P 500 Movers: Apple Climbs 4%, Leads Gainers; Murphy Oil Slides 4%",09-14-16
"Stocks Turn Positive on Stability in Bond Market, Rally in Apple",09-14-16
Apple CEO Tim Cook perceives augmented reality a larger opportunity than virtual,09-14-16
Sector Update: Technology Stocks Mostly Lower in Mid-Day Trade,09-14-17
"Samsung Pain is Apple's Gain as iPhone 7 Comes Amid Galaxy Note7 Recall, RBC Says",09-14-16
Midday Update: Stocks Cautiously Higher as Tech Gains Offset Weak Energy Markets,09-14-16
Sector Update: Tech Stocks Underwater Despite Sizable Rise For Chip-Makers,09-14-18
Time Offers Apple Pay Functionality to Subscribers,09-14-16
Stocks Post Slim Gains in US Intraday as Tech Strengthens on Apple Rally,09-14-16
Market Chatter: Verizon Comms iPhone 7 Orders in Normal Range Shows Disconnect With T-Mobile & Sprint Data,09-14-16
Pandora's Direct Licensing Deals Put It In Step With Apple and Spotify for On-Demand,09-14-16
Ad trade groups blast Apple's new Safari privacy feature,09-14-17
"Verizon iPhone 7 pre-orders within usual range, higher at AT&T",09-14-16
Sector Update: Tech Stocks Ride Late Updraft to Small Closing Gain,09-14-18
Sector Update: Technology Stocks Close Session in the Red,09-14-17
S&P 500 Posts 1.2% Weekly Gain in Broad Climb Led by Telecom; Financials Lag,09-14-18
US Stocks End Mixed Before Data Deluge as Apple Lifts Nasdaq,09-14-16
Spotify passes the 40M subscriber mark,09-15-16
Initial quantities of iPhone 7 Plus sold out,09-15-16
Acacia Research Unit Wins $22.1 Mln Damages Award in Patent Lawsuit Against Apple,09-15-16
Market Chatter: Apple Says Initial Quantities of iPhone 7 Plus Sold Out,09-15-16
Hong Kong Hang Seng Edges Forward 0.11% Despite Geopolitical Tensions,09-15-17
"Initiating Research Reports on Electronic Equipment Equities -- Energous, Apple, Fabrinet, and Philips",09-15-17
OPTIONS: Apple iPhone Component Option Implied Volatility amid iPhone 7 Plus success,09-15-16
Apple higher premarket as Credit Suisse boosts iPhone estimates,09-15-16
Preorders start for iPhone 8 and Apple Watch,09-15-17
--Analyst Actions: Credit Suisse Reiterates Apple Outperform Rating with $150 PT,09-15-16
"Markets Look Past Geopolitical Jitters as Tech Shares Gain, Dow Up Sixth Day",09-15-17
"Stocks Bounce As Data Dims Rate Hike Expectations, S&P 500 Respects 2,120 Support",09-15-16
Cirrus Logic Scores Record High In Line With Apple as iPhone 7 Sales Jump,09-15-16
Pandora Media Launches Pandora Plus for $4.99 Per Month,09-15-16
KGI reduces iPhone X shipment estimates,09-15-17
"Midday Update: Stocks Buoyed by Anemic Retail Sales, Support For S&P 500 at 2,120",09-15-16
"--Analyst Actions: BTIG Research Lifts Apple PT to $133 vs $124, Reiterates Buy Rating",09-15-16
Stocks Advance as US Economic Data Dims Rate-Hike Chances,09-15-16
Apple And Dell Join Bain Capital Bidding Team For Toshiba Flash Memory Unit,09-15-17
"Market Chatter: Energous Gains, Apple Reportedly Working on Integrating Co's Wireless Technology Into iPhones",09-15-16
"Skyworks Solutions Shares Up 6% After Debut of iPhone 7, Corresponding Technology",09-15-16
"Sector Update: Late Surge for Apple, Suppliers Lift Tech Sector to Big Gains",09-15-16
Apple updates developer app guide; Watch only works in home country,09-15-17
Close Update: Stocks Rally as Economic Data Cools Rate Hike Jitters,09-15-16
US Stocks End Stronger as Data Dims Chances of Interest-Rate Hike,09-15-16
iPhone 7 hits retail stores,09-16-16
Apple in court over Irish tax bill,09-16-19
Analyst Actions: Apple's Price Target From BMO Boosted to $140 Amid Signs of Strong Demand for iPhone 7,09-16-16
Analyst Actions: Apple's PT From Canaccord Genuity Raised to $140 as Survey Indicates Strong iPhone 7 Demand,09-16-16
Sector Update: Tech Majors Decline Pre-Market Monday,09-16-19
Apple paid $118M tax charge in Japan for underreporting income,09-16-16
S&P 500 buybacks decline significantly in Q2 2019; expenditures still remain higher than the pre-2018 levels,09-16-19
Apple falls silent on wireless charger,09-16-18
Market Chatter: Apple's Japanese Unit Pays $118 Million in Back Taxes,09-16-16
Piper Jaffray's Gene Munster sees strong iPhone 7 demand despite shorter retail lines,09-16-16
Apple Reportedly Prepares to Fight $14.4 Billion Tax Bill From European Commission in Court,09-16-19
"S&P 500 Edges Up 0.5% on Week, Driven by Technology Sector; Energy Leads Decliners",09-16-16
Apple reportedly buys mapping visualization firm; S&P upgrades to Strong Buy,09-16-15
EU tax order 'defies common sense' - Apple,09-17-19
Market Chatter: Apple Said to Prepare $1 Bln Investment in India in Shift Away From China,09-17-19
Apple Awards an Additional $250 Million from Advanced Manufacturing Fund to Corning,09-17-19
Apple fund invests $250M in Corning,09-17-19
Small NASDAQ Company Just Got A Huge $900 Opportunity From Apple,09-17-18
"Share Repurchases Account For Largest Share of S&P 500 Cash Spending, Though Capex Also Surging",09-17-18
Sector Update: Leading Tech Stocks Mostly Lower Pre-Market Tuesday,09-17-19
"Thinking about buying stock in Apple, American Express, Alibaba, Oracle, or Teva Pharmaceuticals?",09-17-18
Report: Spotify nearing launch in Middle East/North Africa,09-17-18
"Equities Dragging in US Trading as Amazon, Apple Shares Weigh on Tech Sector",09-17-18
Apple Awards Corning $250 Million More From Advanced Manufacturing Fund,09-17-19
Apple: ITC staff urging finding of no violation of Qualcomm patents,09-17-18
Mid-Day Update: Wall Street Braces For More Trade Restrictions Against China,09-17-18
Amazon Launches Amazon Music HD With Highest Quality of Streaming Audio,09-17-19
Bloomberg: Apple Watch excluded from latest tariffs,09-17-18
"Market Chatter: Apple Watch, AirPods Safe from Next Batch of Chinese Goods Tariffs",09-17-18
Close Update: Dow Dips 100 Points as Wall Street Braces for Trade Announcement,09-17-18
"Dow, S&P 500 Snap Winning Streaks as Trump Renews US-China Trade Jitters",09-17-18
Hagens Berman: Judge Allows Federal Class-Action Lawsuit Accusing Apple of Using Refurbished Replacements in AppleCare Coverage,09-17-19
Apple wins key patent appeal against Samsung,09-18-15
Apple's iPhone X comes with slimmer margins?,09-18-17
Apple iPhone 11 pre-orders show strength,09-18-19
"Trump Administration Imposes Tariffs on $200 Billion Worth of Chinese Goods From Coal to Fruits, Vegetables",09-18-18
Sector Update: Tech Heavyweights Mixed In Wednesday's Pre-Market Trading,09-18-19
"Thinking about trading options or stock in Apple, Citigroup, Facebook, Coca-Cola, or Merck?",09-18-19
Tim Cook discusses Apple's narrow tariff miss,09-18-18
"Q2 2017 S&P 500 Buybacks Fall 9.8% from Q1, to $120.1 Billion",09-18-17
Apple Deposits Almost $17 Billion in Escrow as European Commission Fine Works Way Through Courts,09-18-18
Appeals court backs Copyright Royalty Board's decisions,09-18-18
Ireland fully recovers €13.1B tax bill from Apple,09-18-18
Apple continues EU tax appeal,09-18-19
Sector Update: Tariff Exemptions Help Lift Tech Stocks to Sizable Gains,09-18-18
"Analyst Actions: RBC Sees Higher Apple Selling Prices, Keeps at Outperform, Price Target $240 - Stock Firmer",09-18-18
"KGI: iPhone X eating 8 pre-orders, Watch beats expectations",09-18-17
Market Chatter: Pre-orders for Apple's iPhone 11 Lineup Exceed Expectations in Taiwan,09-18-19
Sector Update: Tariff Exemptions for Selected Apple Products Lifts Tech Stocks to Big Gains,09-18-18
Apple losing VP of communications,09-18-19
What to expect as iOS 13 gets released,09-19-19
"Asian Stock Markets Gain On Federal Reserve, Bank Of Japan Views",09-19-16
Hong Kong Hang Seng Down 1.07% on Protest Concerns; Shanghai Higher,09-19-19
"Wall Street Presses Gate Pre-Bell; Futures Up, Europe Higher, Asia Closes North",09-19-16
JPMorgan cautious on iPhone 7 demand,09-19-16
WSJ: Apple prioritized release of iPhone XS models over XR,09-19-18
Sector Update: Top Tech Stocks Mixed Pre-Bell Thursday,09-19-19
"Morgan Stanley raises Apple price target, says iPhone X price will increase demand",09-19-17
Apple Fifth Avenue: The Cube is Back,09-19-19
"Apple iOS 11 launches today with AR, App Store changes",09-19-17
"Reports: Apple held 62% of Q2 handset profit, dominated premium smartphones",09-19-18
"Analyst Actions: Morgan Stanley Raises PT for Apple to $194, Reiterates Overweight Rating",09-19-17
"Pre-Market Briefing: US Equities Futures Tread Water Ahead of Federal Reserve's Policy, Outlook Announcement",09-20-17
Market Chatter: Toshiba Said to Select Bain Group as Chip Buyer Over Western; Bain Seeks $7 Bln From Apple,09-20-17
Apple's iPhone 11 goes on sale,09-20-19
Hong Kong Hang Seng Slips 0.13% Despite Sino Central Bank Rate Cut,09-20-19
More cautious iPhone 7 comments,09-20-16
"Analyst Actions: Apple Price Target From BMO Boosted to $219 From $199, Market Perform Reiterated",09-20-18
"--Analyst Actions: Citigroup Sets $120 PT on Apple, Reiterates Buy Rating",09-20-16
Apple issues statement on Watch cellular connection issues,09-20-17
Sector Update: Tech Heavyweights Climb Pre-Market Friday,09-20-19
"Analyst Actions: Cascend Securities Lifts Apple's Price Target to $270 From $260, Reiterates Buy Rating",09-20-19
Rosenblatt: iPhone 8 pre-orders lower than previous models,09-20-17
BMO raises its Apple target but wants to see iPhone unit growth,09-20-18
UBS increases Apple price target to $127,09-20-16
"U.S. Stocks Mixed Before FOMC Results, Apple Weighs on Report of Connectivity Issues with New Watch Series 3",09-20-17
Mid-Day Update: U.S. Stocks Mixed Ahead of FOMC Policy Statement,09-20-17
Stocks Mixed in US Trade Ahead of Fed Decision as Tech Weighs on Nasdaq,09-20-17
macOS Sierra Now Available as a Free Update,09-20-16
"Apple Slips 2% After Rosenblatt Says iPhone 8, 8 Plus Pre-Orders Lag Prior Models; Co Admits Watch Connectivity Issues",09-20-17
Apple Says macOS Sierra Now Available as Free Update,09-20-16
"Apple's iOS 11 leaves Bluetooth, Wi-Fi running in background",09-20-17
Market Chatter: Fitbit Shares Soar on Report it May Mull Sale,09-20-19
Raymond James: Apple hasn't begun final production of iPhone X,09-20-17
Stocks Slide After Chinese Trade Delegation Cancels Visits to US Agricultural States,09-20-19
"Dow, S&P 500 Reverse Losses After US Rate Decision While Tech Weighs on Nasdaq",09-20-17
Apple's iPhone 7 bill of materials estimated higher than previous iterations,09-20-16
Apple gets tariff exclusion on some Mac Pro parts - Bloomberg,09-20-19
iPhone 7 teardown reveals shrinking margins,09-21-16
Apple App Store suffers first 'big hack attack',09-21-15
"New iPhones, Apple Watch go on sale",09-21-18
Market Chatter: Tesla Supply Management Head Resigns,09-21-18
"Hong Kong Hang Seng Index Trades Flat, Off Slightly On Fed Outlook",09-21-17
"iPhone 6s & iPhone 6s Plus Arrive on Friday, September 25",09-21-15
"Should you buy Apple, Capital One, 3D Systems, AT&T or Walgreens Boots Alliance?",09-21-17
"Apple trade offers a 4% return in 30 days, or find similar option trades on Wells Fargo & Co., Marriott International, Starwood Hotels & Resorts Worldwide, and Merrimack Pharmaceuticals",09-21-16
"Technical Coverage on Stocks from Diverse Sectors -- Williams Companies, Apple, Ford, General Motors and Coca-Cola",09-21-15
"Financialinsiders.com Earnings Recap Week Ending September 21st, 2018",09-21-18
Financial Times: Apple approached McLaren Technology Group regarding acquisition,09-21-16
