headlines,date
Market Chatter: Apple to Sell Older iPhone Models Fitted With Qualcomm Chips in Germany,02-14-19
Google’s Waze Deal Is a Likely Target in FTC Antitrust Sweep,02-14-20
Dean Of Valuation' Says Tesla Still Has Long Way To Go To Justify Stock Price,02-14-20
Sector Update: Tech,02-14-18
Apple in talks for first order from Chinese chipmaker - Nikkei,02-14-18
Older iPhones return to Germany,02-14-19
Sector Update: Technology Stocks Higher in Pre-Market Trade; Earnings Drive Stock Movement,02-14-18
Sector Update: Top Tech Stocks Narrowly Mixed Pre-Market Friday,02-14-20
Sector Update: Most Tech Stocks Drop In Thursday's Pre-Bell Trading,02-14-19
"Option Trading Strategies on Apple, Cenovus Energy, Facebook, General Electric, and NVIDIA",02-14-19
"Roku Shares Surge As Disney, Apple Launches Drive Solid Q4 Revenue Gains",02-14-20
Is It Time to Buy Nike Stock?,02-14-20
"BMO Capital Markets reissues Alphabet at Outperform, models 6M Pixel units for 2017",02-14-17
Market Chatter: Apple Said in Talks for First Order From Chinese Chipmaker,02-14-18
Apple to reopen a store in Shanghai on Feb. 15,02-14-20
Apple reopening Shanghai store,02-14-20
"Market Chatter: Google, Amazon, Apple, Microsoft, Facebook Targeted in EU Unfair Practices Digital Rules",02-14-19
Alphabet Cuts Off YouTube TV Subscriptions Through Apple's App Store,02-14-20
"Bridgewater, Viking among big hedge funds that added Tesla in Q4 before rally",02-14-20
Market Chatter: Apple Reportedly to Reopen Store in Shanghai Feb. 15,02-14-20
Apple designing 5G iPhone antenna - Fast Company,02-14-20
All 30 Dow Stocks Ranked: The Analysts Weigh In,02-14-20
Market Chatter: Apple Reportedly Designing Own Antenna for 5G iPhone,02-14-20
"Stock Market Today: Nvidia Rips, Roku Dips",02-14-20
"Buffett boosts airline bets, buys Monsanto and Sirius XM",02-14-17
Roku Stock Spikes Then Reverses After Fourth-Quarter Report,02-14-20
Apple Accused by Ex-Exec It’s Suing of Poaching His Staff,02-14-20
Ex-Apple exec says iPhone maker is doing same thing to his startup that it's suing him over,02-14-20
Facebook and Google Face Real Regulatory Risk. The Pain Is Just Starting.,02-14-20
Market Chatter: Apple Buys DataTiger,02-14-19
Apple acquires marketing startup DataTiger,02-14-19
Market Chatter: Teva Shares Surge After-Hours As Berkshire Reports $358 Mln Stake,02-14-18
"Buffett's Berkshire takes stake in Red Hat, reduces Apple",02-14-19
MTNewswires After-Hours News Movers,02-14-19
Apple Is Designing Its Own 5G Antennas,02-14-20
Big investor moves in latest 13-F filings,02-15-18
There’s No Doubt Roku Is Growing Fast. But Analysts Are Split on the Stock.,02-15-20
Sector Update: Tech,02-15-18
Omni-Channel Payment Processors Embrace the Times,02-15-17
Golf star Francesco Molinari: Why I use big data,02-15-20
Sector Update: Technology Stocks Higher in Pre-Market Trade; Cisco Surges on Q2 Beat,02-15-18
Sector Update: Tech Stocks Mixed In Friday's Pre-Bell Trade,02-15-19
Berkshire's Apple trim wasn't Buffett,02-15-19
"Berkshire Hathaway Increases Bets on Airlines, Apple But Sells Out Kinder Morgan, NOW, Deere",02-15-17
Inside Berkshire Hathaway’s Future Without Warren Buffett,02-15-20
Market Chatter: Apple Said In Talks With China's BOE Technology For Supply of Future iPhone Displays,02-15-17
Midday Update: Wall Street Shrugs off Inflationary Pressures as 10-Yr Yield Backs off 3.0%,02-15-18
"Greenlight Takes Stake in Fred's, Monsanto, Raises Holdings in Apple & Rite Aid",02-15-17
Market Chatter: Berkshire Hathaway Move to Trim Apple Stake Nothing to Do With Buffett,02-15-19
"Apple Q4 performance: 12% China growth, 51% of global smartphone revenue",02-15-18
Afraid of sky-high stock valuations? Consider this ‘deep value’ strategy,02-15-20
Wall Street Ignores Inflation Risk as Rally Extends to Day 5,02-15-18
"U.S. Woman From Cruise Falls Ill as 2,200 Head Home: Virus Update",02-15-20
Close Update: Inflation Fears Fail to Dent Wall Street's Euphoria,02-15-18
"Equities Advance for Fifth Straight Day as Tech, Utilities Drive Gains",02-15-18
Sector Update: Tech,02-16-18
"Apple, Microsoft, and Intel Stock Have Been Killing It. Why Fund Managers Don’t Have Enough.",02-16-20
Sector Update: Technology Stocks Higher in Pre-Market Trading; Iron Mountain Beats Q4 Estimates,02-16-18
"WWDC, Apple’s Worldwide Developers Conference, returns to San Jose June 5-9, 2017",02-16-17
Regulators should allow RTL and ProSieben to merge - Rabe,02-16-20
Apple Files Registration to Sell Fixed-Rate Notes Maturing Up to 2046,02-16-16
NAR: Samsung looking for OLED buyers after iPhone X cuts,02-16-18
Apple WWDC 2017 scheduled for June 5-9,02-16-17
Intel Facing 32 Lawsuits Over Spectre and Meltdown Security Flaws,02-16-18
Market Chatter: Apple Pay Goes Live in China Feb 18: Reuters,02-16-16
GBH sets Apple target at 18.5% upside,02-16-18
Smartwatches call time on the Swiss industry,02-16-20
Nintendo Is Likely to Suffer Global Switch Shortages From Virus,02-16-20
"EU Fights For ‘Purpose’ in Grand Plan for Tech, AI Rules",02-17-20
Apple's Indian dream begins with iPhone SE,02-17-17
Apple news roundup,02-17-16
"Pre-Market Briefing: US Equities Futures Slip, Echoing Overseas Markets",02-17-17
Apple issues revenue warning over coronavirus,02-17-20
Market Chatter: Apple Said to Start Assembling iPhone SE in India in Coming Months,02-17-17
Wall Street Sees Lower Open Ahead of Holiday Weekend,02-17-17
The Stock Market Is Up About 5% Through Presidents Day. Here’s What Happens Next.,02-17-20
"Covered Call Alerts For Apple, Fitbit, Ambarella, Sarepta Therapeutics and ADT Released By InvestorsObserver",02-17-16
"Apple Opposing FBI's ""Dangerous Precedent"" to Create iPhone Hack",02-17-16
Icahn and Einhorn Cut Stake in Apple,02-17-16
"Tech Daily: Zuckerberg in Europe, EU Industrial Data, YouTube Dumps App Store, More",02-17-20
Hagens Berman: Court Affirms Potential $450 Million Settlement with Apple in E-books Price-Fixing Class Action,02-17-16
Apple reportedly orders 5M-6M Watch units; car speculation swirls,02-17-15
Apple Shares Up 1%; Court Affirms Potential $450 Mln Settlement over E-Books Price-Fixing Class Action,02-17-16
Investor Update on Quarterly Guidance,02-17-20
Apple says will not meet revenue guidance for March quarter due to coronavirus outbreak,02-17-20
"U.S. mulls cutting Huawei off from global chip suppliers, with TSMC in crosshairs",02-17-20
Apple Sales Will Miss; U.S. Cruisers Quarantined: Virus Update,02-17-20
Apple warns it will miss quarterly revenue target due to effects of coronavirus,02-17-20
Apple warns on revenue for March quarter,02-17-20
Apple says coronavirus effects will cause revenues to fall short of guidance,02-17-20
Apple Says It Will Miss Its Revenue Forecast Because of the Coronavirus,02-17-20
"Apple Scraps Q2 Revenue Guidance; Says Coronavirus Will Hit iPhone Supplies, China Demand",02-17-20
--Apple Says to Miss March Quarter Revenue Guidance Due to Coronavirus,02-17-20
Apple Won’t Meet Quarterly Revenue Target Due to Coronavirus,02-17-20
"U.S. stock futures retreat, Asia dips after Apple warns on virus impact",02-17-20
"WRAPUP 8-China sees fall in coronavirus deaths, WHO urges caution, Apple takes hit",02-17-20
Apple unlikely to meet revenue guidance due to coronavirus impact,02-17-20
"FOREX-Euro edges lower on economic pessimism, Aussie hit by rate outlook",02-17-20
Global Markets: Stocks fall after Apple warns on coronavirus impact,02-17-20
GLOBAL MARKETS-Stocks fall after Apple warns on coronavirus impact,02-17-20
"Australia, NZ dollars swoon as economic costs of epidemic mount",02-17-20
Nikkei falls to two-week low as Apple warning hurts technology stocks,02-17-20
Samsung offers phone delivery service for test use to ride out coronavirus impact,02-17-20
"VEGOILS-Palm oil slips on prospects of higher output, lower exports",02-17-20
Apple's Virus Cut Puts All Eyes on Tech Bellwether,02-17-20
SE Asia Stocks-Most down as Apple's warning rattles sentiment; Indonesia up,02-17-20
"Sensex, Nifty drop as Apple's warning signals virus impact",02-17-20
"FOREX-Euro on back foot before ZEW data, rate cut talk hurts Aussie",02-18-20
Gold rises on mounting business impact from virus outbreak,02-18-20
PRESS DIGEST- New York Times business news - Feb. 18,02-18-20
"Samsung poised to benefit from China virus woes afflicting Apple, other rivals",02-18-20
EM ASIA FX-Asian currencies slip on concerns over rising virus impact to businesses,02-18-20
GLOBAL MARKETS-Stocks under pressure as Apple sounds warning on coronavirus,02-18-20
SoftBank spends $2.5 bln to get second Vision Fund off the ground -sources,02-18-20
Apple Expects Virus Outbreak to Hit Q1 Revenue,02-18-20
Topix sinks to near 4-month low as Apple warning hurts tech shares,02-18-20
European shares slump as Apple warning hammers tech sector,02-18-20
Tech Investors Jolted by Apple Pin Hopes on a Fast Turnaround,02-18-20
Apple to Miss Quarterly Revenue Guidance Due to Coronavirus Impact,02-18-20
Apple takes hit from coronavirus,02-18-20
German bond yields most negative in two weeks on coronavirus caution,02-18-20
Hong Kong shares slip as Apple's warning weighs on sentiment,02-18-20
Apple Shares Fall 4.2% in U.S. Pre-Market Trading After Warning,02-18-20
Wildfires Are Just Beginning of Australian Dollar’s Climate Woes,02-18-20
EMERGING MARKETS-EM stocks reel under pressure from virus impact on businesses,02-18-20
"Nikkei 225 Down 1.4%; Sells Off on Coronavirus Outlook, Apple Revenue Warning",02-18-20
Infineon sees only minor impact from coronavirus,02-18-20
"If Apple is hurting due to the coronavirus, its suppliers and rivals likely are too",02-18-20
Hong Kong Hang Seng Slides 1.54% On Coronavirus Concerns; Shanghai Up Slightly,02-18-20
SE Asia Stocks-Most markets slip after Apple warns on coronavirus impact,02-18-20
Stocks under pressure as Apple sounds warning on coronavirus,02-18-20
Apple Lowers Second-Quarter Revenue Guidance as Coronavirus Impacts iPhone Manufacturing in China,02-18-20
YOUR MONEY-What it means to invest with a gender lens,02-18-20
"European chip stocks tumble on Apple warning, while HSBC slumps on profit slide",02-18-20
Apple Is Handcuffed to the iPhone. Just Like Its Customers,02-18-20
Apple’s coronavirus sales warning hits global stocks,02-18-20
"GRAPHIC- 20 years after dot-com peak, tech dominance keeps investors on edge",02-18-20
Apple’s biggest iPhone plant faces continued worker shortages over coronavirus,02-18-20
Apple's stock cutting more than 70 points off the Dow's price,02-18-20
"Apple, Coronavirus, Walmart, Legg Mason and Pier 1 - 5 Things You Must Know Tuesday",02-18-20
Microsoft Stock Could Keep Surging. How to Play It With Stock Options.,02-18-20
Berkshire unloads a bit more of Apple stake,02-18-20
Apple’s Coronavirus Warning Has Tech Stocks Falling. The Market Is Dropping.,02-18-20
US STOCKS-Apple's surprise sales warning pressures futures,02-18-20
FirstFT: Today’s top stories,02-18-20
Apple set to lose title of most valuable U.S. companies to Microsoft,02-18-20
Apple's surprise sales warning pressures futures,02-18-20
Spain sends bill on taxing web giants' Spanish revenues to parliament,02-18-20
US Futures Fall as Apple Revenue Warning Weighs on Sentiment,02-18-20
Research Alert: CFRA Maintains Buy Recommendation On Shares Of Apple Inc.,02-18-20
"Dow Jones Futures: Apple Warns On Coronavirus, Walmart Earnings Miss",02-18-20
Will Apple's Coronavirus Woes Affect Supplier Stocks As Well?,02-18-20
"Apple suppliers, semi stocks drop on warnings",02-18-20
"GLOBAL MARKETS-Apple virus warning shakes stocks, euro near three-year low",02-18-20
"Coronavirus threatens Apple supply chain, sales; shares drop",02-18-20
Sector Update: Tech Heavyweights Trade Lower Pre-Bell Tuesday,02-18-20
Wall Street Heads South Pre-Bell as Apple Revenue Warning Weighs on Sentiment,02-18-20
Apple Is Gut-Check Test for Traders Who Have Absorbed Every Blow,02-18-20
Apple Investors Get Nervous After Tech Giant Cautions on Coronavirus Impact,02-18-20
History of Apple: Facts and Latest Developments,02-18-20
Apple Warned About Damage From the Coronavirus. Analysts Say It’s Just a Blip.,02-18-20
US STOCKS-Apple's surprise sales warning sets Wall St for lower open,02-18-20
TREASURIES-Yields fall as Apple sales warning dents risk appetite,02-18-20
"20 years after dot-com peak, tech dominance keeps investors on edge",02-18-20
Dow Jones Today: Stocks Dip Early On Apple Warning; Tesla Surges Again,02-18-20
"Apple Inc., Intel share losses lead Dow's nearly 100-point drop",02-18-20
FOREX-Dollar rises as weak German data hurts euro,02-18-20
"Apple’s coronavirus warning wasn’t a total surprise, but magnitude rattles Wall Street",02-18-20
Apple Drops After Warning But Analysts See Short-Term Hit,02-18-20
EMERGING MARKETS-Latam assets shaky on fears of virus impact on companies,02-18-20
RPT-WRAPUP 7-China sees fall in coronavirus deaths but WHO urges caution,02-18-20
US STOCKS-Apple's surprise sales warning pressures Wall St,02-18-20
"Stocks Slump as Coronavirus Spread, Tech Sell-Off Dampen Sentiment",02-18-20
Chip Stocks Slide as Apple Warns on China Supply-Chain Issues,02-18-20
CANADA STOCKS-TSX flat as Apple's sales warning fuels coronavirus fallout worries,02-18-20
"--Analyst Actions: Canaccord Genuity Cuts Apple's Price Target to $345 From $355 on COVID-19 Impact, Reiterates Buy Rating",02-18-20
Apple Outlook Cut Renews Questions About China Over-Reliance,02-18-20
"Apple Inc., Dow Inc. share losses contribute to Dow's 165-point fall",02-18-20
"Despite Apple's Warning, Market Not Embracing Negative Narrative",02-18-20
"Apple Lowers Guidance, Walmart Misses in Q4",02-18-20
"Analyst Actions: Barclays Cuts Apple Price Target to $297 From $304, Maintains Equal Weight Rating",02-18-20
The Coronavirus Is Still Derailing China’s Economy. Here’s What to Watch.,02-18-20
Apple AirTags launching in Q3?,02-18-20
"Apple Inc., Dow Inc. share losses lead Dow's nearly 275-point drop",02-18-20
US STOCKS-Wall Street dragged down by Apple's shock sales warning,02-18-20
Stock Market Falls On Apple Sales Warning; Key Earnings Movers Include InMode And Walmart,02-18-20
Oil Retreats After Apple Warning Rekindles Coronavirus Fears,02-18-20
"Analyst Actions: DA Davidson Lowers Apple's Price Target to $370 From $385, Maintains Buy Rating",02-18-20
"Analyst Actions: FBN Securities Cuts Apple's Price Target to $340 From $350, Maintains Outperform Rating",02-18-20
US Stocks Fall With Treasuries While Gold Jumps as Apple's Sales Warning Brings Home Impact of China Coronavirus Outbreak,02-18-20
"‘Silent melt-up’ in stocks to continue, but switch into value delayed until virus fears recede, strategist says",02-18-20
Apple's iPhone SE successor hits delay - NAR,02-18-20
Taiwan Semi Stock Drops as U.S. Reportedly Considers New Huawei Chip Restrictions,02-18-20
"--Analyst Actions: Zacks Investment Research Lifts Apple's Price Target to $374 From $373, Maintains Outperform Rating",02-18-20
US Stocks Step Back From Record Highs as Coronavirus Worries Pressure Apple Sales,02-18-20
Apple Warning Boosts Trade in Chip-Heavy Fund to Two-Year High,02-18-20
Coronavirus to Hurt Apple Earnings: Time to Buy These ETFs?,02-18-20
The Dow Is Down 213 Points Because of Apple’s Bad News About the Coronavirus,02-18-20
"Apple Inc., Dow Inc. share losses lead Dow's nearly 200-point drop",02-18-20
Midday Report: US Stocks Drop With Oil; Gold Jumps to Seven-Year High; Apple Sales Warning Underscores China Coronavirus Impact on 2nd Quarter,02-18-20
US STOCKS-Wall Street skids after Apple's shock sales warning,02-18-20
Paul Krugman on Making Wonkery Accessible to the Public,02-18-20
Apple Should Continue to Fall Say the Charts,02-18-20
"Apple may miss mass production schedule for new, cheaper iPhone: Nikkei",02-18-20
Intel Is in Talks to Sell Connectivity Unit to MaxLinear,02-18-20
Sector Update: Tech Stocks Sagging After Apple Q2 Sales Warning,02-18-20
"Gold tops $1,600 for first time since 2013 as coronavirus fears spur haven demand",02-18-20
"Apple, iPhone suppliers tumble on coronavirus warning",02-18-20
Apple Stock: What Matters Most Is What Happens Wednesday,02-18-20
"Update: Berkshire Hathaway Buys Kroger and Two ETFs, Cuts Stake in Phillips 66, Apple",02-18-20
"Apple's Coronavirus Warning, Tesla Climbs & A Strong Buy Chip Stock - Free Lunch",02-18-20
Apple's coronavirus profit warning weighs on chip supplier stocks,02-18-20
Apple preps for life after iPhone,02-18-19
China Bought Time With Quarantine; Russian Borders: Virus Update,02-18-20
FOREX-Dollar climbs as weak German data dents euro,02-18-20
Apple Falls Behind Samsung in Mobile Market Share as iPhone Sales Drop 4.4%,02-18-16
"US STOCKS-Dow, S&P 500 down after Apple's sales warning but off session lows",02-18-20
16 Stocks Warren Buffett Is Buying and Selling,02-18-20
EMERGING MARKETS-Latam equities at one-week low as Apple warning sours risk appetite,02-18-20
Sector Update: Tech Stocks Almost Recover From Early Slide Fueled by Apple Q2 Sales Warning,02-18-20
Apple and Alibaba's Coronavirus Warnings Will Probably Be Followed by Others,02-18-20
US Stocks Indicated to Close Mostly Lower as Apple's Q2 Sales Warning Shows Extent of Coronavirus Impact,02-18-20
Stocks Slump on Apple’s Warning; Treasuries Rally: Markets Wrap,02-18-20
Dow Sells Off After Apple Warns That Virus Outbreak Will Hurt Sales,02-18-20
"China Coronavirus Concerns Weigh On Apple Stock, Chipmakers",02-18-20
"Nasdaq ekes out record finish, other stock indexes slump as coronavirus takes toll on Apple sales",02-18-20
"Equities End Mixed, Pulled Lower by Apple's Warning on First-Quarter Guidance Over COVID-19",02-18-20
It Isn’t Just Apple. Virus Issues Will Affect a Wide Swath of Tech Firms.,02-18-20
Close Update: US Stocks Mostly Lower as Apple's Q2 Sales Warning Shows Extent of Coronavirus Impact,02-18-20
Tesla Stock Is Still Skyrocketing. Critics Are Giving Up.,02-18-20
The Economic Hit From Coronavirus Is All in Your Mind,02-18-20
Apple Analyst Says Cupertino's Semiconductor Suppliers Caught At Center Of Coronavirus Outbreak,02-18-20
The Dow Fell 166 Points Because Apple Stock Is Exposed to the Coronavirus,02-18-20
"Buy Roku Stock on the Dip as a Bet on Netflix, Disney & Streaming TV Growth?",02-18-20
US Indexes Mostly Lower After Apple's Coronavirus Warning,02-18-20
"Dow, S&P 500 hurt by Apple warning",02-18-20
"Tech Daily: AAPL Guidance Cut, QCOM Chooses Samsung, Huawei Restrictions, AMZN Climate Fund",02-18-20
Apple's Coronavirus Warning to Wall Street,02-18-20
"WRAPUP -New coronavirus cases in China fall for second day as death toll passes 2,000",02-18-20
"FOREX-Dollar shines against euro, riskier peers as virus hit widens",02-18-20
"GLOBAL MARKETS-Asian shares nudge up as virus spread slows, euro fragile",02-18-20
"Australia, NZ dollars weaken on fears of virus impact on economy",02-18-20
WRAPUP 6-Criticism of Japan's effort on coronavirus cruise ship as passengers leave,02-18-20
Japanese shares recoup as Apple regains some lost ground,02-18-20
"GLOBAL MARKETS-Asia stocks rise on lull in virus worry, euro still weak",02-19-20
"Top 5 Things to Know in the Market on Wednesday, February 19th",02-19-20
REFILE-Japanese shares end higher as Apple regains some lost ground,02-19-20
US Stock Market: Apple Suppliers at Risk along with China-exposed Chipmakers,02-19-20
Samsung jumps deep into mobile payments,02-19-15
"Apple Low-Cost iPhone Production Delayed, Hit By Coronavirus",02-19-20
Apple suffers further supply chain setbacks in China,02-19-20
"GLOBAL MARKETS-China stimulus hints, slowing spread of virus lift stocks",02-19-20
Apple gains time to respond to iPhone hack order,02-19-16
EMERGING MARKETS-EM assets gain ground as new coronavirus cases drop,02-19-20
"Dow Jones Futures: AMD Ignores Apple-Led Retreat; Enphase, SolarEdge, Amedisys, 10X Genomics, Palomar Are Key Movers",02-19-20
"Market Chatter: Apple Reshuffles Management Team in Strategic Shift Away from iPhone, Ruffles Staff as Projects Put On Hold",02-19-19
Brussels proposes new digital strategy,02-19-20
"Futures rise on China stimulus hopes, signs of slowing virus spread",02-19-20
Sector Update: Tech Stocks Retreat Pre-Market Tuesday,02-19-19
"US STOCKS-Wall St poised for higher open on China stimulus hopes, signs of slowing virus spread",02-19-20
"Nasdaq hits record high at open on China stimulus hopes, drop in new virus cases",02-19-20
NASDAQ Hits Another Closing High Despite Apple's Warning,02-19-20
Sector Update: Top Tech Stocks Rise Pre-Bell Wednesday,02-19-20
Global Payments Says Merchants in China Can Accept China UnionPay Payments Made With ApplePay,02-19-16
"Thinking about trading options or stock in Apple, Cisco Systems, Micron, Uber, or Wells Fargo?",02-19-20
"Option-trading strategies on Apple, Facebook, General Electric, Netflix, and NVIDIA",02-19-19
TREASURIES-Yields rise with stocks on China stimulus hopes,02-19-20
"Analyst Actions: DA Davidson Cuts Price Target on Apple to $370 From $385, Maintains Buy",02-19-20
"China’s tourism, automotive industries sink amid COVID-19 outbreak",02-19-20
"Dow Inc., JPMorgan Chase share gains contribute to Dow's 81-point jump",02-19-20
"Stock market bulls will trample the bears this year, according to the weight of the evidence",02-19-20
Payment Data Systems Announces Apple Pay Support for Akimbo Prepaid MasterCard,02-19-16
"US STOCKS-S&P 500, Nasdaq scale new highs on China stimulus hopes, drop in new virus cases",02-19-20
How Pandora And Spotify Pay Artists,02-19-20
AI's Growing Adoption in Agriculture a Boon for These Stocks,02-19-20
U.S. Attorney Gen. questions need to shield big tech from liability for user posts,02-19-20
Apple Court Response to FBI Now Due Feb 26 Instead of Feb 19,02-19-16
There's Some Market Choppiness and Inconsistency That's Quite Challenging,02-19-20
"Stock Market News for Feb 19, 2020",02-19-20
"The Zacks Analyst Blog Highlights: Apple, American Express, Starbucks, Goldman Sachs and BCE",02-19-20
"The Zacks Analyst Blog Highlights: Apple, Eagle Bancorp Montana, Onconova Therapeutics, Proteostasis Therapeutics and Abeona Therapeutics",02-19-20
"The Zacks Analyst Blog Highlights: Cirrus Logic, Skyworks, Qorvo, Lumentum and Broadcom",02-19-20
"Barr Takes Aim at Legal Shield Enjoyed by Google, Facebook",02-19-20
"Mania has taken hold in the equity market and there is “no respect” for risk, says one strategist",02-19-20
"US STOCKS-S&P 500, Nasdaq scale new highs on China stimulus hopes",02-19-20
"David Rolfe's Firm Cuts Apple, Visa",02-19-20
"Apple Aside, the Coronavirus Hasn’t Caused Many Companies to Adjust Their Outlooks",02-19-20
US Stocks Push Higher as China Offers Aid to Tech Companies Hurt by Coronavirus Outbreak,02-19-20
"Midday Update: Stocks Advance Sending S&P 500, Nasdaq to Record Highs as Coronavirus Concerns Ease",02-19-20
"US STOCKS-S&P 500, Nasdaq reach new heights on China stimulus hopes",02-19-20
Worldwide Smartphone Sales Growth Underpinned by Burgeoning Demand from Emerging Markets,02-19-16
Apple's Production of New Affordable iPhone Reportedly Delayed Until March,02-19-20
--DoJ Files Order To Compel Apple to Comply with FBI Order To Create Software to Access Data on Terrorist's iPhone: CNBC,02-19-16
"REFILE-Fed policymakers cautiously optimistic on U.S. economy despite new risks, minutes show",02-19-20
How The Coronavirus May Be Impacting Your Portfolio,02-19-20
Qualcomm argues against Apple's patent workaround,02-19-19
Justice Department Moves to Compel Apple to Comply With FBI on California Shooter's iPhone,02-19-16
Apple's Q4 HomePod shipments grew 45%,02-19-19
"US STOCKS-Indexes climb on China stimulus hopes, hold ground after Fed minutes",02-19-20
"GLOBAL MARKETS-Stocks scale fresh peaks on slowing virus, dollar gains",02-19-20
"S&P 500, Nasdaq close at records in tech-led stock rally",02-19-20
"Fed officials more upbeat about the economic outlook this year, minutes show",02-19-20
"US STOCKS-S&P 500, Nasdaq hit record closing highs, lifted by China stimulus hopes",02-19-20
"Stocks End Higher as New COVID-19 Cases Fall, Report Chinese Government to Help Businesses Affected by Outbreak",02-19-20
Trump calls for Apple boycott in response to San Bernardino controversy,02-19-16
US Indexes Close Higher Wednesday With China's Support Comments,02-19-20
"For Clues on How Apple's Quarter Is Shaping Up, Keep an Eye on Its Suppliers",02-19-20
Jim Cramer: Is It Too Late to Sell and Buy Back Again?,02-19-20
Irish regulator readies draft decisions in first big tech privacy probes,02-19-20
Bloomberg: Apple's first car could arrive by 2020,02-19-15
WRAPUP 2-Coronavirus fears grip South Korean city; China reports drop in new infections,02-19-20
INSIGHT-Manufacturers entangled in logistical nightmare as virus-hit China limps back to work,02-19-20
REFILE-Taiwan's Foxconn warns of negative revenue impact from virus outbreak,02-20-20
Comic: Stock Markets Shrug Off Apple’s Coronavirus Warning,02-20-20
S.Korea's Hynix says 800 workers to stay home after trainee had contact with virus patient,02-20-20
Chip designer Dialog de-risks with $500 mln Adesto deal,02-20-20
War With Netflix and Disney Looms for India’s Top Local Streamer,02-20-20
Investor Day Meetings Provide a Chance to Reap Big Gains. How to Play Them With Options.,02-20-20
"EU privacy body warns of privacy risks in Google, Fitbit deal",02-20-20
Apple Demands To Stop Publication Of Book Written By Employee Because It Allegedly Reveals Company Secrets,02-20-20
HSBC sees Apple's China woes continuing,02-20-19
Major Stock Indexes Heading for Milestones: 5 Top Picks,02-20-20
"As analysts lower the bar, 2020 earnings will beat — but market risks linger, Goldman forecasts",02-20-20
