headlines,date
Market Chatter: Apple Said to Have Begun Trial Production of Highest-Selling iPhone 6s Plus in India; Move Could Cut Prices,04-13-18
Market Chatter: Apple Firms More Than 1.5% After Motor Trend Tweet Suggests Apple Car,04-13-16
Analyst says Apple could double its dividend; leaked memo shows employee arrests,04-13-18
"IBM buys health tech startups, launches Watson Health, expands Apple deal",04-13-15
"Apple Faces Several 'Existential Threats' That Include Messenger Bots, UBS Says",04-14-16
"Mobile & Online Payments, Smart Wallets & Contactless Payment Systems Could Reach $3.6 Trillion This Year",04-14-16
Apple’s Worldwide Developers Conference Kicks Off June 8 at San Francisco’s Moscone West,04-14-15
Sector Update: Technology Stocks Mixed In Pre-Market Trade,04-14-16
Sector Update: Tech,04-14-16
Apple gets a second chance to defend pinch-to-zoom,04-14-17
Apple wades into the Toshiba chip sale auction,04-14-17
Apple Announces ResearchKit Available Today to Medical Researchers,04-14-15
Microsoft Sues Justice Department Over Secrecy of Investigations Into Cloud Users' Data,04-14-16
Apple buys 3D/multi-image camera module developer LinX,04-14-15
Apple reportedly weighs App Store search ads that would compete with Facebook/Google,04-15-16
"Market Chatter: Apple Considering Paid Search Results, Other Changes in App Store",04-15-16
Sector Update: Tech,04-15-16
Sector Update: Technology Stocks Edge Lower In Pre-Market Trade,04-15-16
Sector Update: Most Tech Giants Rally Pre-Market Monday,04-15-19
Apple moves another step forward with self-driving car efforts,04-15-17
Apple spending $500M+ on games - Bloomberg,04-15-19
"Option-trading opportunities on Apple Inc., Citigroup Inc., The Walt Disney Co., The Goldman Sachs Group Inc., and Tesla Inc.",04-15-19
"Jury trial starts for Apple, Qualcomm battle",04-15-19
"Market Chatter: Apple Arcade Budget Reportedly Tops $500 Million, Incentives Offered to Developers for Exclusives",04-15-19
Apple -1% on report iPhone production slowdown will continue,04-15-16
Market Chatter: Apple Slides After Suppliers Say Reduced Output of iPhones to Continue For Another Quarter,04-15-16
Market Chatter: Huawei Says No Talks With Apple on 5G Chipsets; US to Push Allies on 5G Security,04-16-19
"Detailed Research: Economic Perspectives on General Dynamics, Garmin, Walgreens Boots Alliance, The Home Depot, Facebook, and Apple — What Drives Growth in Today's Competitive Landscape",04-16-18
Sector Update: Top Tech Stocks Advance Pre-Market Tuesday,04-16-19
"Critical Alerts For Apple, Petrobras, 3D Systems, Citigroup and Rite Aid Released By InvestorsObserver",04-16-15
"Ward, Smith & Hill Helps Secure $502.6M Patent Infringement Win Against Apple",04-16-18
"Legacy' Tech Names With Lower Regulatory Risk Offer Investor Opportunities, Goldman Says",04-16-18
Sector Update: Chip-Makers Lifting Tech Stocks to Moderate Advance,04-16-19
UBS: Apple won't return to peak sales in China,04-16-18
Market Chatter: Google Takes Down TikTok App in India to Comply With Court Order,04-16-19
Qualcomm and Apple Agree to Drop All Litigation,04-16-19
"--Qualcomm Spiking 17% - Drops All Ongoing Litigation with Apple, Companies Ink License Deal",04-16-19
"Qualcomm, Apple drop all litigation; QCOM +14.7%",04-16-19
Qualcomm Soars 17% on Agreement With Apple to Drop 'All Litigation Worldwide',04-16-19
Sector Update: Tech Stocks Drifting Off Mid-Day Highs,04-16-19
Qualcomm and Apple Agree to End All Litigation With Each Other as New Licensing Deal Reached,04-16-19
Robbins Geller Rudman & Dowd LLP Files Class Action Suit against Apple Inc.,04-16-19
"Close Update: Nasdaq Closes Above 8,000 as Stocks Post Modest Advance in Tuesday Trading",04-16-19
Equities End Higher as Financial Shares Lead Advance; Qualcomm Jumps 23% on Settlement With Apple,04-16-19
"LEAD PLAINTIFF DEADLINE ALERT: Faruqi & Faruqi, LLP Encourages Investors Who Suffered Losses Exceeding $500,000 In Apple, Inc. To Contact The Firm",04-16-19
"APPLE SHAREHOLDER ALERT BY FORMER LOUISIANA ATTORNEY GENERAL: KAHN SWICK & FOTI, LLC REMINDS INVESTORS WITH LOSSES IN EXCESS OF $100,000 of Lead Plaintiff Deadline in Class Action Lawsuit Against Apple Inc. - AAPL",04-16-19
Pre-Market Briefing: US Equities Futures Edge Lower; North Korea Tension Weighs,04-17-17
Market Chatter: Apple Said to Consider Options to Bid For Toshiba's Chip Unit,04-17-17
OPTIONS: Option Implied Volatility for Apple Suppliers after Patent Settlement With Qualcomm (QCOM),04-17-19
Intel Unveils Plan to Exit 5G Smartphone Modem Business,04-17-19
Apple talking to lidar suppliers - Reuters,04-17-19
"Be on Top of the Latest Developments: Complementary Research on Apple, Ford Motors, Avon Products, Pfizer and Transocean",04-17-15
Market Chatter: Apple Reportedly In Talks With Suppliers of Sensors For Autonomous Vehicles,04-17-19
Sector Update: Most Top Tech Stocks Rally Pre-Bell Wednesday,04-17-19
"--Qualcomm CEO Tells CNBC He Won't Disclose Apple Settlement Amount, Shares Up 13% Pre-Bell",04-17-19
Bloomberg: Apple planning Texture-based news subscription,04-17-18
"The Klein Law Firm Reminds Investors of Class Actions on Behalf of Shareholders of STMP, CAG, WSR and AAPL",04-17-19
Apple's Q1 iPhone ships miss estimates - OTR,04-17-19
Analyst Actions: RBC Capital Reiterates Apple Outperform Rating; Lifts PT to $157 from $155,04-17-17
WSJ: Apple in talks to launch Apple Pay in Canada this fall,04-17-15
Apple Gets License to Test Autonomous Cars in Calif,04-17-17
Market Chatter: Apple Plans to Launch Premium News Subscription Offering by Integrating Texture,04-17-18
Sector Update: Chipmakers Carrying Tech Stocks to Modest Gain,04-17-19
Meet the electric/autonomous vehicle ETF,04-17-18
CNBC: Facebook building entry to voice assistants,04-17-19
Market Chatter: Facebook Said to be Working on Producing Voice Assistant to Rival Amazon's Alexa,04-17-19
Sector Update: Tech Stocks Finishing Near Session Highs,04-17-19
SHAREHOLDER ALERT: Pomerantz Law Firm Investigates Claims On Behalf of Investors of Apple Inc. - AAPL,04-17-19
Bernstein Liebhard LLP Announces That A Class Action Has Been Filed On Behalf Of Apple Inc. Investors,04-17-19
Equities End Slightly Lower as Healthcare Stocks Lose 2.8%,04-17-19
Behind Apple's surprise settlement with Qualcomm,04-18-19
Hon Kong Hang Seng Up 0.74% On China Central Bank Easing,04-18-18
Apple Expands Global Recycling Programs,04-18-19
Sector Update: Tech,04-18-16
Sector Update: Technology Stocks Edge Lower In Pre-Market Trade,04-18-16
New iPhones getting front camera upgrade - Kuo,04-18-19
Sector Update: Tech Giants Declining in Pre-Market Trading Thursday,04-18-19
"CLASS ACTION UPDATE for STMP, WTW, NIO and AAPL: Levi & Korsinsky, LLP Reminds Investors of Class Actions on Behalf of Shareholders",04-18-19
Market Chatter: Apple Said to Test All-Screen Front For iPhone,04-18-17
Apple paying Qualcomm $9/iPhone - UBS,04-18-19
Sector Update: Tech Shares Edging Higher Monday; Apple Said to Ink Deal with Samsung for OLED Displays,04-18-16
Market Chatter: Qualcomm Appeals $1.2 Bln Fine on Apple Loyalty Payments,04-18-18
Market Chatter: Apple Slips 2% - Maybank Forecasts Significant Drop in Q3 iPhone Sales Vs. Yr-Ago,04-18-16
Apple’s Worldwide Developers Conference Kicks Off June 13 in San Francisco,04-18-16
"Apple, FBI to testify before House panels",04-19-16
Software is Eating the World and Mobile is Leading the Charge,04-19-17
"Apple Updates MacBook with Latest Processors, Longer Battery Life & New Rose Gold Finish",04-19-16
Sector Update: Tech,04-19-16
Sector Update: Technology Stocks Higher In Pre-Market Trade,04-19-16
"Do these Household Names Still Woo Investors - AAPL, PHG, SNE, and HAR",04-19-16
SHAREHOLDER ALERT: T INGN BA AAPL: The Law Offices of Vincent Wong Reminds Investors of Important Class Action Deadlines,04-19-19
"Thinking about buying stock in Apple, Advanced Micro Devices, NVIDIA, Procter & Gamble or Taiwan Semiconductor Manufacturing Company Limited?",04-19-18
"Covered Call reports for Apple, Bank of America, Cardinal Health, CVS Health Corp., and Walgreens Boots Alliance include trade ideas that offer returns of 23% or more!",04-19-17
"InvestorsObserver releases covered-call reports for Apple, Constellation Brands, eBay, Mattel Inc and Dow Chemical",04-19-16
"Taiwan Semi phone-based softness dragging Apple, other chipmakers",04-19-18
"Apple updates retina MacBooks with new CPUs, faster storage, rose gold option (updated)",04-19-16
"Apple Updates MacBook With New Processors, Longer Battery Life",04-19-16
All eyes back on Project Titan with German lab and Tesla hire in the mix,04-19-16
Market Chatter: Apple Hires Former Tesla Vehicle Executive Chris Porritt to Work on Vehicle Project,04-19-16
Midday Update: Earnings-Fueled Rally Stalls as Consumer Sector Suffers Miss,04-19-18
Apple Adds Earth Day Donations to Trade-in and Recycling Program,04-19-18
ASM International falls short and chipmakers stay in downdraft,04-19-18
"Close Update: S&P 500, Nasdaq Snap 3-Day Win Streak on Consumer and Tech Losses",04-19-18
"Equities Retreat in US as Tech, Consumer Losses Snap Win Streak for S&P, Nasdaq",04-19-18
"APPLE SHAREHOLDER ALERT BY FORMER LOUISIANA ATTORNEY GENERAL: KAHN SWICK & FOTI, LLC REMINDS INVESTORS WITH LOSSES IN EXCESS OF $100,000 of Lead Plaintiff Deadline in Class Action Lawsuit Against Apple Inc. - AAPL",04-19-19
"Hong Kong Hang Seng Off 0.94% On Tech and Energy Issues, Wall Street Cues",04-20-18
"Wall Street Pre-Bell Jittery; Europe Trading Down, Futures Red, Oil Down, Asia Soft",04-20-16
Sector Update: Tech,04-20-16
Sector Update: Technology Stocks Mostly Lower In Pre-Market Trade,04-20-16
Apple's reach for new screen supplier hits hurdles,04-20-18
"Analyst Actions: Morgan Stanley Lowers Apple Price Target to $200 From $203, Maintains Overweight Rating",04-20-18
BofA: Some 4-7% more downside in chips into Apple earnings,04-20-18
Morgan Stanley cautiously bullish into Apple report; OTR Global downgrades,04-20-18
Apple +0.8% as firms boost targets for iPhone demand,04-20-17
Stocks Extend Losses as Apple and Higher Yields Weigh Down Wall Street,04-20-18
"European Tech Firms Need Support to Grow Worldwide, Former Swedish Finance Minister Says",04-20-16
Midday Update: Stocks Lose Ground as Higher Yields And Tech Sector Selling Weighs on Wall Street,04-20-18
Wall Street Roiled by Climbing Yields and Tech Selling,04-20-18
Correction: Sector Update: Tech,04-20-16
"Close Update: Wall Street Loses Ground as Bond Yields Climb, Tech Sector Roiled by Apple and Chipmakers",04-20-18
Stocks Slide in US With Apple's Losses Handing Dow Third Straight Decline,04-20-18
"Report: Apple, device makers behind DOJ probe of telecom collusion",04-20-18
Apple delays scheduled earnings report by a day due to memorial (updated),04-20-16
Apple Delays Q2 Earnings Release By One Day to April 25 - Shares Slip 0.7%,04-21-16
Bloomberg: Apple hires Google satellite execs for new hardware team,04-21-17
Sector Update: Tech Stocks Slipping Near Closing Bell,04-21-17
How much did the FBI pay to hack the San Bernardino shooter's phone?,04-22-16
Apple still faces uphill battle in China,04-22-16
"Be on Top of the Latest Developments: Complementary Research on McDermott, J.C. Penney, Apple, Ford Motor, and Avon",04-22-15
"--Apple Reportedly Biggest AWS Customer, Spends More Than $30 Million a Month on Amazon Cloud",04-22-19
Apple spending $30M/month on AWS,04-22-19
Sector Update: Most Top Tech Stocks Fall In Monday Pre-Bell Trading,04-22-19
"Option-trading opportunities on Altaba Inc., Apple Inc., The Blackstone Group, Microsoft Corp., Stoneco Ltd.",04-22-19
"Market Chatter: Apple's iBooks, iMovies Shut Down in China: New York Times",04-22-16
"5G iPhone includes Qualcomm, Samsung - Kuo",04-22-19
Apple looms large in self-driving car push,04-22-17
"INVESTOR ACTION ALERT: The Schall Law Firm Announces the Filing of a Class Action Lawsuit Against Apple Inc. and Encourages Investors with Losses in Excess of $100,000 to Contact the Firm",04-22-19
"Apple Reportedly Will Launch 5G iPhones in 2020 with Modems from Qualcomm, Samsung, Analyst Says",04-22-19
US Stocks Pull Back as Technology Earnings Weigh,04-22-16
Report: Internal fighting slows Apple's efforts to improve cloud services,04-22-16
Market Chatter: Apple Spending More Than $30 Mln Per Month on Amazon Web Services,04-22-19
"LEAD PLAINTIFF DEADLINE ALERT: Faruqi & Faruqi, LLP Encourages Investors Who Suffered Losses Exceeding $500,000 In Apple, Inc. To Contact The Firm",04-22-19
Apple software bug lets hackers crash iPhones,04-23-15
Hong Kong Hang Seng Off 0.54% On Tech Weakness,04-23-18
Analyst Actions: Qualcomm's Price Target From DA Davidson Raised to $91 From $75 Amid Apple Agreement,04-23-19
Wells lowers iPhone outlook before earnings,04-23-19
Apple supplier could post record profits; HomePod orders slashed with suppliers,04-23-18
Sector Update: Most Top Tech Stocks Advance Pre-Market Tuesday,04-23-19
European antitrust regulators set deadline for Apple-Shazam probe,04-23-18
Apple's Q1 iPhone sales show X weakness; co. offers batteries for MacBook issue,04-23-18
Apple's Acquisition of Music Recognition App Shazam Gets 'In-Depth' European Probe,04-23-18
AT&T and Verizon Under DoJ Probe Relating to Antitrust Violations; JPMorgan Says Probe Could Imperil Sprint-T-Mobile Merger,04-23-18
"Apple's Quarterly iPhone Shipment Estimate Cut at Wells Fargo, Market Perform Rating Maintained",04-23-19
"S&P, Nasdaq Close at Record Highs, Boosted by Strong Earnings Reports",04-23-19
"--Analyst Actions: Goldman Sachs Raises Price Target on Apple to $182 From $140, Maintains Neutral Rating",04-24-19
Apple gets target boosts ahead of earnings,04-24-19
Analyst Actions: Qualcomm Price Target From RBC Cut to $75 From $80 Ahead of Q2 Report; Outperform Kept,04-24-18
Apple launching two new AirPods - Kuo,04-24-19
"Technology Hardware, Storage and Peripherals Stocks Review -- Apple, Hewlett-Packard, SanDisk, Seagate Technology, and QLogic",04-24-15
Analyst downgrades Skyworks on weak iPhone sales estimates,04-24-18
Wolfe Research names favorite large-cap longs and shorts,04-24-17
"Analyst Actions: Morgan Stanley Lifts Apple's Price Target to $234 From $220, Reiterates Overweight Rating",04-24-19
Sector Update: Tech Stocks Mixed Pre-Bell Wednesday,04-24-19
"Ireland, Apple tax appeal gets timeframe",04-24-18
"CLASS ACTION UPDATE for DPLO, WTW, EB and AAPL: Levi & Korsinsky, LLP Reminds Investors of Class Actions on Behalf of Shareholders",04-24-19
"Apple roundup: Street in ""full panic"" ahead of earnings, Samsung price negotiations",04-24-18
"CLASS ACTION ALERT: Brower Piven Notifies Investors of Class Action Lawsuit And Encourages Those Who Have Significant Losses From Investment In Apple, Inc. (NASDAQ: AAPL) To Contact Brower Piven Before The Lead Plaintiff Deadline",04-24-19
"SHAREHOLDER ALERT BY FORMER LOUISIANA ATTORNEY GENERAL: KSF REMINDS AAPL, BV, FLEX, BPI INVESTORS of Lead Plaintiff Deadline in Class Action Lawsuits",04-24-19
Apple Watch debut-year sales double iPhone in its first year,04-25-16
Tim Cook heads to the Oval Office,04-25-18
Apple's team of self-driving car experts,04-25-17
Apple's First Quarter Earnings Expected Lower Amid Slowing iPhone Sales; iPhone7 Seen a Boost,04-25-16
"Ford Boss Sees Apple, Google Emerging as Competitors in Car-Making Field, BBC Reports",04-25-16
Sector Update: Tech,04-25-17
Sector Update: Technology Stocks Edge Higher In Pre-Market Trade,04-25-17
Important Notice for Certain AC Wall Plug Adapters and Apple World Travel Adapter Kits,04-25-19
Sector Update: Top Tech Stocks Mixed In Thursday's Pre-Bell Trading,04-25-19
Street underestimates Apple Services potential - UBS,04-25-19
"Option-trading opportunities on Apple Inc., eBay Inc., Oracle Corp., Snap Inc., and Texas Instruments Inc.",04-25-19
"Analyst Actions: UBS Lifts Apple's Price Target to $235 From $215, Reiterates Buy Rating",04-25-19
"The Klein Law Firm Reminds Investors of Class Actions on Behalf of Shareholders of DPLO, CVS, UMC and AAPL",04-25-19
Cobalt Prices to Rocket as Tesla and Apple Scramble for Supplies,04-25-17
Market Chatter: Apple's New iPhone Said to Face Supplier Issues,04-25-17
Trump and Apple's Tim Cook meeting today,04-25-18
Midday Update: Dow on Course For Longest Losing Streak in a Year as Investors Rotate Into Bonds,04-25-18
Apple Holds Pattern of Reversing Earnings-Driven After-Hours Gains and Declines in Follow-On Regular Session,04-25-16
"LEAD PLAINTIFF DEADLINE ALERT: Faruqi & Faruqi, LLP Encourages Investors Who Suffered Losses Exceeding $500,000 In Apple, Inc. To Contact The Firm",04-25-19
Bernstein Liebhard LLP Announces That Approximately Seven Weeks Remain to Make a Motion for Lead Plaintiff in a Class Against Apple Inc.,04-25-19
WSJ: Speaker maker Sonos files confidentially for IPO,04-25-18
Hong Kong Hang Seng Edges Up 0.19% In Cautious Trading,04-26-19
OPTIONS: Straddle Prices for Companies Reporting Financial Results this Week,04-26-16
Sector Update: Top Tech Stocks Mixed Pre-Market Friday,04-26-19
"AT&T AUDIENCE Network New Original Series ""Fear{less} with Tim Ferriss"" Premieres May 30",04-26-17
Stocks Surrender Gains As Investors Brace for Apple Earnings,04-26-16
Another firm cuts iPhone outlook before earnings,04-26-19
"Apple, IBM, Costco among those expected to raise payouts next week",04-26-19
"Midday Update: Stocks Staying Above Water As Investors Brace for Apple Earnings, FOMC Conclusion",04-26-16
Bernstein expects Apple earnings to disappoint on iPhone weakness,04-26-18
"Correction: Midday Update: Stocks Staying Above Water As Investors Brace for Apple Earnings, FOMC Conclusion",04-26-16
"US Stocks Little Changed as Investors Await Fed Meeting, Apple Earnings",04-26-16
"Tesla Autopilot Chief Leaves for Intel; Succeeded by Former Apple Exec, Current Tesla Director",04-26-18
"Earnings Reaction History: Apple, Inc., 50.0% Follow-Through Indicator, 4.7% Sensitive",04-26-16
Apple discussed buying Intel modem chip business - WSJ,04-26-19
"Glancy Prongay & Murray LLP Announces Investigation on Behalf of Apple, Inc. Investors",04-26-19
Stocks Mixed as Investors Brace for Apple Earnings,04-26-16
"Qualcomm Lowers Estimates on Doubts About NXP Acquisition, Licensing Disputes, Canaccord Says",04-26-18
Close Update: Wall Street Reverses Gains After Tax Reform Package Release,04-26-17
Close Update: Stocks Eke Out Positive Close But Nasdaq Underwater on Upcoming Apple Results,04-26-16
Apple Reports Second Quarter Results,04-26-16
"Apple Misses Q2 Street Estimates, Guides Q3 Revenue Below Street, Adds $50 Bln to Capital Return Program",04-26-16
Stocks Lose Ground Late in Session After Trump Tax Plan Released,04-26-17
Apple's gross margin at 39.4% and iPhone ASP at $642; higher dividend declared,04-26-16
Notable earnings after Monday’s close,04-26-15
MT Newswires After Hours News Movers,04-26-16
"Apple's call: Smartphone market, Apple Watch, Apple Music, and M&A discussed",04-26-16
"AAPL, Q2, Operating Metrics Released",04-26-16
Apple Inc. Shareholder Investigation: Lawsuit Filed (AAPL),04-26-19
"SHAREHOLDER ALERT BY FORMER LOUISIANA ATTORNEY GENERAL: KSF REMINDS AAPL, ARA, AMRS, HCSG INVESTORS of Lead Plaintiff Deadline in Class Action Lawsuits",04-26-19
World shares soft as markets await the Fed,04-27-16
Nikkei 225 Off 0.36% Awaiting Central Bank Plans,04-27-16
Asian Stock Markets Retreat Awaiting Central Bank Policy Announcements,04-27-16
"Wall Street Pre-Bell Tech Averse, Europe Trading Mixed, Futures Red, Asia Down",04-27-16
"Beverages and Automobile Stock Watch: Complementary Research on Apple, Coca Cola, Ford, General Motors and Ambev",04-27-15
Apple Posts Decline in Second Quarter Revenue as Currency Headwinds Hit,04-27-16
"Morgan Stanley: 10 cheap big names, 10 expensive ones",04-27-15
Electric Bar Boom Sets Cobalt Up For Massive Price Spike,04-27-17
Stock Futures Negative as Apple Earnings Disappoint,04-27-16
U.S. Stock Futures Turn Negative as Apple Profits Fall,04-27-16
Sector Update: Tech,04-27-16
Sector Update: Technology Stocks Mainly Lower Pre-Bell,04-27-16
Stock Indexes Open Moderately Lower on Disappointing Apple Earnings,04-27-16
"--Analyst Actions: Apple Drops 7%, Oppenheimer Downgrades to Perform Vs Outperform",04-27-16
"Have cash, will travel?",04-27-17
"Market Chatter: Apple In Talks to Launch Money Transfer Service, Possibly Also Create Its Own Pre-Paid Cards",04-27-17
"--Analyst Actions: Goldman Sachs Maintains Buy on Apple, Cuts PT to $136 from $155 - Shares Down 6%",04-27-16
CNET: Amazon pursuing launch of Echo device with video screen,04-27-17
Stocks Buckle as Apple Earnings Blindsides Tech Sector,04-27-16
Midday Update: Wall Street Fighting Undertow After Apple Q2 Results Disappoints,04-27-16
Recode: Apple in talks over launching Venmo payments rival,04-27-17
"Stocks Mixed as Apple, Twitter Earnings Weigh on Tech Shares",04-27-16
CNET: Apple will have AR/VR headset in 2020,04-27-18
"--Body Reportedly Found at Apple HQ in Cupertino, CA; Investigation Ongoing: ABC News 7 - Shares Down 6%",04-27-16
Market Chatter: Apple to Launch Wireless AR/VR Headset in 2020,04-27-18
Market Chatter: FBI Won't Disclose How it Decrypted Apple iPhone: Bloomberg,04-27-16
"Stocks Snap Back as FOMC Remains Accommodative, Nasdaq Stays Negative on Fallout From Apple",04-27-16
Apple Expands Capital Return Program to $200 Billion,04-27-15
Apple Reports Record Second Quarter Results,04-27-15
"Close Update: FOMC Lifts Dow to Positive Turf, But Nasdaq Weighed Down by Apple",04-27-16
"Apple beats estimates, guides in-line, ups dividend",04-27-15
"Dow, S&P 500 Close Higher Second Day as Fed Leaves Rates Unchanged",04-27-16
Apple's gross margin tops guidance; iPhone ASP at $659,04-27-15
"Apple's call: iPhone upgrades, Apple Watch, China, margins discussed",04-27-15
World smartphone volumes drop for first time on annual basis,04-28-16
Singapore Apple Store to open soon,04-28-17
OPTIONS: Straddle Prices for Companies Reporting Financial Results the Week of May 1,04-28-17
"Mobile Payment Devices Gaining Steam as Consumers Seek Newest Smart Wallet Product That Offers Secure, Point-of-Sale Purchases",04-28-15
Streaming Music Access Popularity Continues to Grow at a Rapid Pace as Consumers Race to the Newest Music Streaming Apps,04-28-15
"Qualcomm Shares Drop 4% Pre-Bell After Warning of Lower Fiscal Q3 Sales, EPS as Apple Withholds Payments",04-28-17
"Critical Alerts For Apple, Du Pont, Youku Tudou, Westport Innovations and JetBlue Released By InvestorsObserver",04-28-15
"Apple gets target hikes, Icahn praise after FQ2 beat",04-28-15
Icahn: No longer holding Apple position,04-28-16
Market Chatter: Apple Shares Off 2%; Investor Carl Icahn Says Sold Stake in Company: CNBC,04-28-16
Close Update: Stocks Pulled Lower as Apple Weighs,04-28-16
Apple Seeks Changes in California Self-Driving Vehicle Proposals,04-28-17
Stocks Indexes Close Lower After Icahn Reports No Apple Holdings,04-28-16
Apple explains parental control app removal,04-28-19
"Hong Kong Hang Seng Up Nearly 1% on US, Sino Economic Data",04-29-19
Apple asks California to change proposed self-driving car testing policies,04-29-17
Lynx lowers iPhone forecast on sell-through,04-29-19
Sector Update: Leading Tech Stocks Mostly Lower In Monday's Pre-Bell Trading,04-29-19
"InvestorsObserver releases stock and option data on Apple, Canopy Growth, Dropbox, NVIDIA, and Occidental Petroleum",04-29-19
Morgan Stanley Equalweight on Skyworks Solutions Ahead of Earnings Report,04-29-19
Stocks Set to Post Weekly Declines as Technology Shares Slide,04-29-16
"EB, AAPL & NOK - Bronstein, Gewirtz & Grossman, LLC Reminds Shareholders of Class Action",04-29-19
Close Update: U.S. Stocks Head for Weekly Loss Amid Apple's Woes,04-29-16
"Tech, Health Care Drag S&P 500 to 1.26% Decline This Week; Energy Stocks Offset Larger Loss Following 5% Gain for Crude Oil",04-29-16
"Apple roundup: Watch component defect, tax disclosure, smartphone share",04-29-15
"SHAREHOLDER ALERT BY FORMER LOUISIANA ATTORNEY GENERAL: KSF REMINDS AAPL, ARA, AMRS, WTW INVESTORS of Lead Plaintiff Deadline in Class Action Lawsuits",04-29-19
Hong Kong Hang Seng Down 0.65% on China Growth Concerns,04-30-19
OPTIONS: Straddle Prices for Stocks Expected to Report Results This Week,04-30-18
Shorts Eke Out Historical Advantage Trading Apple off After-Hours Earnings Moves,04-30-19
"Analyst Actions: Barclays Lowers Apple Price Target to $157 from $168, Maintains Equalweight Rating",04-30-18
Sector Update: Tech Stock Majors Declining in Pre-Bell Trading Tuesday,04-30-19
"Thinking about buying stock in Apple, Alibaba, Canopy Growth Co., General Electric, or Pinterest?",04-30-19
Market Chatter: Apple May Give Shareholders Up to $400 Bln Back To Soothe Ire From Soft iPhone X Sales,04-30-18
Mergers and Earnings Prop Up Wall Street,04-30-18
Barclays thinks new iPhones won't include headphone adapter,04-30-18
"S&P 500 Movers: Arconic Tumbles 17%, Leads Losers; Andeavor Surges 14%",04-30-18
US Stocks Pare Early Gains Amid Earnings Onslaught,04-30-18
Midday Update: Wall Street Turns Defensive Amid Rising Mideast Tensions,04-30-18
"Earnings Reaction History: Apple, Inc., 50.0% Follow-Through Indicator, 4.4% Sensitive",04-30-19
Apple gains on expectations of record capital allocation program,04-30-18
Glancy Prongay & Murray LLP Announces the Filing of a Securities Class Action on Behalf of Apple Inc. Investors,04-30-19
Analysts and investors make predictions ahead of Apple earnings,04-30-18
Apple Reports Second Quarter Results,04-30-19
Apple declares $0.77 dividend,04-30-19
"Apple beats by $0.10, beats on revenue",04-30-19
"Apple Beats Q2 Street Expectations, Guides Q3 Revenue Above Consensus",04-30-19
