headlines,date
"Bragar Eagel & Squire, P.C. Reminds Investors That Class Action Lawsuits Have Been Filed Against Heron Therapeutics, Box, Cloudera, and Mammoth Energy and Encourages Investors to Contact the Firm",06-26-19
"Lifshitz & Miller LLP Announces Investigation of Ascena Retail Group, Inc., Barnes & Noble, Inc., Cloudera, Inc., Cypress Semiconductor Corporation, Pivotal Software, Inc., Sunlands Technology Group, Tableau Software, Inc., and Zuora, Inc.",06-27-19
"INVESTOR ALERT - Cloudera, Inc. (CLDR) - Bronstein, Gewirtz & Grossman, LLC Announces Class Action and Lead Plaintiff Deadline: August 6, 2019",06-27-19
CLASS ACTION DEADLINE CLOUDERA: Bernstein Liebhard LLP Announces That Approximately 5 Weeks Remain To Make A Motion For Lead Plaintiff In A Securities Class Action Against Cloudera Inc. – CLDR,06-28-19
"Hagens Berman Reminds Cloudera (CLDR) Investors of Lead Plaintiff Deadline, Encourages Investors Who Suffered $50,000+ Losses to Contact the Firm",06-28-19
"TOP RANKED ROSEN LAW FIRM: Announces Filing of Securities Class Action Lawsuit Against Cloudera, Inc. – CLDR",06-29-19
"Today's Research Report Coverage on Application Software Stocks -- Box Inc., Cloudera, Tableau Software, and HubSpot",06-30-17
"SHAREHOLDER ALERT: Pomerantz Law Firm Investigates Claims On Behalf of Investors of Cloudera, Inc. - CLDR",06-30-19
"Pawar Law Group Reminds Investors of Important August 6 Deadline in Securities Class Action Lawsuit Against Cloudera, Inc. – CLDR",07-01-19
"LEAD PLAINTIFF DEADLINE ALERT: Faruqi & Faruqi, LLP Encourages Investors Who Suffered Losses Exceeding $50,000 In Cloudera, Inc. To Contact The Firm",07-01-19
Cloudera and MetiStream Empower Healthcare Organizations to Accelerate Genomic Medicine and Improve Patient Outcomes with Machine Learning,07-02-18
"CLDR DEADLINE: Zhang Investor Law Reminds Investors of August 6 Deadline in Securities Class Action Lawsuit Against Cloudera, Inc. – CLDR",07-02-19
"Bragar Eagel & Squire, P.C. Reminds Investors That Class Action Lawsuits Have Been Filed Against Heron Therapeutics, Box, Cloudera, and Mammoth Energy and Encourages Investors to Contact the Firm",07-02-19
"CLASS ACTION UPDATE for HL, PVTL, CLDR and TEVA: Levi & Korsinsky, LLP Reminds Investors of Class Actions on Behalf of Shareholders",07-03-19
"SHAREHOLDER ALERT: Pomerantz Law Firm Investigates Claims On Behalf of Investors of Cloudera, Inc. - CLDR",07-05-19
This year's tech IPOs struggle to pass listing price,07-05-17
"BOX, CLDR & TUSK - Bronstein, Gewirtz & Grossman, LLC Class Action",07-05-19
Cloudera Empowers YES BANK's Digital Strategy to Deliver Enhanced Business Insights,07-05-17
"LEAD PLAINTIFF DEADLINE ALERT: Faruqi & Faruqi, LLP Encourages Investors Who Suffered Losses Exceeding $50,000 In Cloudera, Inc. To Contact The Firm",07-08-19
"CLASS ACTION REMINDERS for TUSK, RMED, AAC and CLDR: Hagens Berman Reminds Investors of Class Actions on Behalf of Shareholders",07-08-19
"The Klein Law Firm Reminds Investors of Class Actions on Behalf of Shareholders of TUSK, CLDR, PYX and FDX",07-09-19
CLASS ACTION DEADLINE CLOUDERA: Bernstein Liebhard LLP Announces That Approximately 3 Weeks Remain To Make A Motion For Lead Plaintiff In A Securities Class Action Against Cloudera Inc. – CLDR,07-09-19
"SHAREHOLDER ALERT: Pomerantz Law Firm Investigates Claims On Behalf of Investors of Cloudera, Inc. - CLDR",07-11-19
"CLDR INVESTOR ALERT: Hagens Berman Reminds Cloudera (CLDR) Investors of Lead Plaintiff Deadline, Encourages Investors Who Suffered $50,000+ Losses to Contact the Firm",07-11-19
Cloudera Helps Drive Midea's Business Innovation and Achieve Rapid Growth in Revenue,07-11-17
Cloudera Enterprise Suite Selected by China-Based Midea Group,07-12-17
"Zhang Investor Law Reminds Investors of August 6 Deadline in Securities Class Action Lawsuit Against Cloudera, Inc. – CLDR",07-12-19
"Pomerantz Law Firm Announces the Filing of a Class Action against Cloudera, Inc. and Certain Officers – CLDR",07-12-19
"Box, Inc. (NYSE: BOX), Cloudera, Inc. (NYSE: CLDR) & Mammoth Energy Services, Inc. (NASDAQ: TUSK)  - Bronstein, Gewirtz & Grossman, LLC Class Action Update",07-12-19
"TOP RANKED ROSEN LAW FIRM: Reminds Cloudera, Inc. Investors of Important August 6th Deadline in Securities Class Action Lawsuit– CLDR",07-12-19
Cloudera Partners with CyberZ on Cloud Migration Journey to Simplify Big Data,07-12-17
Cloudera and ISID Partner to Build Integrated Platform for Mizuho Americas to Enhance Its Customer Experience,07-16-19
"LEAD PLAINTIFF DEADLINE ALERT: Faruqi & Faruqi, LLP Encourages Investors Who Suffered Losses Exceeding $50,000 In Cloudera, Inc. To Contact The Firm",07-16-19
"Bragar Eagel & Squire, P.C. Reminds Investors That Class Action Lawsuits Have Been Filed Against Heron Therapeutics, Box, Cloudera, and Mammoth Energy and Encourages Investors to Contact the Firm",07-16-19
CLASS ACTION DEADLINE CLOUDERA: Bernstein Liebhard LLP Announces That Approximately 2 Weeks Remain To Make A Motion For Lead Plaintiff In A Securities Class Action Against Cloudera Inc. – CLDR,07-18-19
"SHAREHOLDER ALERT:  Pomerantz Law Firm Reminds Shareholders with Losses on their Investment Cloudera, Inc. of Class Action Lawsuit and Upcoming Deadline – CLDR",07-18-19
Cybraics Builds on Cloudera to Accelerate Artificial Intelligence and Advance Cybersecurity Analytics,07-19-17
"Box, Inc. (NYSE: BOX), Cloudera, Inc. (NYSE: CLDR) & Mammoth Energy Services, Inc. (NASDAQ: TUSK)  - Bronstein, Gewirtz & Grossman, LLC Class Action Update",07-19-19
CredEx Finance Technology Uses Cloudera to Expand and Innovate for the Future,07-19-17
Navistar's IoT Deployment on Cloudera Wins TDWI 2017 Best Practices Award,07-21-17
"Pawar Law Group Reminds Investors of Important August 6 Deadline in Securities Class Action Lawsuit Against Cloudera, Inc. – CLDR",07-22-19
HAGENS BERMAN CLDR NOTICE: Hagens Berman Announces Cloudera (CLDR) Investigation and Lead Plaintiff Deadline,07-22-19
Stifel leaves Cloudera sidelines,07-23-19
"CLASS ACTION UPDATE for CLDR, ASNA, PYX and DBD: Levi & Korsinsky, LLP Reminds Investors of Class Actions on Behalf of Shareholders",07-23-19
"LEAD PLAINTIFF DEADLINE ALERT: Faruqi & Faruqi, LLP Encourages Investors Who Suffered Losses Exceeding $50,000 In Cloudera, Inc. To Contact The Firm",07-23-19
"Rosen, A Leading Law Firm, Reminds Cloudera, Inc. Investors of Important August 6th Deadline in Securities Class Action Lawsuit – CLDR",07-23-19
"Bragar Eagel & Squire, P.C. Reminds Investors That Class Action Lawsuits Have Been Filed Against Box, Beazer Homes, Cloudera, and Mammoth Energy and Encourages Investors to Contact the Firm",07-23-19
Cloudera Enables Digital Transformation for Global Financial Services Institutions,07-24-19
Open Source Innovation Strengthens Cloudera's Cybersecurity Solution and Accelerates Machine Learning at Scale,07-24-17
CLDR CLASS ACTION DEADLINE: Bernstein Liebhard LLP Announces That Approximately 12 Days Remain To Make A Motion For Lead Plaintiff In A Securities Class Action Against Cloudera Inc. – CLDR,07-25-19
"Zhang Investor Law Reminds Investors of August 6 Deadline in Securities Class Action Lawsuit Against Cloudera, Inc. – CLDR",07-25-19
Cloudera Recognized for World Class Customer Service and Support for Third Consecutive Year,07-25-18
"SHAREHOLDER ALERT: Pomerantz Law Firm Reminds Shareholders with Losses on their Investment in Cloudera, Inc. of Class Action Lawsuit and Upcoming Deadline – CLDR",07-25-19
"Box, Inc. (BOX), Cloudera, Inc. (CLDR) & Mammoth Energy Services, Inc. (TUSK) - Bronstein, Gewirtz & Grossman, LLC Class Action",07-26-19
"LEAD PLAINTIFF DEADLINE ALERT: Faruqi & Faruqi, LLP Encourages Investors Who Suffered Losses Exceeding $50,000 In Cloudera, Inc. To Contact The Firm",07-29-19
"ROSEN, A TOP RANKED LAW FIRM, Reminds Cloudera, Inc. Investors of Important August 6th Deadline in Securities Class Action Lawsuit; Encourages Investors with Losses in Excess of $100K to Contact the Firm   – CLDR",07-29-19
"CLDR INVESTOR ALERT: Hagens Berman Reminds Cloudera (CLDR) Investors of August 6, 2019 Deadline; Investors Who Lost $50,000 May Contact the Firm",07-29-19
CLDR CLASS ACTION DEADLINE: Bernstein Liebhard LLP Announces That Approximately 7 Days Remain To Make A Motion For Lead Plaintiff In A Securities Class Action Against Cloudera Inc. – CLDR,07-30-19
"Bragar Eagel & Squire, P.C. Reminds Investors That Class Action Lawsuits Have Been Filed Against Heron Therapeutics, Box, Beazer Homes, and Cloudera and Encourages Investors to Contact the Firm",07-30-19
"SHAREHOLDER ALERT:  Pomerantz Law Firm Reminds Shareholders with Losses on their Investment in Cloudera, Inc. of Class Action Lawsuit and Upcoming Deadline – CLDR",07-31-19
Cloudera Awarded Prestigious Certification for World Class Customer Service and Support for Second Consecutive Year,07-31-17
CLDR 6-DAY DEADLINE: Hagens Berman Reminds Cloudera (CLDR) Investors of August 6th Lead Plaintiff Deadline,07-31-19
"APHA, NTAP, FTNT and FLR among notable after hour movers",08-01-19
"ACB, APHA among premarket gainers",08-02-19
"CLASS ACTION UPDATE for CLDR, ZUO, BUD and INS: Levi & Korsinsky, LLP Reminds Investors of Class Actions on Behalf of Shareholders",08-02-19
"CLASS ACTION UPDATE for CLDR, CTST, OMCL and CARB: Levi & Korsinsky, LLP Reminds Investors of Class Actions on Behalf of Shareholders",08-02-19
Cloudera Rising Friday After Carl Icahn Disclose Large Stake,08-02-19
Sector Update: Tech Stocks Fall Hard In Friday Trading,08-02-19
"DEADLINE ALERT - Cloudera, Inc. (CLDR) - Bronstein, Gewirtz & Grossman, LLC Reminds Shareholders with Over $2 Million of Class Action and Lead Plaintiff Deadline: August 6, 2019",08-05-19
Cloudera Empowers Leading Manufacturing Firms to Rethink Data Management Strategy,08-06-19
"FINAL DEADLINE: Rosen, a Top Ranked Law Firm, Reminds Cloudera, Inc. Investors of Important Deadline Today in Securities Class Action Lawsuit – CLDR",08-06-19
Cloudera Recognized in Gartner Peer Insights Customers' Choice,08-06-18
"Intel adds position in Switch, Carbon Black, and DocuSign",08-07-18
Cloudera Sets Date to Announce Second Quarter Fiscal Year 2018 Results,08-08-17
Cloudera +2.7% after Icahn increases stake,08-08-19
Cloudera Sets Date to Announce Second Quarter Fiscal Year 2019 Results,08-08-18
"Jobrapido Increases Traffic Acquisition, Job Placements and Revenue Using Cloudera for Machine Learning",08-09-17
Cloudera and Carl C. Icahn Announce Agreement,08-12-19
"Cloudera, Icahn reach board deal; CLDR +1.4%",08-12-19
"Cloudera Reaches Agreement With Icahn Group on Board Membership, Composition of CEO Search Committee",08-12-19
"Wall Street Tips Lower Pre-Bell Amid Trade War Worries, Hong Kong Unrest",08-12-19
Cloudera Sets Date to Announce Second Quarter Fiscal Year 2020 Results,08-13-19
New positions at Tiger Global,08-14-17
Cloudera to Participate in Upcoming Financial Conferences,08-15-18
Cloudera to Participate in the 2017 Deutsche Bank Technology Conference,08-15-17
Cloudera Recognized for Cloud-Native Platform-as-a-Service Innovation,08-18-17
Leading Pharmaceutical and Healthcare Organizations Rely on Cloudera to Power Predictive Data Insights,08-20-19
"/C O R R E C T I O N -- Cloudera, Inc./",08-21-19
"Research Report Identifies Cloudera, Snap, Social Reality, BioTime, Renewable Energy Group, and Mattel with Renewed Outlook — Fundamental Analysis, Calculating Forward Movement",08-23-18
"Workday +3.4% after OTR upgrade, Splunk's stellar earnings",08-24-18
Cloudera Leads the Way in Data Warehousing for Hybrid Cloud,08-28-18
Sector Update: Tech Stocks Building on Mid-Day Gains,08-29-18
Cloudera Advances Data Warehousing Leadership,08-29-18
OPTIONS: Straddle Prices for Stocks Expected to Report Quarterly Results Next Week,08-30-19
Stocks to watch next week,09-02-17
Notable earnings after Wednesday’s close,09-03-19
"Earnings Reaction History: CLOUDERA INC, 87.5% Follow-Through Indicator, 19.5% Sensitive",09-04-19
Cloudera Agrees to Acquire Arcadia Data to Accelerate Time-to-Insight for Data Analytics,09-04-19
Cloudera Reports Second Quarter Fiscal Year 2020 Financial Results,09-04-19
"Cloudera EPS beats by $0.08, beats on revenue",09-04-19
Cloudera +6.7% after beat-and-raise,09-04-19
"Cloudera Narrows Per-Share Loss, Beats Revenue Estimates for Fiscal Q2; Acquires Data Analytics Platform Provider",09-04-19
"Cloudera Launches an End-to-End, Open, Modular IoT Architecture with Red Hat and Eurotech to Accelerate IoT Deployments",09-04-18
"Cloudera Starts New Open Source Architecture With Red Hat, Eurotech",09-04-18
Notable earnings after Wednesday’s close,09-04-18
MTNeswires After-Hours News Movers,09-04-18
MT Newswires After-Hours News Movers,09-04-19
"MT Newswires After-Hours Watch List: CLDR, HOME, MNK",09-04-19
"Stock Performance Review on Application Software Industry -- Box Inc., Cloudera, RingCentral, and Cadence Design Systems",09-05-17
JMP bullish after Cloudera earnings,09-05-19
"PANW, EQNR among premarket top gainers",09-05-19
"Analyst Actions: JMP Securities Upgrades Cloudera to Market Outperform From Market Perform, $12 Price Target",09-05-19
"Analyst Actions: JP Morgan Lifts Cloudera PT to $9 From $8, Maintains Neutral Rating",09-05-19
"Analyst Actions: Nomura Lifts Cloudera PT to $10 From $8, Maintains Buy Rating",09-05-19
"Analyst Actions: Citigroup Lifts Cloudera Price Target to $8 From $7.50, Maintains Neutral Rating",09-05-19
"ADPT, CLDR, GIII, LVGO and MDP among midday movers",09-05-19
Sector Update: Tech Stocks Extending Post-Labor Day Rebound,09-05-19
"Earnings Reaction History: CLOUDERA INC, 80.0% Follow-Through Indicator, 14.2% Sensitive",09-05-18
"Amazon, Splunk competitor Elastic files for IPO",09-05-18
"CLDR, ENPH, TEUM and VRNT among tech movers",09-05-19
Sector Update: Chipmakers Carry Tech Stocks to Big Advance,09-05-19
Cloudera Reports Second Quarter Fiscal Year 2019 Financial Results,09-05-18
"Cloudera beats by $0.07, beats on revenue",09-05-18
Close Update: Nasdaq Leads Market Indexes Higher as Hopes for Upcoming Trade Talks Abound,09-05-19
"After Hours Watch List Scorecard: CLDR, HOME, MNK",09-05-19
After Hours Gainers / Losers (09/05/2018),09-05-18
Impact of Artificial Intelligence Innovation Proving to be Monumental Making Dramatic Impact on Global Economy,09-06-18
Stifel raises Cloudera to 53% upside after strong quarter,09-06-18
Premarket Gainers as of 9:05 am (09/06/2018),09-06-18
"Financialbuzz.com: 'Market Recap' Week Ending September 6th, 2019",09-06-19
"Cloudera, MongoDB earnings pull up application software peers",09-06-18
Technology - Top 5 Gainers / Losers as of 3.00 PM (09/06/2018),09-06-18
Notable earnings after Thursday’s close,09-06-17
"Financialinsiders.com Earnings Recap Week Ending September 7th, 2017",09-07-18
Cloudera Reports Second Quarter Fiscal Year 2018 Financial Results,09-07-17
"Cloudera beats by $0.08, beats on revenue",09-07-17
"Cloudera Posts Narrower-than-Estimated Fiscal Q2 Loss, Provides Upbeat Guidance; Shares Gain After-Hours",09-07-17
MT Newswires After-Hours News Movers,09-07-17
Cloudera acquires AI training and consultancy company,09-08-17
Cloudera Delivers Its Most Powerful Machine Learning and Analytics Platform - Cloudera Enterprise 6,09-10-18
"Cloudera +3% target boost, platform launch",09-10-18
Cloudera Announces Fifth Annual Data Impact Awards Finalists,09-11-17
Midday Gainers / Losers,09-11-17
Technology - Top Gainers / Losers as of 2:55 pm,09-11-17
Cloudera Enables Globe Telecom to Manage Mobile Data Growth and Boost Customer Experience with Machine Learning,09-11-17
BTIG starts Cloudera at Buy,09-12-18
Cloudera Joins Open Source Eclipse IoT Community,09-14-17
Cloudera Files Registration Statement for Proposed Follow-on Offering,09-15-17
New Study Proves Current Enterprise Data Strategies Ineffective,09-17-19
Cloudera Files for Secondary Offering,09-18-17
Cloudera down after filing for common stock offering,09-18-17
Cargotec Transforms into a Digital Leader in Intelligent Cargo Handling with Internet of Things (IoT) Platform Powered by Cloudera,09-21-17
Industry's First Enterprise Data Cloud Launched by Cloudera,09-24-19
Cloudera Introduces New Cloud-Native Data Warehousing Service for Cloudera Data Platform,09-24-19
Cloudera Launches New Cloud-Native Machine Learning Service for Cloudera Data Platform to Empower the AI-First Enterprise,09-24-19
"Analyst Actions: Morgan Stanley Lifts Cloudera's Price Target to $9 From $7, Reiterates Equal Weight Rating",09-24-19
Cloudera Expands Machine Learning and Data Warehousing Solutions on Microsoft Azure Marketplace,09-25-18
"Cloudera to Share Latest Platform Innovations in Machine Learning, Analytics and Cloud at Strata Data New York 2017",09-25-17
Cloudera Innovation in Machine Learning and Data Science Recognized,09-25-17
Cloudera Announces Launch of Proposed Follow-on Offering,09-25-17
"Cloudera Plans to Sell 12 Mln Shares, With 9 Mln Of Those Belonging to Shareholders, in Offering",09-25-17
Cloudera announces follow-up offering,09-25-17
MT Newswires After-Hours News Movers,09-25-17
AtScale Partners with Cloudera and Tableau to speed up the deployment of Big Data analytics applications,09-26-17
New Cloudera Foundation Will Use Data Analytics and Machine Learning to Improve People's Lives,09-26-17
"Cloudera Launches SDX, a Shared Data Experience for the Enterprise",09-26-17
Cloudera Announces Winners of Inaugural Partner Impact Awards,09-27-17
Cloudera Announces Winners of Fifth Annual Data Impact Awards,09-27-17
Cloudera Introduces Altus Data Engineering for Microsoft Azure Beta Enabling New Hybrid and Multi-cloud Data Analytic Workflows,09-27-17
Cloudera Appoints Scott Aronson as SVP Worldwide Sales and Services,09-27-18
Cloudera Announces Pricing of Follow-on Offering,09-27-17
Cloudera Prices Follow-On Stock Offering at 0.8% Discount,09-28-17
Leading Businesses Rely on Cloudera for Machine Learning to Drive IoT Innovation,09-28-17
Cloudera Announces Closing of Follow-on Offering and Full Exercise of the Underwriters' Option to Purchase Additional Shares,10-02-17
"SHAREHOLDER ALERT: Levi & Korsinsky, LLP Announces an Investigation Concerning Possible Breaches of Fiduciary Duty by Certain Officers and Directors of Cloudera, Inc.",10-02-17
Cloudera and Hortonworks Announce Merger to Create World’s Leading Next Generation Data Platform and Deliver Industry’s First Enterprise Data Cloud,10-03-18
"Cloudera, Hortonworks to Merge - HDP due off After-Hours Halt at 4:35 pm ET",10-03-18
Cloudera soars on Hortonworks merger,10-03-18
--Hortonworks Resumes Trade - Up 14% on Merger with Cloudera - CLDR up 16% in After-Hours,10-03-18
After Hours Gainers / Losers (10/03/2018),10-03-18
MT Newswires After-Hours News Movers,10-03-18
Sector Update: Tech,10-04-18
Analyst Actions: DA Davidson Upgrades Cloudera to Buy From Neutral,10-04-18
Sector Update: Tech Stocks Declining in Early Trading,10-04-18
Premarket Gainers as of 9:05 am (10/04/2018),10-04-18
"Citi, Cowen out positive on Cloudera-Hortonworks merger",10-04-18
Cloudera's Tie-Up With Hortonworks Sends Shares Rallying as RBC Says Deal Makes 'Strategic Sense',10-04-18
"Analyst Actions: Raymond James Raises Cloudera's Price Target to $24 From $20, Reiterates Outperform Rating",10-04-18
"Analyst Actions: Stifel Nicolaus Lifts Cloudera's Price Target to $25 From $22, Reiterates Buy Rating",10-04-18
Sector Update: Technology Stocks Lower in Thursday Selloff,10-04-18
Technology - Top 5 Gainers / Losers as of 2.55 PM (10/04/2018),10-04-18
Sector Update: Little Late Buying for Tech Stocks Keeps Sector Near Session Lows,10-04-18
US Stocks Sink on Widespread Selloff as Dow Stems Five-Day Rally,10-04-18
Software industry's week topped by Cloudera-Hortonworks merger,10-05-18
"Today's Research Report Coverage on Application Software Stocks -- Zendesk, Box Inc., Cloudera, and RingCentral",10-09-17
Technology - Top 5 Gainers / Losers as of 3.00 PM (10/10/2018),10-10-18
Nutanix Certifies on Cloudera Enterprise,10-10-17
Mizuho initiates Cloudera,10-11-17
Analyst Actions: Mizuho Securities Initiates Coverage on Cloudera With Neutral Rating and $18 PT,10-12-17
Cloudera Announces Strategic Alliance with NEC to Support Acceleration of the Utilization of Big Data,10-16-18
Cloudera and NEC collaborate on big data,10-16-18
Cloudera Enters Strategic Alliance with NEC to Accelerate Big Data Use,10-16-18
Cloudera Unveils Vision for Industrialization of AI at Gartner Symposium ITxpo,10-17-18
"Analysis: Positioning to Benefit within Armstrong World Industries, Cloudera, Cameco, Mistras Group, Cray, and Medical Transcription Billing — Research Highlights Growth, Revenue, and Consolidated Results",10-17-18
Cloudera and Hitachi Ltd. Form Strategic Partnership to Strengthen Adoption and Support of Cloudera Enterprise,10-17-17
Analyst Actions: Wedbush Initiates Coverage of Cloudera With Neutral Rating and $17 Price Target,10-19-18
Stocks to watch next week,10-21-17
Cloudera Speeds Analytics Deployment for Cybersecurity Hub,10-23-17
"Detailed Research: Economic Perspectives on DexCom, Pier 1 Imports, Gilead Sciences, Fitbit, Cloudera, and GoPro – What Drives Growth in Today's Competitive Landscape",10-23-17
MEDIA ADVISORY: Cloudera Hosts Government Forum Denver,10-26-17
"IBM, Red Hat and recent IPOs move on $34B deal",10-29-18
Analyst Actions: Needham & Co Upgrades Cloudera to Strong Buy From Buy; Lifts PT to $31 From $23,11-05-18
Needham adjusts ratings on recent M&A names,11-05-18
Cloudera Data Platform Available on Microsoft Azure,11-06-19
"Cloud stocks soar after Twilio, Tableau smash earnings",11-07-18
Hortonworks +3.5% on Q3 beats ahead of Cloudera merger,11-08-18
Cloudera Sets Date to Announce Third Quarter Fiscal Year 2018 Results,11-09-17
"Analysis: Positioning to Benefit within IDEXX Laboratories, Editas Medicine, Arconic, Cardtronics, Cloudera, and BMC Stock — Research Highlights Growth, Revenue, and Consolidated Results",11-12-18
Cloudera Sets Date to Announce Third Quarter Fiscal Year 2020 Results,11-13-19
Komatsu Helps Improve Mining Performance with Industrial Internet of Things (IIoT) Platform Powered by Cloudera,11-15-17
Cloud stocks drop with tech woes,11-19-18
Cloudera and Hortonworks Announce Termination of Hart-Scott-Rodino Waiting Period for Proposed Merger,11-19-18
Cloudera Sets Date to Announce Third Quarter Fiscal Year 2019 Results,11-20-18
Cloudera Announces Enhanced Partner Program,11-20-19
Cloudera to Participate in Upcoming Financial Conferences,11-20-19
Cloudera partners with Bank Rakyat Indonesia on Data-Driven Journey to Boost Growth and Accelerate Financial Inclusion in Indonesia,11-20-18
Cloudera Enterprise Selected by Bank Rakyat Indonesia,11-21-18
Cloudera to Participate in Upcoming Financial Conference,11-21-18
"SHAREHOLDER ALERT: Levi & Korsinsky, LLP Notifies Investors of an Investigation Regarding Whether the Sale of Hortonworks, Inc. to Cloudera, Inc. is Fair to Shareholders",11-26-18
Cloudera changes the game in cloud-based data warehouses with Cloudera Altus Analytic DB (beta),11-28-17
Cloudera +3.5% as Hedgeye names Best Idea Long,11-28-18
--Analyst Actions: Hedgeye Adds Cloudera to Best Ideas Long List - Stock Up 5%,11-28-18
"Market Trends Toward New Normal in Cloudera, C.R. Bard, Jabil Circuit, Valero Energy, Navient, and Interpace Diagnostics Group — Emerging Consolidated Expectations, Analyst Ratings",11-29-17
"Analyst Actions: Morgan Stanley Lifts Cloudera's Price Target to $11 From $9, Keeps Equal-Weight Rating",12-03-19
Sector Update: Tech Stocks Sinking on Tuesday,12-03-19
Sector Update: Tech Stocks Struggle Tuesday Amid Rising Trade Worries,12-03-19
Notable earnings for Wednesday,12-04-18
Cloudera Announces Preview of Cloud-Native Machine Learning Platform to Accelerate the Industrialization of AI,12-05-18
Cloudera Reports Third Quarter Fiscal Year 2020 Financial Results,12-05-19
"Cloudera EPS beats by $0.03, beats on revenue",12-05-19
Cloudera Reports Third Quarter Fiscal Year 2019 Financial Results,12-05-18
"Cloudera beats by $0.08, beats on revenue",12-05-18
"Cloudera Q3 Bests Estimates, Loss Guidance Smaller vs Views",12-05-18
"Cloudera Q3 Bests Expectations, Guidance Ahead of Street Views - Stock Rises 5.5% After-Hours",12-05-19
Cloudera reports Q3 beats,12-05-18
"Cloudera reports beats, upside revenue forecasts",12-05-19
MT Newswires After-Hours News Movers,12-05-19
"--Analyst Actions: Wedbush Boosts Price Target on Cloudera to $11 From $8.50, Maintains Neutral Rating",12-06-19
"TTD, ULTA among premarket gainers",12-06-19
"Analyst Actions: Deutsche Bank Lifts Cloudera's Price Target to $11 From $8, Reiterates Hold Rating",12-06-19
"Analyst Actions: Morgan Stanley Lifts Cloudera's Price Target to $12 From $11, Keeps Equal-Weight Rating",12-06-19
"Analyst Actions: BofA Merrill Lynch Cuts Lifts Price Target on Cloudera to $8 From $7, Maintains Underperform",12-06-19
"Analyst Actions: DA Davidson Boosts Price Target on Cloudera to $13 From $11, Maintains Buy",12-06-19
"Analyst Actions: JPMorgan Lifts Price Target on Cloudera to $11 From $9, Maintains Neutral",12-06-19
"Analyst Actions: Bernstein Raises Cloudera's Price Target to $10 From $8, Maintains Market Perform Rating",12-06-19
"Analyst Actions: JMP Securities Lifts Cloudera's Price Target to $15 From $12, Maintains Market Outperform Rating",12-06-19
"Analyst Actions: Craig-Hallum Lifts Price Target for Buy-Rated Cloudera to $16 From $14, Maintains Buy Rating",12-06-19
Analyst Actions: Nomura Lifts Price Target for Buy-Rated Cloudera to $11 From $10,12-06-19
"Analyst Actions: Barclays Raises Cloudera's Price Target to $11 From $10, Maintains Equalweight Rating",12-06-19
