headlines,date
"Analyst Actions: Stifel Nicolaus Doubles Cloudera's Price Target to $12 From $6, Maintains Hold Rating",12-06-19
Cloud stocks see green after Cloudera earnings,12-06-18
Notable earnings after Thursday’s close,12-06-17
Cloudera Reports Third Quarter Fiscal Year 2018 Financial Results,12-07-17
"Cloudera beats by $0.07, beats on revenue",12-07-17
"Cloudera Q3 Bests Expectations, Loss Guidance Smaller Than Estimates - Stock Up 5% After-Hours",12-07-17
"Cloudera +4.8% after Q3 beats, upside guidance",12-07-17
After Hours Gainers / Losers,12-07-17
MT Newswires' After-Hours Trading Range Analysis: CLDR,12-07-17
Forecast Report: CLDR,12-07-17
MT Newswires After-Hours News Movers,12-07-17
Premarket Gainers as of 9:05 am,12-08-17
"Analyst Actions: Citigroup Raises Cloudera's Price Target to $10 From $8, Maintains Neutral Rating",12-09-19
Industry Call to Define Universal Open Standards for Machine Learning Operations and Governance,12-11-19
Cloudera Ranked as One of the Fastest Growing Companies in North America on Deloitte's 2017 Technology Fast 500,12-11-17
"MERGER ALERT – HDP and ADPI: Levi & Korsinsky, LLP Reminds Investors of Investigations Concerning the Sale of these Companies",12-11-18
"Report: Developing Opportunities within Pfizer, Bed Bath & Beyond, Vishay Intertechnology, Cloudera, Markel, and QTS Realty Trust — Future Expectations, Projections Moving into 2018",12-12-18
Rakuten Card Modernizes Data Architecture with Cloudera,12-12-17
Cloudera to Participate in Upcoming Financial Conferences,12-13-17
Cloudera to Participate in Upcoming Financial Conference,12-13-18
Drexel Hamilton initiates Cloudera,12-20-17
Cloudera Empowers Bombay Stock Exchange with Real-Time Insights to Reduce Operation Costs by 95%,12-21-18
Cloudera Shareholders Approve Share Issuance of Cloudera Common Stock in Relation to Hortonworks Merger Deal,12-28-18
Cloudera holders approve Hortonworks merger,12-28-18