headlines,date
Cloudera and Hortonworks Complete Planned Merger,01-03-19
Cloudera-Hortonworks merger closes,01-03-19
"Financialinsiders.com: 'Roller Coaster Week' Market News Recap Ending January 4th, 2019",01-04-19
Cloudera to Participate in Upcoming Financial Conference,01-07-20
"Analyst Actions: DA Davidson Lifts Cloudera's Price Target to $14 From $13, Reiterates Buy Rating",01-08-20
Northland starts Cloudera at 30% upside,01-09-19
Analyst Actions: Northland Initiates Cloudera At Outperform,01-09-19
Analyst Actions: Citigroup Upgrades Cloudera to Buy From Neutral,01-10-18
"Cloudera +3.7% on analyst upgrades, price target increases",01-10-18
Analyst Actions: Cloudera Gets Upgrade at Mizuho Securities From Neutral to Buy With $21 Price Target,01-10-18
Update: Analyst Actions: Mizuho Upgrades Cloudera to Buy; PT Set at $21,01-10-18
"How Did Cloudera, Inc. (CLDR) Compare Against Top Hedge Fund Stocks in 2019?",01-11-20
Needham initiates Cloudera at Buy,01-12-18
Analyst Actions: Needham Iniitates Cloudera at Buy; PT Set at $22,01-12-18
Cloudera Appoints Robert Bearden President and Chief Executive Officer,01-13-20
Cloudera appoints Hortonworks founder as CEO,01-13-20
Cloudera Names Hortonworks' Bearden as New CEO; Reaffirms Guidance - Stock Rises Over 3% After-Hours,01-13-20
Cloudera appoints Hortonworks co-founder as new CEO,01-13-20
MT Newswires After-Hours News Movers,01-13-20
"Former Hortonworks, Docker CEO comes back to head up Cloudera",01-13-20
Sector Update: Tech Stocks Edging Higher Tuesday Afternoon,01-14-20
Sector Update: Tech Stocks Sinking Despite Increase for Chipmakers,01-14-20
Cloudera bull sees M&A in CEO hire,01-14-20
Cloudera Wins Two 2018 IoT Breakthrough Awards for Connected Car Innovation,01-17-18
Wells Fargo starts Cloudera at 56% upside,01-22-19
"Analyst Actions: Wells Fargo Starts Cloudera at Outperform, With $20 Price Target",01-22-19
"Firsthand Technology Value Fund Discloses Preliminary NAV of $23.83 Per Share as of December 31, 2017",01-23-18
"Juniper (JNPR) Q4 Earnings Match Estimates, Revenues Rise Y/Y",01-28-20
"Corning (GLW) Q4 Earnings & Revenues Top Estimates, Fall Y/Y",01-29-20
Cloudera helps the Office for National Statistics (ONS) to produce clearer view of the UK economy,02-01-18
Cloudera Appoints Amy O'Connor to Chief Data and Information Officer,02-05-18
Cloudera Promotes Amy O'Connor to Chief Data and Information Officer,02-05-18
"New Research Coverage Highlights Hooker Furniture, Independent Bank, Guaranty, Oasis Petroleum, Fitbit, and Cloudera — Consolidated Revenues, Company Growth, and Expectations for 2018",02-05-18
Cloudera Sets Date to Announce Fourth Quarter Fiscal Year 2020 Results,02-11-20
Cloudera Sets Date to Announce Fourth Quarter and Fiscal Year 2019 Results,02-12-19
Cloudera and Hortonworks Named Among Leaders in Cloud Hadoop/Spark Platforms Report by Independent Research Firm,02-13-19
"Analysis: Positioning to Benefit within Cloudera, Domtar, NextEra Energy Partners, LP, Benefitfocus, Robert Half International, and Bassett Furniture Industries — Research Highlights Growth, Revenue, and Consolidated Results",02-15-19
Cloudera Sets Date to Announce Fourth Quarter and Fiscal Year 2018 Results,02-20-18
Octo Telematics Transforms the Insurance Industry with Cloudera's Machine Learning and Analytics Platform,02-22-18
Cloudera Honored as a Recipient of Navistar International 2017 Diamond Supplier Award,02-27-18
Cloudera Altus Wins 2018 Cloud Award for Innovation,03-01-18
"Cloudera, Inc. (CLDR) May Report Negative Earnings: Know the Trend Ahead of Next Week's Release",03-03-20
Cloudera Introduces the Industry's First Machine Learning and Analytics Platform-as-a-Service Built with a Shared Data Experience (SDX),03-06-18
Cloudera (CLDR) to Report Q4 Earnings: What's in Store?,03-06-20
Cloudera Empowers Enterprises to Turn Complex Data into Actionable Insights,03-06-18
OPTIONS: Straddle Prices for Stocks Expected to Report Quarterly Results This Week,03-09-20
"One Thing To Remember About The Cloudera, Inc. (NYSE:CLDR) Share Price",03-09-20
Cloudera initiated at 5% upside,03-09-18
Notable earnings after Tuesday's close,03-09-20
Cloudera Q4 2020 Earnings Preview,03-09-20
"Benzinga Pro's Top 5 Stocks To Watch For Tues., Mar. 10, 2020: FXI, TSLA, OXY, CORV, CLDR",03-10-20
Cloudera's Q4 Earnings Preview,03-10-20
Cloudera Soars After Turning Surprise Profit in Q4,03-10-20
"Earnings Reaction History: CLOUDERA INC, 90.0% Follow-Through Indicator, 17.9% Sensitive",03-10-20
Cloudera Reports Fourth Quarter and Fiscal Year 2020 Financial Results,03-10-20
"Cloudera EPS beats by $0.07, beats on revenue",03-10-20
"Cloudera Jumps 11% After Q4 Beat, Outlook In Line to Higher; Board Sets Buyback",03-10-20
"Cloudera Sharply Higher On Q4 Sales Beat, Strong Guidance",03-10-20
"Cloudera stock surges 15% after results, outlook top Street view",03-10-20
"Cloudera +15.5% after beats, upside FY outlook",03-10-20
"Cloudera, Inc. (CLDR) Q4 Earnings and Revenues Beat Estimates",03-10-20
"CLDR, DXC, CNDT and CNX among after hours movers",03-10-20
Forecast Report: CLDR,03-10-20
MT Newswires After-Hours Trading Range Analysis: CLDR,03-10-20
MT Newswires After-Hours News Movers,03-10-20
"--Analyst Actions: Wedbush Boosts Price Target on Cloudera to $12 From $11, Maintains Neutral Rating",03-11-20
"Analyst Actions: Barclays Starts Cloudera at Equalweight, With $16 Price Target",03-11-19
Cloudera +2.7% on Equal-Weight start,03-11-19
Cloudera's (CLDR) Q4 Earnings and Revenues Increase Y/Y,03-11-20
"Thinking about buying stock in Cloudera, Cypress Semiconductor, Inovio Pharmaceuticals, T-Mobile, or Verisign?",03-11-20
Cloudera Climbs on 'Impressive' Fourth-Quarter Results,03-11-20
"Cloudera, Like Dropbox, Looks Like a Value Play That Can Deliver Moderate Growth",03-11-20
"Cloudera, Inc. Just Reported Full-Year Earnings: Have Analysts Changed Their Mind On The Stock?",03-12-20
Analyst Actions: Morgan Stanley Resumes Cloudera With Equalweight Rating With $16 Price Target,03-12-19
"Morgan Stanley resumes Cloudera at Equal Weight, sees 11% upside",03-12-19
Cloudera Q4 2019 Earnings Preview,03-12-19
Notable earnings after Wednesday’s close,03-12-19
"Earnings Reaction History: CLOUDERA INC, 83.3% Follow-Through Indicator, 15.9% Sensitive",03-13-19
Cloudera Reports Fourth Quarter and Fiscal Year 2019 Financial Results,03-13-19
"--Cloudera Posts Q4 Loss of $0.15, vs. Street Est. of Loss of $0.07; Revenue at $144.5 Mln, vs. Street View of $209 Mln",03-13-19
"Cloudera misses by $0.08, misses on revenue",03-13-19
Cloudera Reports Q4 Miss; Guides Q1 and FY19 Below Forecasts,03-13-19
"Cloudera -14% on Q4 misses, downside guide",03-13-19
After hours movers and shakers,03-13-19
MT Newswires After-Hours News Movers,03-13-19
MTNewswires' Opening Bell Momentum Stocks: CLDR,03-14-19
"DG, TLRD and CLDR among premarket losers",03-14-19
Wall Street Turns Cautiously Higher Ahead of Opening Bell as Chinese Output Slows; US Jobless Claims Rise,03-14-19
Analysts trim Cloudera targets after earnings,03-14-19
"Analyst Actions: Cloudera's Price Target From Wedbush Cut to $16 From $17, Neutral Rating Maintained",03-14-19
Stock Indexes Slip in Early Trading as Economic Data Weighs on Sentiment,03-14-19
"CLDR, TLRD, MDB and WAGE among midday movers",03-14-19
"Analyst Actions: Cloudera's Price Target Trimmed to $15 at Morgan Stanley, Equalweight Rating Reiterated",03-14-19
Analyst Actions: Needham & Co Reiterates Cloudera Strong Buy Rating; Lowers PT to $28 From $31,03-14-19
Analyst Actions: Cloudera PT Cut to $16 as Wedbush Maintains Neutral Recommendation,03-14-19
Analyst Actions: Deutsche Bank Cuts Price Target for Cloudera to $13; Maintains Hold Rating,03-14-19
Analyst Actions: Stifel Nicolaus Lowers Price Target for Cloudera to $16; Reiterates Buy Rating,03-14-19
MongoDB leads technology gainers; Fusion Connect and Huami among losers,03-14-19
Sector Update: Tech Stocks Hanging On To Slim Advance,03-14-19
"What Makes Cloudera, Inc. (CLDR) a New Buy Stock",03-16-20
Bull of the Day: Cloudera (CLDR),03-18-20
"CLDR, FANG, MSFT, FB and BABA as Zacks Bull and Bear of the Day",03-18-20
"Option-trading opportunities on Boston Scientific Corp., Cloudera Inc., The Walt Disney Co., Fidelity Information Services Inc., and Momo Inc.",03-19-19
Cloudera Congratulates 2019 European Data Heroes Award Winners,03-20-19
"Independent Director Peter Fenton Just Bought Shares In Cloudera, Inc. (NYSE:CLDR)",03-20-20
Mizuho raises Cloudera target to 24% upside,03-20-18
Bad Week Gets Worse as Morning Rally Falters,03-21-20
Zoom (ZM) Looks Good: Stock Adds 5.5% in Session,03-23-20
"Cloudera Investor Alert: Faruqi & Faruqi, LLP Encourages Investors Who Suffered Losses Exceeding $100,000 Investing in Cloudera, Inc. to Contact the Firm",03-24-20
New Strong Buy Stocks for March 25th,03-25-20
Cloudera to Host Investor and Financial Analyst Day,03-26-18
Cloudera Unlocks Opportunity at the Edge Accelerating Enterprise Data Cloud Vision,03-27-19
"Cloudera Investor Alert: Faruqi & Faruqi, LLP Encourages Investors Who Suffered Losses Exceeding $100,000 Investing In Cloudera, Inc. To Contact The Firm",03-27-20
"Hedge Funds Were Selling Cloudera, Inc. (CLDR) Before The Coronavirus",03-27-20
Cloudera Wins Multiple Awards for Cybersecurity Innovation and Leadership,03-28-18
Buy Cloudera ahead of platform release - Rosenblatt,03-28-19
"Cloudera Stock Has Crumbled, but a Director Scooped Up Shares",03-30-20
"CLOUDERA INVESTOR ALERT: Faruqi & Faruqi, LLP Encourages Investors Who Suffered Losses Exceeding $100,000 Investing In Cloudera, Inc. To Contact The Firm",03-30-20
Why You Shouldn't Bet Against Cloudera (CLDR) Stock,04-01-20
"Cloudera Investor Alert: Faruqi & Faruqi, LLP Encourages Investors Who Suffered Losses Exceeding $100,000 Investing In Cloudera, Inc. To Contact The Firm",04-01-20
"Cloudera's Data Platform Empowers LINE to Deliver Secure, Data-Driven Innovation",04-01-20
"Cloudera's Data Platform Empowers LINE to Deliver Secure, Data-Driven Innovation",04-01-20
Inseego (INSG) in Focus: Stock Moves 11.6% Higher,04-02-20
Cloudera to Support LINE's Digital Transformation Journey,04-02-20
Notable earnings after Tuesday’s close,04-02-18
Needham raises Cloudera target to 22% upside ahead of earnings,04-03-18
"Analyst Actions: Needham Raises Cloudera Price Target to $26 from $22, Maintains Buy Rating",04-03-18
Cloudera Reports Fourth Quarter and Fiscal Year 2018 Financial Results,04-03-18
"Cloudera beats by $0.13, beats on revenue",04-03-18
"Cloudera -17% after Q4 beats, mixed guidance",04-03-18
Cloudera Fiscal Q4 Results Beat View; Fiscal Q1 Outlook in Line; FY19 Revenue Below Street View -- Shares Sink,04-03-18
After Hours Gainers / Losers (04/03/2018),04-03-18
Forecast Report: CLDR,04-03-18
MT Newswires' After-Hours Trading Range Analysis: CLDR,04-03-18
MT Newswires After-Hours News Movers,04-03-18
"MT Newswires' After Hours Watch List: AEHR, HCC, PLAY, CLDR",04-03-18
Two analysts downgrade Cloudera after earnings; shares -33.5%,04-04-18
"Cloudera (CLDR) Alert: Johnson Fistel Launches Investigation into the Cloudera Acquisition of Hortonworks, Inc.; Hortonworks Investors Receiving Cloudera Shares Encouraged to Contact Firm",04-04-20
Premarket Losers as of 9:05 am (4/4/2018),04-04-18
Futures Limp Into Open as Trade War With China Escalates,04-04-18
Stock Move: Cloudera Shares Plunge 38% as Q1 and FY19 Guidance Misses Street View,04-04-18
Analyst Actions: Deutsche Bank Downgrades Cloudera to Hold From Buy,04-04-18
Analyst Actions: JP Morgan Downgrades Cloudera to Neutral From Overweight,04-04-18
Midday Gainers / Losers (4/4/2018),04-04-18
Midday Update: Wall Street Reverses Losses as Trade-War Fears Ease,04-04-18
"Cloudera sinks to new low after earnings, more analyst adjustments",04-04-18
Technology - Top 5 Gainers / Losers as of 3:00 PM (04/04/2018),04-04-18
Close Update: Wall Street Rallies Back as Trade War Fears Subside,04-04-18
"After Hours Watch List Scorecard: AEHR, HCC, PLAY, CLDR",04-04-18
Cloudera upgraded on potential revenue growth,04-08-19
Analyst Actions: Bernstein Lifts Cloudera to Outperform From Market Perform,04-08-19
Cloudera and Simudyne Offer Banks Advanced Simulation Solutions for Risk Management,04-09-18
Cloudera helps Zoomlion Accelerate their Industrial Internet of Things (IIoT) and Digital Transformation Journey,04-11-18
"Analyst Actions: Monness, Crespi & Hardt Initiates Coverage on Cloudera With Neutral Rating",04-11-18
Cloudera target raised to 30% upside,04-13-18
"Analyst Actions: Mizuho Securities Lowers Cloudera Price Target to $18 from $23, Retains Buy Rating",04-13-18
"Recent Analysis Shows Urban Outfitters, Depomed, Helios and Matheson Analytics, Keryx Biopharmaceuticals, Cloudera, and Valero Energy Market Influences — Renewed Outlook, Key Drivers of Growth",04-16-18
Indosat Ooredoo calls on Cloudera to reduce capital and operational costs by 46%,04-26-18
"Cloudera Introduces New Business Units to Accelerate Innovation and Leadership in Machine Learning, Analytics, and Cloud",04-26-18
Cloudera forms three new business units,04-26-18
"Cloudera Announces Pricing of Initial Public Offering, Marking its Debut as a Public Company",04-27-17
Cloudera Prices IPO of 15 Mln Shares at $15 Each; to Start Trading on NYSE Under Ticker Symbol CLDR,04-28-17
Cloudera jumps 25% in public debut,04-28-17
Stock Move: Cloudera Shares Rise 25% Above IPO Price in NYSE Debut,04-28-17
Sector Update: Tech Stocks Counter Balance Downward Bias Today,04-28-17
Equities End Weaker After US GDP But April Brings Monthly Gains,04-28-17
Cloudera Announces General Availability of Data Science Workbench to Accelerate Data Science and Machine Learning in the Enterprise,05-01-17
Cloudera Named to CRN's Big Data 100 List for Four Consecutive Years,05-02-17
"Good Guys Win: Apache Spot (Incubating) Team Collaborates on Machine Learning Approach to Cybersecurity, Earns Bronze Edison Award",05-03-17
Cloudera Announces Closing of Initial Public Offering and Full Exercise of the Underwriters' Option to Purchase Additional Shares,05-03-17
Premarket Gainers as of 9:05 am,05-04-17
Cloudera Sets Date to Announce First Quarter Fiscal Year 2019 Results,05-07-18
Cloudera +3.1% as Craig-Hallum starts at Buy,05-07-18
Analyst Actions: Craig-Hallum Starts Coverage of Cloudera with Buy Rating; Shares Up More Than 4%,05-07-18
Close Update: Wall Street Pares Gains as Trump Plans Iran Deal Announcement,05-07-18
Over 100 Leading Healthcare/Life Sciences Organizations Use Cloudera to Improve Patient Outcomes by Integrating Complex Data Sets and Operationalizing Data Insights,05-10-18
Cloudera Sets Date to Announce First Quarter Fiscal Year 2020 Results,05-14-19
Cloudera to Participate in Upcoming Financial Conferences,05-15-18
Cloudera Sets Date to Announce First Quarter Fiscal 2018 Results,05-17-17
Cloudera to Participate in Upcoming Financial Conference,05-21-19
Cloudera Accelerates Enterprise Machine Learning from Research to Production,05-22-18
Kim Hammonds and Mike Stankey Join Cloudera Board of Directors to Broaden Industry Insight and Advise Newly Public Company,05-22-17
Analyst Actions: Wells Fargo Downgrades Cloudera to Market Perform From Outperform,05-23-19
Cloudera -2.6% as Wells Fargo hits sidelines,05-23-19
Cloudera +2.2% as analyst launch neutral-to-strong coverage,05-23-17
"Maxim Group still favors Splunk in big data, reiterating Buy",05-23-17
Cloudera Launches Altus to Simplify Big Data Workloads in the Cloud,05-24-17
"--Analyst Actions: Nomura Cuts Cloudera PT to $14 from $20 Ahead of Q1, Keeps at Buy - Stock Down 2%",05-30-19
Cloudera Named Network Product Guide Best Overall IT Company For Third Consecutive Year,05-31-17
Stocks to watch next week,06-02-17
Cloudera Q1 2020 Earnings Preview,06-04-19
Notable earnings after Wednesday’s close,06-04-19
"Earnings Reaction History: CLOUDERA INC, 85.7% Follow-Through Indicator, 16.4% Sensitive",06-05-19
Cloudera Announces CEO Transition,06-05-19
Cloudera Reports First Quarter Fiscal Year 2020 Financial Results,06-05-19
"Cloudera EPS beats by $0.10, misses on revenue",06-05-19
"Cloudera CEO Reilly to Retire in July, Chairman Named Interim CEO, Firm Posts Mixed Q1, Revenue Guidance Disappoints - Stock Slumps 28% After-Hours",06-05-19
"Cloudera -27% on downside outlook, CEO resignation",06-05-19
Notable earnings after Wednesday’s close,06-05-18
Forecast Report: CLDR,06-05-19
MT Newswires' After-Hours Trading Range Analysis: CLDR,06-05-19
MT Newswires After-Hours News Movers,06-05-19
"MT Newswires After-Hours Watch List: SFIX, CMTL, DSS, CLDR",06-05-19
"Cloudera (CLDR) Alert: Johnson Fistel Launches Investigation into Cloudera, Inc.; Investors Encouraged to Contact Firm",06-05-19
"Cloudera CEO to Retire by End of July, Shares Fall",06-06-19
Cloudera Q1 was a 'thesis changer'- Needham,06-06-19
Analyst Actions: Citigroup Downgrades Cloudera to Neutral From Buy; Price Target is $7.50,06-06-19
Sector Update: Tech,06-06-19
Analyst Actions: Stifel Nicolaus Downgrades Cloudera to Hold From Buy,06-06-19
Analyst Actions: Needham Downgrades Cloudera to Hold From Strong Buy,06-06-19
"--Analyst Actions: Nomura Cuts Cloudera's Price Target to $8 From $14, Reiterates at Buy",06-06-19
Sector Update: Most Tech Heavyweights Climb Pre-Market Thursday,06-06-19
"HOME, CLDR and MIK among premarket losers",06-06-19
"Inside the Market: MS Raises Rating on AMD, Several Firms Cut Outlook on CLDR, Goldman Upgrades UAL",06-06-19
Wall Street Cautiously Higher Ahead of Opening Bell on Rate Cut Hopes,06-06-19
"CIEN, SFIX, HOME and CLDR among midday movers",06-06-19
"Stock Move: Cloudera Slumps 40% as CEO Reilly to Retire in July; Firm Posts Mixed Q1, Revenue Guidance Disappoints",06-06-19
"Sector Update: Tech Stocks Edging Higher, Led by Semiconductor Companies",06-06-19
"Analyst Actions: Wedbush Chops Cloudera PT to $7 After 'Trifecta' of Bad News, Keeps at Neutral - Stock Slumps 41%",06-06-19
Analyst Actions: Cloudera Stock Price Target Halved to $7 From $14 at Barclays,06-06-19
"Earnings Reaction History: CLOUDERA INC, 75.0% Follow-Through Indicator, 16.1% Sensitive",06-06-18
"CIEN, CMTL and CLDR among notable tech movers",06-06-19
"Scott+Scott Attorneys at Law LLP Announces Investigation into Securities Claims Against Cloudera, Inc. (CLDR)",06-06-19
Sector Update: Tech Stocks End Sharply Higher Thursday,06-06-19
Cloudera Reports First Quarter Fiscal Year 2019 Financial Results,06-06-18
"Cloudera beats by $0.01, beats on revenue",06-06-18
Cloudera Reports Q1 Loss a Penny Better Than Expected; Offers Mostly In Line Guidance,06-06-18
Cloudera -6.3% on Q1 beats with weak Q2 guidance,06-06-18
Inova Translational Medicine Institute Partners with Cloudera to Advance Genome-Based Machine Learning Initiatives and Save Lives,06-06-17
MT Newswires After-Hours News Movers,06-06-18
"Lost Money in Cloudera, Inc.?",06-06-19
Internet of Things (IoT) Technology Innovation Lighting The Tech Industry on Fire,06-07-18
Premarket Losers as of 9:05 am (6/7/2018),06-07-18
"SHAREHOLDER ALERT: Levi & Korsinsky, LLP Notifies Investors of an Investigation Involving Possible Securities Fraud Violations by Certain Officers and Directors of Cloudera, Inc.",06-07-19
CLOUDERA (CLDR) INVESTIGATION: Bernstein Liebhard LLP Announces Investigation of Cloudera Inc. - CLDR,06-07-19
"Johnson Fistel, LLP Files Class Action Suit Against Cloudera, Inc.; Class Period Between April 28, 2017 and June 5, 2019",06-07-19
Cloudera Reports First Quarter Fiscal Year 2018 Financial Results,06-08-17
"Cloudera beats by $0.08, beats on revenue",06-08-17
"Cloudera Gains Almost 9% After Q1 Beats Estimates, Outlook Mostly In Line to Better",06-08-17
After Hours Gainers / Losers,06-08-17
Cloudera's first quarterly report since IPO,06-09-17
Premarket Losers as of 9:05 am,06-09-17
Midday Gainers / Losers,06-09-17
Midday Update: Averages Set Record Highs After Event Risk Fades,06-09-17
Technology - Top Gainers / Losers as of 3:00 pm,06-09-17
Analysts weigh in on Cloudera's earnings report; shares down 14.8%,06-09-17
"Close Update: S&P 500, Nasdaq Fall Victim to Tech Sell Off While Dow Reaches Record",06-09-17
"Bragar Eagel & Squire, P.C. Announces That a Class Action Lawsuit Has Been Filed Against Cloudera, Inc. (NYSE: CLDR) and Encourages Cloudera Investors to Contact the Firm",06-09-19
CLOUDERA (CLDR) CLASS ACTION ALERT: Bernstein Liebhard LLP Announces That A Securities Class Action Lawsuit Has Been Filed Against Cloudera Inc. - CLDR,06-10-19
"Gainey McKenna & Egleston Announces A Class Action Lawsuit Has Been Filed Against Cloudera, Inc. (CLDR)",06-10-19
"EQUITY ALERT: Rosen Law Firm Announces Filing of Securities Class Action Lawsuit Against Cloudera, Inc. – CLDR",06-10-19
"Lost Money in Cloudera, Inc.?",06-11-19
"SHAREHOLDER ALERT: Pomerantz Law Firm Investigates Claims On Behalf of Investors of Cloudera, Inc. - CLDR",06-11-19
"ONGOING INVESTIGATION ALERT: The Schall Law Firm Announces it is Investigating Claims Against Cloudera, Inc. and Encourages Investors with Losses in Excess of $100,000 to Contact the Firm",06-11-19
"CLASS ACTION UPDATE for INVVY, EQBK, XENT and CLDR: Levi & Korsinsky, LLP Reminds Investors of Class Actions on Behalf of Shareholders",06-12-19
"Rosen, a Top Ranked Law Firm, Reminds Cloudera, Inc. Investors of Important Deadline in Securities Class Action Lawsuit; Investors with Losses in Excess of $100K are Encouraged to Contact the Firm – CLDR",06-12-19
"CLASS ACTION UPDATE for CLDR, TUSK and RMED: Hagens Berman Alerts Investors to Securities Class Actions and Encourages Investors Who Suffered Losses to Contact the Firm",06-12-19
"The Klein Law Firm Reminds Investors of Class Actions on Behalf of Shareholders of EQBK, AOS, CLDR and PYX",06-13-19
Cloudera Named SD Times 100 Award Winner for Fifth Consecutive Year,06-13-17
"SHAREHOLDER ALERT: Pomerantz Law Firm Investigates Claims On Behalf of Investors of Cloudera, Inc. - CLDR",06-13-19
"Consolidated Research: 2018 Summary Expectations for Encana, Netflix, Veon, The Walt Disney, Gilead Sciences, and Cloudera — Fundamental Analysis, Key Performance Indications",06-14-18
"SHAREHOLDER ALERT: Pawar Law Group Announces a Securities Class Action Lawsuit Against Cloudera, Inc. – CLDR",06-14-19
Cloudera -3.7% on analyst initiation at 23% downside,06-15-18
Analyst Actions: Nomura Initiates Cloudera with Reduce Rating; PT Set at $12,06-15-18
"FILING DEADLINE--Kuznicki Law PLLC Announces Class Actions on Behalf of Shareholders of S, EQBK, CLDR and PYX",06-17-19
"CLASS ACTION UPDATE for MOMO, LTHM, CLDR and ZUO: Levi & Korsinsky, LLP Reminds Investors of Class Actions on Behalf of Shareholders",06-18-19
CLASS ACTION DEADLINE CLOUDERA: Bernstein Liebhard LLP Announces That Approximately 7 Weeks Remain To Make A Motion For Lead Plaintiff In A Securities Class Action Against Cloudera Inc. – CLDR,06-18-19
"CLASS ACTION REMINDERS for CLDR, TUSK and RMED: Hagens Berman Reminds Investors of Class Actions on Behalf of Shareholders",06-18-19
"The Klein Law Firm Reminds Investors of Class Actions on Behalf of Shareholders of EQBK, CBL, CLDR and ZUO",06-19-19
"Safirstein Metcalf LLP Announces That A Class Action Has Been Filed Against Cloudera, Inc. - CLDR",06-19-19
"Deadline Reminder: The Law Offices of Howard G. Smith Reminds Investors of Looming Deadline in the Class Action Lawsuit Against Cloudera, Inc.",06-19-19
"Bragar Eagel & Squire, P.C. Reminds Investors That Class Action Lawsuits Have Been Filed Against Sprint Corporation, Boston Scientific Corporation, Box, Inc. and Cloudera, Inc. and Encourages Investors to Contact the Firm",06-19-19
"The Klein Law Firm Reminds Investors of Class Actions on Behalf of Shareholders of EQBK, CLDR, PYX and ZUO",06-20-19
"SHAREHOLDER ALERT: Pomerantz Law Firm Investigates Claims On Behalf of Investors of Cloudera, Inc. - CLDR",06-20-19
"Federman & Sherwood Announces Filing of Securities Class Action Lawsuit Against Cloudera, Inc.",06-20-19
"Glancy Prongay & Murray Reminds Investors of Looming Deadline in the Class Action Lawsuit Against Cloudera, Inc.",06-20-19
"IBM, Cloudera Announce Strategic Partnership",06-21-19
"SDRL, CLDR among premarket gainers",06-21-19
Market Chatter: Cloudera Signs Strategic Partnership with IBM; Shares Sure 8% Pre-Market,06-21-19
Cloudera +3.5% on IBM tie-up,06-21-19
"International Business Machines, Cloudera Form Strategic Partnership",06-21-19
Sector Update: Tech Stocks Narrowly Lower as Chipmakers Post Steeper Retreat,06-21-19
"INVESTOR ALERT - Cloudera, Inc. (CLDR) - Bronstein, Gewirtz & Grossman, LLC Announces Class Action and Lead Plaintiff Deadline: August 6, 2019",06-21-19
Sector Update: Chipmakers Keep Tech Sector Underwater on Friday,06-21-19
"Pawar Law Group Reminds Investors of Important Deadline in Securities Class Action Lawsuit Against Cloudera, Inc. – CLDR",06-21-19
Cerner and Cloudera Win Ovum's Inaugural IoT Futures Award,06-22-17
"ROSEN, A GLOBALLY RECOGNIZED LAW FIRM: Announces Filing of Securities Class Action Lawsuit Against Cloudera, Inc. - CLDR",06-23-19
Cloudera Recognized as Winner for Microsoft 2018 Partner of the Year,06-25-18
"Zhang Investor Law Reminds Investors of Deadline in Securities Class Action Lawsuit Against Cloudera, Inc. – CLDR",06-25-19
"LEAD PLAINTIFF DEADLINE ALERT: Faruqi & Faruqi, LLP Encourages Investors Who Suffered Losses Exceeding $50,000 In Cloudera, Inc. To Contact The Firm",06-25-19
"LEAD PLAINTIFF DEADLINE ALERT: Faruqi & Faruqi, LLP Encourages Investors Who Suffered Losses Exceeding $50,000 In Cloudera, Inc. To Contact The Firm",06-26-19
